2,"..""special guest"":
villani""pediatra""che ci offre i termini del novo vaccino, prontissimo,anzi:è qua!
#popolobue ostaggio e psichicamente coinvolto nova sindrome #sindromelombardia:registered: 
(l'uso hashtag è subordinato alla donazione spiccioli,in attesa buonipasto)link"
0,"invece di investire i soldi nella ricerca di un vaccino si spendono per verificare se il virus ci sta tra i coglioni. ora, non so se il covid sta proprio lì ma questo spreco di denaro di sicuro mi sta sopra i #testicoli"
2,"riflettevo: quali sono le big che sono al di sopra dei governi, che siano cio in grado di minacciare un qualsiasi paese con pesantissime ripercussioni, compreso il caos?: beh, indovinate chi c' al numero 1? #vaccini link"
1,"coronavirus: coletto, l'università di perugia ha competenze per vaccino link di user"
1,"coronavirus, in russia iniziate le sperimentazioni sul vaccino link"
1,"coronavirus, a fine aprile primi test del vaccino sull’uomo link link"
2,"come per il 2019 anche per il 2020 questo deve essere un monito. affinch non sia ""solo una questione di punturina""... link"
2,"#vaccini se ne sono accorti anche in kenya. pi casi di polio causati dal vaccino che dal virus. da the nation di oggi. user link"
1,"user user avremo prima vaccino o immunità di gregge?certo se non si va in giro l'immunità non arriverà mai.xtanto ci saranno paesi che avranno immunità di gregge prima di altri costringendo gli altri a chiudere le frontiere. lockdown arma doppio taglio serve x nn riempire le rianimazioni"
2,"(io come cavie per provare il vaccino userei quelli che vogliono uscire di casa a tutti i costi)"
1,"user trovare una cura per guarire una volta infetti,  quale vantaggio porterebbe rispetto ad un vaccino?"
1,"user appunto parlo di comunicazione fatta a cazzo... parlassero si sperimentazione, di risultati positivi per gli agenti...parlano di vaccino come fosse sprite, poi la gente pensa che è pronto il vaccino....aricome cazzo si fa?!"
0,"user user secondo me i novax sono da cercare fra chi non vaccina i figli... vedrai che gli over 65 non faranno storie, sia perché si ricordano quando ancora vi era la polio, sia perché sanno che se si aggravano ci lasciano le penne"
1,"coronavirus, professor de donno: ""plasma unico farmaco, è molto più potente di un vaccino"". e difende ricciardi da attacchi politici - il fatto quotidiano link"
0,"coronavirus, dalla cina primi successi per il vaccino link"
2,"#coronavirus, il terrore continuera' finche' non arrivera' il ""#vaccino miracoloso"". tanto i decessi da strumentalizzare non mancano... link"
2,"user il rischio di una dittatura è altissimo infatti. quello di questa scemenza di virus ""pandemico"" fa ridere. e il vaccino non serve a niente. se lo facciano i beoti che credono ancora alle balle di questo governo di farabutti e dei suoi ""esperti"" prezzolati."
0,"user ormai il collasso cè che cazzo vogliono? sappiamo che fino a quando non c’è un vaccino sarà sempre a rischio.. quindi che schiantano tutti"
1,"la rivista vaccines ha appena pubblicato un lavoro di ricercatori delluniversit di bari e della regione puglia, dove riportano, i principali risultati del famoso report dellosservatorio epidem. pugliese del 2018 sul vaccino morbillo-parotite-rosolia-varicella (mprv). segue link"
0,"user nel senso che infierire non è nella mia natura.

dato che non è medico, sul web troverà qualcosa sulla fake della ruggine.

e magari scoprirà pure che i novax sono solo un mezzo per taluni di ottenere cuoricini a prezzo di saldo. 

ma non vorrei farla pensare troppo."
0,"user_vigliero i no vax e la mamma"
2,"i danneggiati da vaccino sono troppi! ll dato riportato  una stima per difetto; mancano infatti coloro che, pur riconosciuti danneggiati, non sono stati indennizzati perch le relative istanze sono state presentate in modo intempestivo. link"
0,"per ogni discussione con no-vax, complottari e affini, da tenere in mente sempre la linea guida:
""sai cosa vedono le persone quando discuti con un imbecille? due imbecilli"""
0,"user user user user vedo che cogli il tuo problema almeno.
già, su internet ognuno spara cazzate in libertà.
tipo voi novax. dopo 2 pagine di blog e 10 min di video su youtube pensate di sapere tutto.
invece avete appreso cazzate e bugie.
ao, bella per voi. contento tu contenti tutti.
hasta nunca."
0,"coronavirus, rixi (lega), ""giusto mantenere chiusura totale: serve pianificazione su stili di vita e attività economiche fino a vaccino"" link link"
2,"user, pence , u.s.a.: vaccino pronto a fine estate. ma che &lt;&lt; combinazione &lt;&lt;&lt; link"
1,"vaccino covid-19, speranza: “firmato contratto insieme a francia, germania e olanda"" link"
2,"c' un bambino in terapia intensiva a causa di febbre e convulsioni dopo il vaccino mprv ma nessuno ne parla. come mai? #vaccini link"
1,"user hanno ricevuto il nulla osta da bruxelles a lasciare tutto aperto.
il progetto inizialmente era l'attacco biologico alla cina ma dai vertici è arrivato l'ordine di scremare la popolazione mondiale. siamo decisamente troppi 7 miliardi. il vaccino c'è ma è solo per gli eletti."
2,"user user user user voi quanto siete affidabili ?

link link"
0,"user è un casino così, ok che abbiamo da ieri contagi zero come città, però alcun tipo di vaccino ancora... boh sono perplesso."
2,"user user credo anche la terza ondata con la decimazione della popolazione il blocco sino a marzo 2021 e con l'avviso che se avrebbero fatto il vacino non ci sarebbero stati tutti questi morti. il vaccino uccide il doppio della museruola"
2,"user detto a un antifascista dopo che il fascismo è morto da 70 e passa anni è il top. inoltre sappi che mezza europa è no vax, proprio quella che tu sostieni. genio"
0,"user_hopppe1 user corretto e giusto. chi si oppone al progresso sono gli stessi che bruciavano i telai e che prima hanno invocato che i vaccini fanno diventare spastici, e che ora trepidano per il vaccino anticovid"
2,"user user user io vivo normalmente senza il vaccino, mi disturba che vogliono costringermi a vaccinarmi, solo business,troppi interessi,poca sperimentazione,troppa fretta,troppo denaro"
1,"user il medico deve valutare caso per caso. ma se una persona ha il sistema immunitario compromesso o a causa di una malattia o perché è sottoposto ad una terapia immunosoppresiva, la vaccinazione potrebbe scatenare un reazione deleteria da parte dell'organismo"
0,"user user user allora bisogna stare reclusi in casa da soli per più di un anno? (tempo stimato per la messa in circolazione del vaccino). il virus c'è e resterà non se ne va se restiamo in casa!"
2,"user user mi sembra inutile sperare nel vaccino , perché quando il vaccino sarà pronto ,il virus sarà già mutato ."
0,"un medico no vax non è un medico."
0,"annunciati oggi i primi risultati promettenti di un candidato vaccino covid 19 link"
1,"user #salvini dovevano dare il chinino a tutti 1 mese fa, link invece si attende un vaccino chissà quando."
2,"user_sn studio americano: fra i vaccinati per l'influenza +36% di covid19 in forma grave
link"
0,"user_official beh ci vorrà ancora molto tempo che quando uscirà il vaccino dobbiamo stare tranquilli cauti e prudenti"
2,"user spero che il vaccino ti faccia male, matteo- e non ciarlare di politica: hai a cuore solo i tuoi interessi e quelli di pochi privilegiati-"
1,"conte: “allo studio piano per riaperture omogenee. mascherine e distanziamento fino al vaccino. la app…” link link"
0,"coronavirus, l`ultimo delirio dei no-vax: `il vaccino? rischia di fare danni` - link link"
0,"#morbillo. continua lalert dell#oms: nel 2018 ha provocato oltre 140.000 morti. unica arma: il #vaccino. in #italia casi in diminuzione ma nei giovani adulticopertura  scarsa #sanit link di user"
2,"lascienza vuole far passare un ""abominio"" come una cosa ""figa"".  il vaccino sotto pelle, che tiene traccia della storia vaccinale, non  solo una violenta violazione alla dignit umana, ma anche una pericolosa pratica medica, in quanto priva di test.  link"
1,"user user user user @_branzo_ user_oc quindi secondo lei notrack == novax?

perché se si cala un po' il livello del dibattito"
2," user: il vaccino contro la malattia non esiste ancora, quindi per partire � obbligatorio farne un altro.  sulla televisione d�"
1,"coronavirus, parla lo scienziato barese «così abbiamo scoperto il vaccino»
gambotto dagli usa: ci vorrà un anno, poi sarà come l'influenza link"
0,"user user user user mi sono spiegato? 
la mia domanda è semplice: lockdown fino al vaccino? 
o è il caso di progettare un futuro prossimo?"
2,"""la vaccinazione dtp era associata ad una mortalit 5 volte superiore rispetto alla non vaccinazione... tutte le prove attualmente disponibili suggeriscono che il vaccino dtp pu uccidere pi bambini di quanti ne risparmi da difterite, tetano o pertosse""  link"
1,"user non è miseria, è m...a umana,  quale è il senso del tentativo?  immagino che nel momento che verrà individuato e testato il vaccino tutte le aziende farmaceutiche, in tutti i paesi, si dovranno rendere disoonibili a produrlo pagando le royalties a chi lo avrà scoperto."
1,"coronavirus, rezza di malattie infettive: ""per il vaccino ci vuole un anno, siamo pronti ma poi bisognerà provarlo"". quindi la rivelazione shock:""difficile dire quando ci sarà il picco.e' plausibile che il virus sia entrato nel lodigiano ancora prima del blocco dei voli da wuhan"" link"
0,"user perfetto così tra plasma e nuovo vaccino, forse riusciremo a vincere il covid 19 in termini di cura e prevenzione."
0,"user da quando siamo nati tutti abbiamo fatto almeno un link miei tempi si vaceva alle elementari quello con i 4 buchi e poi chi ha fatto il militare si ricorda la puntura sul petto? comunque  il perché siamo rimasti tutti in casa e usiamo la mascherina?"
1,"io voglio un’alternativa allo “state a casa” non perché stia male ma perché non può essere la cura al #covid19 nel lungo periodo, in attesa che un vaccino pronto fra 18 mesi (o forse mai come per altri virus) faccia la sua comparsa."
2,"user non ha una bella cera il caro e vecchio bill!

ne vedremo delle belle con questo vaccino della vergogna!

appuntamento in tribunale!"
2,"se sono sicuri,perch chiedere l'immunit?  fatevi una #domanda    s da un'epidemia hanno solo da guadagnare e nulla da perdere ,cosa succeder? link"
2,"errata corrige: l'amica che mi ha passato il servizio mi fa presente che � del 2013...ovvero di un tempo quando parlare dei danni da vaccino era ancora consentito!"
2,"#ebola il vaccino  pronto ed  certificato efficace al 100%.  ora ci manca solo che si scateni un'epidemia in #europa.  scommettiamo che succeder a breve?  link"
1,"coronavirus, la deputata no vax fermata a ostia: “vaccinarmi contro il covid-19? perché dovrei?” link link"
0,"user user user qualora fosse vero dovrebbero darci un vaccino(sempre se esiste), altrimenti dobbiamo comunque continuare a combatterlo come stiamo facendo. i processi avrebbero vita a sè stante"
2,"zingaretti: 'la mascherina diventi la moda dell'estate, la metteremo fino al vaccino' link via user  maledetti"
2,"link altro giro, altra corsa...muore bimba di due anni e mezzo nel sonno! loro la chiamano morte in culla...io invece omicidio causato da vaccino esavalente..."
2,"user e il vaccino c'è l'hanno in caso qualcosa o qualcuno di loro dovesse succedergli qualcosa"
0,"user user user_nei non diciamo stupidaggini. renzi propone riapertura in sicurezza. posto che senza vaccino l'epidemia covid durerà più di un anno, lei che propone, chiudere il paese e i suoi 60 ml di abitanti in casa per tutto il tempo? con quali soldi?
ragionateci un attimo."
1,"user sì ho letto anch'io. teoria sbagliata però: quel vaccino non viene fatto ai bambini italiani (anche perché funziona poco ed è in disuso)"
2,"oggi in tv la glaxo pubblicizzava il vaccino per la meningite b affermando che gli altri vaccini per la meningite non fanno un gran che.....se prima mi facevano schifo ora gli darei fuoco....(cit.)"
0,"user user si può e si deve se,a livello sanitario,si ritiene che sia indispensabile. non si sta parlando di un vaccino antinfluenzale."
2,"#vaccini   ricordo che l'ex ministro della salute user, col cazzo che si  vaccinata in #gravidanza...  ora mettetevi ordinatamente in coda  pecoroneeeeee....  ????????  link link"
1,"per trovare un vaccino contro il coronavirus serve un nuovo “progetto manhattan” link"
0,"riflessione triste: questa settimana 639.000 casi di influenza, dall�inizio della stagione sono pi� di 3.500.000, prevenibili con una vaccinazione che costa pochi euro e che e� gratuita per gli ultra65enni e per i soggetti a rischio ma che pochi fanno"
1,"user_ph user_r6 user_fr se non avessero importato senza alcuna precauzione tanti immigrati dalla fascia della meningite del sahel non sarebbe stata necessaria la vaccinazione contro la meningite perché questo ceppo in italia non esisteva. se cerchiamo le cause cerchiamole a 360 gradi."
2,"user avete rotto con sto vaccino"
0,"user user e tu lo sai quante varianti dello stesso virus esistono in giro ogni stagione? non credi nella validità dei vaccini? cazzi tuoi. noi abbiamo eradicato malattie come ebola, poliomielite nel secolo scorso con loro, e errrrrradikeremo anche il corlonavairus con un vaccino."
1,"coronavirus, farmindustria: ""un giorno per produrre farmaco, per vaccino mesi"" link"
0,"la scienza si prende la rivincita sui #novax. è forse iniziata la campagna d'informazione o di disinformazione, da parte dei #pennivendoli e dei #rotolidistampaigienica, per spingere la gente nelle braccia delle case farmaceutiche. #vaccino link via user"
0,"user speriamo riescano ad approntare al più presto il vaccino"
1,"azienda usa produce il primo vaccino sperimentale contro il coronavirus link"
0,"user user_stordita normale, senza vaccino, è impossibile"
0,"user user user user lei é un grande,con i suoi libri mi ha fornito tutte le argomentazioni da sciorinare ai tanti ignoranti no vax.continui cosí,tantissimi italiani le sono grati per quello che fa.poi ci sono gli inetti a cui le persone competenti come lei danno solo fastidio."
0,"user 1 stiamo a casa per 2, 3, 4 anni? bocciata.
2 la vita normale? senza protezioni non è più possibile. bocciata!
quindi torniamo alla vita, che non sarà più normale fino alla scoperta del vaccino. e questa è la 3."
1,"user user_the_teacher ma infatti. questi vecchi con un piede nella fossa vogliono pure campare, mo'...lasciamoli crepare di coronavirus, per il quale (a differenza dell'influenza) non esiste ancora vaccino."
0,"ai complottisti, ai #novax, a chi “ è colpa di #bigpharma “ etc etc............ ma andate a cacare.
#tocilizumab #13marzo #coronavirus #covid_19 #spallanzani"
2,"se combatterete per la vera chiesa cattolica contro l’impostura luterana massonica di bergoglio in accordo con il piano massonico della falsa pandemia covid-19, come pretesto per codificarvi con il falso vaccino vincerete perché cristo sarà con voi! link link"
1,"user ad avere mentito sono coloro che per un pomeriggio hanno fatto credere agli italiani che un servizio del 2015 sulle sperimentazioni per un vaccino sul coronavirus è stato spacciato per un servizio che parlava di covid19. bufala e ""scemenza"" secondo burioni link"
2,"che il tuo vate si pronunci, o sommo vaccino, e ci liberi dalla tenebra...???? link"
1,"il governo usa voleva garantirsi l'esclusiva di un vaccino anti-#sarscov2 che la tedesca #curevac sta sviluppando, sarebbe pronto a giugno: ricerca finanz. dal gov. tedesco (+ #billgates) nel fondo cepi di 140 mio �. ora l'azienda ha rifiutato l""offerta"" di #trump. segue"
0,"user bellissimo! ma lo risentiremo quando avremo il vaccino per #covid19 .
il #calcio  non è priorità finché muoiono ogni giorno dalle 400 alle 500 persone al giorno"
2,"user user naturalmente non poteva mancare la raccomandazione finale: vaccinazione di massa."
0,"user user non entro a scuola da un mese, da noi c'è spazio in abbondanza, ci sono anche varie aule vuote. la situazione non é uguale ovunque e la verità non ha un unico depositario.
rifaccio la domanda: se é un problema di strutture non ripartiremo più fino al vaccino?"
0,"user professore, ma discutere con travaglio è ancora meno utile di un dibattito con una banda di novax
lo lasci al suo delirio di onnipotenza"
2,"meraviglia! ora persino beppe grillo si concede uno spot a sostegno del vaccino contro il papilloma virus umano. ma facciamo pure finta che anni fa ne condannava l'uso indiscriminato... link"
0,"stamattina nella sala colazioni di un agriturismo nel padovano ho appreso “con certezza” che dietro il #coronavirus c’è bill gates che possiede 5 case farmaceutiche che ora svilupperanno il vaccino e sai che soldi, altro che microsoft. ora chiamo i miei direttori e sai che scoop."
0,"che tenero l'ex capo politico del movimento no-vax e si-scie chimiche che dice che bisogna fidarsi della scienza #ottoemezzo"
1,"“vaccino obbligatorio per over 65 anni”così zingaretti. sei d'accordo? forum link"
1,"accesso universale al vaccino: sirchia propone francesco come garante link"
1,"user user avete trovato il vaccino? no, perché ci sarebbe una pandemia di un virus molto pericoloso e senza cura né vaccino"
0,"a brescia c'� la corsa al vaccino, dopo la morte di una donna per meningite. in pratica sono tutti no-vax finch� no si cagano addosso dalla  paura!"
0,"user_grillo adesso vuoi un bel vaccino? ma dai? senza vergogna!"
0,"il vaccino non  un opinione. internet oggi  terra di nessuno. situazione molto pericolosa se lignoranza si unisce allarroganza user ora al convegno i costi dell #antiscienza  sui danni della disinformazione scientifica, organizzato da user #28novembre link"
2,"link abbiamo parlato spesso della correlazione tra morte in culla e vaccino esavalente. riporto a tal proposito un interessante articolo del 2014, dove si rilevava la necessit di uno studio in merito...a tale data era ancora concesso avere dubbi!"
0,"user prima o poi bisognerà dare qualche piccola libertà alle persone, non possiamo restare chiusi in casa fino a che non si trova un vaccino (anche perché si parla di parecchi mesi)"
0,"su #vaccine ""email-based reminders to increase vaccine uptake: a systematic review."" un paper sullutilizzo delle nuove tecnologie per aumentare le coperture vaccinali di: b frascella, user, user, user, user, user link link"
0,"user user grazie per la dritta che quando serve un vaccino, chi ci guadagna è chi produce il vaccino, cioè le case farmaceutiche.
e io che ho sempre pensato che a produrre i vaccini fosse la centrale del latte.

ps penso al tuo stipendio con tanta gente che ora è in difficoltà e mi incazzo"
2,"studio del 2012: #vaccini #antinfluenzali trivalenti inattivati aumentano le infezioni virali non influenzali di 4,4 volte. link"
0,"e se l'app di tracciamento #immuni ti desse la priorita' nel ricevere le cure/vaccino, la installeresti? 
nota: priorita' rispetto ad una persona che ha il tuo quadro clinico. la priorita' e' data dal fatto che si sa come ti sei comportato."
0,"user_gattaccio user_angela user fino a quando? spero poche settimane ancora. il mondo è cambiato, non ci saranno mai più stadi pieni, concerti pieni, locali pieni, non ci dovranno essere.
i miei sono anziani, dovrò stare attento con loro finché campano.
guanti e maschere temo fino al vaccino."
1,""" isolato il #coronavirus, la virologa dello spallanzani: 
“vi racconto cosa significa e come procederemo adesso per il #vaccino”
paolo russo link via user"
2,"il virologo giulio tarro all'antidiplomatico : ""una follia aspettare il vaccino per tornare ad una vita normale"" link"
1,"welt am sonntag: donald trump ha cercato di avere il vaccino anti-coronavirus in esclusiva per gli stati uniti link"
0,"pensierino della notte
la scienza medica ed epidemiologica, epidemiologi del calibro di larry brilliant, insegnano che in assenza di vaccino, senza tt non si risolve una pandemia
ne usciremo se non si ascoltano false narrazioni strumentali, ma a chi vero esperto in pandemie
notte link"
0,"9. andr� tutto bene, passer� tutto in giro di qualche mese, andando sempre pi� a scemare. magari domani trovano una cura mirata! magari tra una settimana abbiamo il vaccino! non � come l'ebola, non � come la peste, non � un morbo incurabile. +"
2,"l'immagine che ho allegato al presente tweet � un post pubblicato su fb da barbara nardella, la nonna del piccolo samuel, la quale scrive che � stata effettuata una seconda autopsia sul corpo del piccolo, dalla quale � emerso che � morto a causa di un vaccino ... segue"
1,"buonasera, oggi all  conferenza stampa della protezione civile, parlavano di un vaccino quasi imminente.. potrebbe avere relazioni con questo medicinale. interessante anche la teoria sulla morte dei piu' giovani user link"
1,"vaccini, rissa sfiorata tra no vax e m5s: ""e mi chiami onorevole..."" link di user"
2,"user certo glielo ordina gates... sssss parla piano... devono dare il vaccino... quel pirla di conte gli ha dato anche 170 ml €..."
0,"user_07 user certo sembrerebbe essere questo lo scenario. ma nessuno ha la palla di vetro per poter avere un'idea chiara del futuro anche se, e questo pare evidente , molti dovranno rinunciare al vecchio lavoro e adeguarsi ai nuovi tempi. me compreso. fino al vaccino quantomeno."
1,"state sereni il #vaccino non si fara' prima di 2 anni"
1,"vaccino, al via i test: prime dosi a settembre   link"
2,"tratto dal discorso di #henrykissinger al user il 25.02.09. 
si nota una certa somiglianza con gli intendimenti di user /#rockefeller , che ne è l'erede intellettuale...
ora, sotto coi #vaccini..!
#covidー19 
#coronavirus 
#covid19 
#novax link"
2,"user user il vaccino uccide molto di più del virus, ma ti consiglio di farlo subito!
almeno ti togli dai coglioni"
0,"covid19, “gli anticorpi funzionano”. le ultime novità dal vaccino made in italy - secolo trentino link"
0,"dobbiamo pregare per dei farmaci efficaci,in attesa del vaccino #dimartedi"
1,"user user il vaccino per l'influenza stagionale contiene in parte ceppi virali dell'anno precedente più alcuni ceppi che ""potrebbero"" essere diffusi nell'anno in corso. il vaccino anti influenzale si basa quindi sia su virus pre-esistenti, sia su proiezioni. in questo caso si parte da 0."
1,"primo studio sull’uomo del vaccino covid-19. link"
2,"user salvini chiami tarro in tv e finiamola con questa farsa
avanti. vogliono vendere vaccino che non può funzionare contro questo virus.
chiami tarro e fate uno show in streaming.
forse dell'ordine stanno delirando....elicotteri x scovare gente che prende il sole quando fino"
2,"user loro mica hanno i problemi della sanità italiana dovuta a tagli scellerati ...a causa dei quali a noi toccano gli arresti domiciliari e il vaccino non testato..."
0,"user_____1 user_ronchetti user penso intendesse sul totale delle malattie. sono moltissime quelle senza un vaccino. attenzione, non si sta dicendo che siano inutili e non vadano fatti."
1,"covid-19: cosa succederebbe se il vaccino non uscisse mai? link"
2,"link era il 2010 e ancora si poteva parlare di danni provocati dai vaccini: in un anno 396 vittime causate dall'antinfluenzale!"
2,"l'ue che ci ama e ci protegge ha gi approvato il vaccino (con virus dell'ebola vivo). a quando il ""diritto"" di essere vaccinati tutti? #italexit #uscita #exit link"
0,"user la speranza è che sarà pronto il vaccino nel giro di 2/3mesi"
1,"covid_19: un vaccino uguale per tutti, in tutti i paesi link"
1,"vaccino pomezia-oxford, la gran bretagna prenota 30 milioni di dosi link"
0,"user la parola chiave è ""sospendere"". non sappiamo i tempi: smetterà da sola, sarà necessario attendere produzione vaccino e vaccinazione di massa o che? alla fine qui siamo in ballo da due settimane scarse. ora giusto stare spostati sul lato ""non vita"" (o vita con prudenza). poi boh."
2,"il neocolonialismo dei medici francesi che vorrebbero sperimentare il vaccino contro il coronavirus in africa - #neocolonialismo #medici #francesi link link"
0,"user nei commenti un'intera platea di fasci, bandierinati e no vax. merda a perdita d'occhio."
0,"user_gaspari stiamo a casa fino a chi gli infetti saranno in numero sufficientemente basso da non essere problema, credo.

poi partirà una fase di ""libertà vigilata"" con tracking su base volontaria, per individuare subito possibili nuovi malati e isolarsi subito.

poi un vaccino..speriamo"
0,"user purtroppo ormai più o meno tutti sono concordi: fino al vaccino si può solo tamponare"
1,"virus, l'epidemiologo lopalco: «vaccino, 118 prototipi. oxford, usa e cina in testa» link"
1,"virus e vaccino in usa proposti test infettando volontari | mondo link"
0,"influenza, vaccino raccomandato e gratis per bimbi e over 60. ministero: «anticipare a ottobre» - il link link"
0,"user user non ci sono contagiati perché siamo tutti in casa al sicuro. se dovessimo uscire tornerebbero i morti alle stelle. ancora non c'è sicurezza. ancora non c'è un vaccino."
2,"user rassista, fassista, nazista, a voi interessa la tutela della salute pubblica o le lobby del vaccino? mi sa che è la seconda opzione."
2,"user bolgan: negli over 65 la vaccinazione causa più complicanze e decessi.
link"
2,"""morte in culla signori...ditelo a tutti""  mah.... veramente la seconda autopsia incrimina il vaccino!  ""ah s?"".... ????????????????????  vi auguro di morire malissimo  link"
1,"i fantastilioni di dosi di vaccino pronti a settembre sono solo accordi per avviare una produzione nel caso il vaccino dovesse essere efficace e sicuro.  e poi dicono che sono gli scienziati a creare confusione #covid_19 #vaccino link"
0,"user :red_heart: se è tosto come mamma, appena nasce trova il vaccino. bacio a tutti e due, bella"
1,"al tg1 si sono rotti così tanto i coglioni di allungare il brodo che ora il vaccino lo trovano loro. link"
