0,"vaccino fatto..  adesso una bella passeggiata zona zattere... link"
0,"user caro ministro, ci sarete di sicuro già arrivati voi,ma non sarebbe il caso di verificare se i deceduti di covid19 avessero fatto o non,il vaccino influenzale?e calcolarne la percentuale? giusto per sapere se il vaccino attuale avesse anche un minimo di deterrenza?"
2,"intanto gsk e ""una speciale unit dellesercito statunitense in kenya"" starebbero ""eseguendo decine di migliaia di test su bambini e neonati in alcuni dei villaggi pi poveri del continente africano"" per sperimentare il #vaccino #antimalaria. link"
1,"vaccino si o vaccino no nei pazienti oncologici?  #vaccino #influenza #tumori #oncologia link"
2,"user user lo dice anche quest'altro studio, che chi fa il vaccino influenzale, aumenta il rischio di prendere il contagio da altri virus, incluso il coronavirus, dai 4 alle 5 volte.  link link"
1,"coronavirus: il vaccino arriverà, la seconda ondata no. ecco la sentenza di ilaria capua &amp;raquo; link link"
2,"massimo mazzucco, ci avverte. non fate il vaccino quando uscira`. link via user"
0,"user ma come si fa a pensare che basti questo? i ragazzi sono sempre vicini vicini, riaprire le scuole con virus in giro e senza vaccino vuol dire strage"
1,"#coronavirus 
ma l'avrò fatta la vaccinazione ?? link"
0,"anche voi quando partono i complotti sulle nanotecnologie attivabili in seguito al vaccino antikovid!!!# iniziate a grattarvi il cuoio capelluto come giucas link"
1,"la disinformazione in azione #tg4 isolato il virus ora sara' possibile ricercare una cura. no, non si chiama cura perche' non si cura sta cosa, si chiama #vaccino e serve a prevenirne la diffusione #coronarivus #disinformation"
0,"user_keno0 user il risultato è che così perdono credibilità  e autorevolezza e in un paese di novax e complottisti è rischioso. vanificano anche il lavoro di tanti ricercatori e medici che si fanno il mazzo non apparendo in tv"
0,"user user_ozymandias perché i vaccini prevedono malattie note.

la quarantena è una dei modi per limitare il contagio in assenza di vaccino.

il vaccino permette di limitare il contagio senza limitare lo spostamento della gente.

non è difficile come concetto..."
0,"per sviluppare un candidato vaccino #covid19 dobbiamo contare sulla forza e il supporto degli altri.

e proprio quando la distanza sociale ci mette di fronte a nuove sfide, condividiamo i nostri progressi per accelerare la corsa verso il #vaccino

#janssenatourbest #wewontrest link"
1,"coronavirus, de donno:‘abbiamo il farmaco,il plasma è più potente del vaccino’ link"
0,"#italiani tranquilli gli #americani vi salveranno #coronavirus e #vaccino , azienda #usa annuncia sperimentazione entro #aprile #italia #covid19italia - il sole 24 ore link"
1,"vaccino – ‘chadox1 ncov-19’ ecco il siero italo-inglese: da settembre i test sui pazienti -  #vaccino #‘chadox1 #ncov-19’ #siero  link"
0,"user_grillo sento il pianto sconsolato di tutte le merde #novax link"
2,"twitter fa uso della censura? io posto tweet sui danni da vaccino e sulla logica conseguenza che dove c'e' rischio si impone la libea' di scelta! penso che su questo tema si debba essere tutti d'accordo ... ma, come mai i miei follower continuano a diminuire. ripeto: censura???"
2,"user user se parli male dei vacini sei fuori dall',ordine , a nessuno dei miei cari permetter� di prendere il vaccino antinfluenzale  ,non cerco gloria n� polemiche"
1,"il vaccino contro il coronavirus parla anche italiano, nel team di ricerca il barese andrea gambotto link di user"
2,"user la cosa più bella è che, con tutti sti miglioni elargiti ""per beneficienza"", sto merdoso si fa dare dall'altro merdoso itagliano centinaia di miglioni per ""progettare il vaccino"" (quale di tutti, non si sa)... entrambi i merdosi devono andare davanti a un giudice, come minimo."
0,"fase 2, a trieste riapre il «bagno pedocin»: la spiaggia con il muro che divide uomini e donne
un muro che mi divida per sempre da #giletarancioni, #terrapiattisti, #novax, #populisti esiste?
se sì, ordino subito online...
link"
2,"user warp speed per vaccino e tutto il connesso.
come sempre soldi e potere!"
0,"la fondazione di bill e melinda gates è pronta a finanziare la produzione del vaccino!

#billgates #melindagates #vaccino #coronavirus #27aprile #radio105 
link"
1,"coronavirus – su internet la truffe di sedicenti farmaci anti covid-19: oscurati 4 siti web - ... ricerca di una terapia o un vaccino efficace contro il covid-19, impazza su internet la vendita illegale di sedicenti terapie contro il nuovo coronavirus, ..."
1,"user user user user user user non sono io che studio ad oxford, ma mio cognato che e'  mrc wimm leader al radcliffe department of medicine. al di la' di cio' e' stata la stessa oms a dichiarare che un vaccino non sara' distribuito prima di 12 mesi nella migliore delle ipotesi. burioni e' un megalomane, punto"
2,"la smettiamo con sta storia del vaccino? 
tra l'altro fermate gates, grazie
link"
1,"analisi delle conversazioni di pro-vax e anti-vax nell'ultimo mese. non entro nel merito del dibattito ma noto che la pandemia non affievolisce le tesi degli antivaccinisti, anzi... link

#novax #vaccini #listening #covid19 link"
2,"user user non è così il virus muta, è come pensare di vaccinarsi dal raffreddore per cui il vaccino non serve a nulla.
o meglio serve a fare interessi case farmaceutiche"
2,"vaccinazione globale vi ucciderà se la accetterete  - libro della verità (messaggi per argomento) - - la vaccinazione globale: una delle forme più malvagie di genocidio mai viste dalla morte degli ebrei sotto hitler.... link"
1,"il governo tedesco il conferma quanto pubblicato oggi da user :lamministrazione trump ha cercato di comprare i virologi tedeschi che lavorano sul vaccino a tubinga e ha offerto ingenti somme in modo che fossero esclusive per gli stati uniti link"
2,"con una copertura vaccinale sulla difterite all 99%, in grecia torna la difterite!   morto un bambino.  70 anni di pace ficchiateveli su per il culo.  la povert uccide, la povert porta malattie e nessun vaccino potr mitigare questo dato di fatto! link"
1,"tutto questo ci porterà 10 anni di film e serie tv sul coronavirus.
dalle ciofeche alle americanate e ogni paese avrà il suo eroe che scopre il vaccino, nottetempo e per sbaglio. link"
0,"grande risultato di una eccellenza scientifica italiana. l�istituto spallanzani ha isolato il #coronavirus   adesso la via per il vaccino � pi� breve. in alto mare invece l�isolamento dell�#idioziavirus. si camuffa e si trasforma miliardi di miliardi di volte in un secondo."
2,"user user stanno studiando anche una cura contro il vaccino?"
1,"chi è stefano montanari: curriculum del biologo no vax coronavirus. link"
0,"la soluzione alla pandemia covid – 19 che i governi, pare, condividono con le “organizzazioni deputate”, sembra essere quella del “vaccino”. link"
2,"user_ansa ma guarda , un altro vaccino ..."
0,"user user user e per quello che non mette le pubblicazioni nel cv?  guardi, io parlo con tutti, ma non con i no vax. quindi mi scusi"
2,"studio della durata di 40 anni: scopre che in guinea-bissau un primo vaccino per il morbillo non proteggeva dal morbillo, ma riduceva di la mortalit infantile. nel 1989 #oms decide di cambiare vaccino, questo protegge dal morbillo, ma aumenta la mortalit link"
1,"coronavirus, oms: per vaccino dovremo attendere almeno 18 mesi link"
2,"user

i sospetti di speculazione finanziaria dietro gli annunci sul vaccino di moderna link di user_italia"
2,"user la denuncia del 7.9.2017 di salvatore rainò medico chirurgo specialista in allergologia ed immunologia clinica, specialista in medicina interna e omeopata contro la vaccinazione obbligatoria che si può ascoltare dal suo canale youtube qui &gt;
link"
1,"covid-19: parte negli usa sperimentazione #vaccino a mrna | #ecm link"
0,"user perché quando sono stati eletti erano un partito con elettori e candidati per il 60% di destra. poi salvini gli ha rubato gli elettori, ma gli eletti sempre mezzi bacati sovranisti sono. a roma hanno dovuto ragionare, a bruxelles non sono obbligati. sono ancora novax a gogo"
2,"user forse hai ragione, magari un certo numero di persone, designati, hanno già fatto il vaccino e li ha toccati nel cervello. gli idioti son tutti uguali."
0,"virus sparito? come lo vede e quando? perché non ha ricordato il vaccino? è forse contrario?"
1,"covid-19, patto commissione ue-produttori per vaccino  link"
2,"nessuna caccia... punto! hanno una paura fottuta scoprire che la causa  il vaccino! link"
1,"a che punto siamo con la sperimentazione del vaccino anti covid-19? link"
1,"insieme al vaccino, a un bambino verrebbe iniettato un po 'di colorante invisibile ad occhio nudo ma facilmente visibile con uno speciale filtro per telefono cellulare user user user user_gibilisco user  link"
0,"montagnier, il declino di un nobel tra campagne no vax e strane teorie sul coronavirus | rep link user"
1,"ma si continui ad aspettare “terapia efficace e/o vaccino” e nel frattempo vedere come va. nel frattempo potrebbe passare un anno, ma dettagli.
anziché conviverci, dunque, e tornare gradualmente alla normalità, si continua a praticare un distanziamento sociale che lascerà"
2,"user il virus collezione 2019/20 veniva descritto ad ottobre (:down_arrow:) come un virus molto aggressivo e contagioso. 
stesse caratteristiche del covid. 
vaccino consigliato a tutti! 
ma se il covid era solo la nuova influenza allora cosa è successo esattamente a bergamo? link"
0,"user_xxy9 user user il vaccino dtp è una cosa completamente differente. mi perdoni, ma lei ha una gran confusione riguardo al funzionamento dei vaccini. lasci perdere google e se le interessa conoscere veramente i vaccini si iscriva a biologia, biotecnologie o medicina all'università."
2,"trump: ‘covid-19 sparirà senza vaccino, almeno 95mila morti’ – nord america link"
2,"user trovate la cura il vaccino ve lo fate voi io non faccio da cavia"
2,"se non si trova la cura,non dico il vaccino ma una cura,riaprire sarà quasi impossibile!cosa riapriremo?fabbriche e qualche negozio,stop! scuole,teatri,ristoranti,bar,librerie,discoteche,lidi balneari,sarà impossibile link vita sarà impossibile con il #covid"
0,"user user user il vaccino protegge dal virus dell'influenza, ma non è che se sei vaccinato non ti possono venire forme para influenzali come raffreddore o altre infezioni respiratorie o intestinali. studia"
1,"appello onu e movimento internazionale croce rossa e mezzaluna rossa: “serve unità per il vaccino contro il covid19” link"
1,"tutti alla ricerca vaccino covid, nuovi test e fondi. alleanza ue per le forniture - metropolisweb link"
0,"""bisogna convivere con il virus fin quando non si troverà un vaccino, per questo si dovranno utilizzare mascherine e guanti…"" beh a noi che portiamo gli occhiali da vista abbiamo un grandissimo problema !!!"
0,"pensavo che quei dementi dei #novax fossero spariti ed invece eccoli spuntare come funghi alla notizia di #djokovic link"
1,"come si distribuiranno le dosi del vaccino anti coronavirus? -  #distribuiranno #vaccino #coronavirus? link"
2,"muore a 5 anni dopo richiamo vaccinale ma non  colpa del vaccino bens di un infezione batterica dicono . il richiamo fatto, secondo il calendario vaccinale  il dtpa, anti difterite, tetano e pertosse. tutte  tre sono infezioni batteriche. fate voi???? link"
2,"user user_i l'ultimo pezzo dell'articolo avvalora la tesi della dottoressa americana che ha denunciato tutto,il vaccino serve a sviluppare una risposta immunitaria cosi potente che al contatto col virus selvaggio uccide chi lo ha ricevuto,se lo ammettono loro  immaginate cosa nascondono! link"
0,"user user per tutte quelle malattie ci sono i vaccini. se tu non sei una no vax puoi stare tranquilla. se invece sei no vax allora ti ammalerai."
1,"user user_w user_tonii +++ il governo americano dichiara che il vaccino per il #coronavirus è già pronto e domani parte la sperimentazione clinica +++
link
user user user_grim user user user_masala user user user"
2,"il vaccino antinfluenzale contiene 25.000 volte pi mercurio di quanto consentito legalmente nell'acqua potabile! link link"
2,"user user user user user user user_01 user penso che il vaccino di speranza, sia una bufala, per un vero vaccino bisognerà attendere almeno 9 mesi, quando si avranno i risultati della sperimentazione. se lo faccia speranza il vaccino di gates e soci"
2,"questi bambini non festeggeranno nessun natale, il #vaccino li ha portati via. link"
0,"coronavirus: il senatore d'anna ritira dimissioni da presidente ordine biologi.  -novax -dice �virus � una banale influenza� -anni fa ha fatto il saluto romano in parlamento  -sospeso 5 gg. per frasi sessiste.  il punto �: come mai � presidente dell�ordine? come mai � senatore?"
0,"leggo queste cose ed i miei pensieri vanno direttamente a tutti i quei potervi chimici e ricercatori che stanno chiusi giorni e giorni per lavorare su un cazzo di vaccino che dovrebbe salvarvi la vita fetusi di merda maronna mo urlo link"
2,"user il problema non sono i vaccini,ma il fatto che gliene sono stati sparati 8 in un giorno.
non prendete ogni occasione buona per fare i no-vax"
1,"user_ user è lui che sta per scoprire il vaccino non lo sapevate?????"
2,"#ivaccinisonosicuri la rivista #vaccines ha pubblicato un lavoro di ricercatori dell'universit di bari, dove si  monitorato in maniera attiva le reazioni avverse al #vaccino #mprv.  #aifa riporta 12,7 reazioni gravi su 100.000 dosi, lo studio ne ha riscontrate 3.800 su 100.000 link"
1,"user user chi ha riconosciuto la risposta adeguata? i 34k morti? la metà in lombardia? basta vantarsi! perchè il germania e francia hanno reagito meglio? 
un accordo per un vaccino che non esiste di cui non si sa nulla non le laverà la coscienza.
fuori i dati."
2,"user_cersei user user io neanche solo che ci chipperanno anche con il programma id2020 e dovrai dimostrare di aver fatto il vaccino se vuoi andare da qualche parte.. #immuni è solo l’inizio per abituarci..la rana bolle lenta in pentola"
0,"user user user user sempre per privacy, com'è possibile che avendo visto cosa accadeva in cina, non sia stata messa in piedi la quarantena per tutti coloro che uscivano dal loro paese o ci facevano scalo? la soluzione è il vaccino. perdere la privacy non si pone proprio. user_commission user_it"
2,"#covid19, #fauci: ""non torneremo alla normalità almeno per un anno. la soluzione vera è il #vaccino"".
giusto il tempo che ci vuole per metterlo in commercio. link"
2,"a moe!  condannati bambini perfetti,  sani e innocenti,  discriminati a vita,  perseguitati come i sioux,  braccati da cani avidi e alla catena. che i vermi vi mangino vivi! link"
2,"user user risulta che tutti coloro che hanno fatto il vaccino antinfluenzale...si siano ammalati di covid 19 vuoi vedere che era nel vaccino?"
2,"user user_sicilia se tanto mi da tanto...quindi aspettiamoci a breve notizie del vaccino di gates. abbiamo capito il messaggio, grazie ma spero che le opposizioni la fermino."
0,"user user gentile elisa, da medico con 30anni di esperienza ospedaliera alle spalle ti dico: non ti far coinvolgere in questa campagna anti vaccinazione. tra qualche anno ti potresti accorgere di esserti sbagliata. (continua)"
0,"user user user fintanto che non si trova un vaccino o r0 va sotto 1, questa e' un'emergenza sanitaria di massimo livello. la gente non deve andare in panico, ma nemmeno perdere la propria attenzione 2/2"
2,"user questa è la cura che serve, non il vaccino. deve essere usata dovunque, così potremo tornare presto alla normalità e liberarci di distanze e mascherine,senza aspettare troppo per un vaccino. può pure darsi che il virus andrà via da solo,sta perdendo forza"
1,"user user user user_euro non dia per scontato che ci sarà un vaccino."
0,"user user io se un giorno ipotetico si potrà avere il vaccino per covid19. .. ed io che non posso vaccinarmi perché immunodepresso, se so chi me lo attacca perche gira con sintomi, giuro che possa avere ora un infarto, lo strangolo con le mie mani nude... lo reputo un mio diritto civile."
1,"e se ottenessimo un vaccino contro il covid-19 e metà del paese si rifiutasse di prenderlo? - link link"
2,"ma la concomitanza di vaccino anti influenzale, e durante la cura, degli antivirali e l'intubazione, non hanno influito in nulla secondo il vs esperto?"
2,"user lei saprebbe spiegarmi perché sono arrivati 30 mila soldati americani in europa senza nessun timore o precauzione?? che per caso hanno il vaccino o questo virus di fatto non è così pericoloso come dice lei? chiedo a lei perché è un esperto"
0,"dove sono finiti i no.vax.manifestazioni,non vaccinavano i figli..
il coglionavirus li ha resi idioti? link"
2,"le decine/centinaia di migliaia di persone che moriranno durante l’anno di sperimentazione del vaccino saranno grate al sistema che garantisce un prodotto sicuro.#agorarai"
2,"user user non ne parlano perche' non si deve sapere che c'e' una terapia sicura e non costosa, mentre abbiamo un pdc che fa videochiamate con il criminale mondiale bill gates per pseudo accordi su uno pseudo vaccino prodotto ad oxford, e finanziato dallo stesso gates.."
0,"user user potrebbe essere vero....se non si trova il  vaccino."
1,"coronavirus, dalla germania frenano: `un vaccino potrebbe richiedere anni` link"
0,"user user user quindi il video che“non vogliono farci vedere“é disponibile sulla piattaforma streaming più famosa al mondo?
e’ tutto così segreto che anche il fruttivendolo al mercato ne parla.non fate il vaccino, così bigpharma può vendervi le medicine per curarvi: eccovi servito il complotto!"
0,"user user i novax sono dei ritardati mentali usciti da una caverna del medioevo. si curassero leggendo la bibbia e non osino bussare ad un ospedale frutto di ricerca scientifica."
1,"coronavirus, fauci al senato: ""morte e sofferenze se riapriremo usa troppo presto"". il vaccino? ""fra un anno o due"" link link"
0,"#vaccino per l'#influenza migliora la risposta all'#immunoterapia user | #ecm link"
2,"leggete bene ebola false flag in arrivo il vaccino  pronto, non ha superato nessun trial clinico approvato in gran fretta. faranno scoppiare una finta epidemia. state in campana!  link"
2,"a tutti quelli in file per farsi il vaccino della #meningite:  lo sapete che il vaccino copre solo pochi ceppi?  lo sapete che il vaccino non pu dare immunit istantanea?  ????questo potrebbe farvi scoppiare la meninge.  lo sapete che fra gli effetti collaterali c' la meningite? link"
1,"coronavirus, a fine aprile test per un vaccino sull'uomo link"
1,"vaccino, test in italia in estate link"
0,"#10daysofhumanrights articolo 25 della #dichiarazioneuniversaledeidiritti #dirittoallasalute l' #ema ha dato il via a #ervebro, il vaccino gi sperimentato in #congo per combattere il virus #ebola link"
2,"aiutooo! entro il 2025 i vaccini saliranno a 18, inclusi il vaccino inattivato per polio (ipv), i vaccini per la rabbia e i meningococcici multivalenti. entro il 2025 gavi immunizzer 300 milioni di persone nei paesi in via di sviluppo - link via user"
0,"#vaccino fate presto non c'è più tempo!"
0,"user user non si potrà ripartire normalmente fino al vaccino lo stanno dicendo in tutti i modi gli scienziati"
2,"sciacalli in corsa per il brevetto. la corsa al vaccino vale 30 miliardi: i favoriti sono le star delle borse. | rep link user"
0,"user_cloe user aimè la capisco, sono di bologna ed ho perso due amici che per me erano come fratelli, uno lascia due bambini. spero e confido nell’intelligenza e buon senso della gente perché se non arriva presto il vaccino una soluzione là si deve trovare. in bocca al lupo per il suo papà."
1,"da personaggio più odiato di germania per ragioni legate al suo hoffenheim, il magnate tedesco potrebbe trovare riscatto grazie al vaccino contro il coronavirus al quale lavora la sua casa farmaceutica. alla presunta offerta di trump ha risposto picche. link"
2,"user link
- meglio il modello germania: meno divieti e meno malati.
- arriva! la truffa chiamata vaccino.
- ecco come bill gates è diventato “padrone” dell’oms.
- genealogia di bill gates – eugenetici, malthusiani, vaccinatori.(non vogliamo avere molte persone guar"
1,"vaccino, test positivi in usa oms, in 100 chiedono un’inchiesta link"
1,"trump «compra»  in germania il brevetto di un vaccino: un miliardo di dollari (in esclusiva per gli usa) link"
1,"#coronavirus, negli #usa oltre 35 mila casi #vaccino russo pronto in 11 mesi  #ansa #23marzo #covid19 link"
2,"user vaccino per cosa? link"
0,"user user_apostata se ne è “preso” immeritatamente il merito, sono i geniali ricercatori del suo dipartimento che l’hanno scoperto, per tua info il guro dei #novax cura il cancro con l’omeopatia e parkinson e sars con la papaya ... te lo raccomando"
1,"regione lazio – obbligatorio per gli over 65 il vaccino contro l`influenza; l’annuncio dell’assessore alla sanità, alessio d`amato - radiocassinostereo link"
1,"creato un vaccino-cerotto contro il #coronavirus: bene i primi test sui topi. la university of pittsburgh school of medicine anticipa: il vaccino potrebbe entrare già entro un mese nei test clinici di fase i su individui.
#covid19 #covid19italia"
0,"per me le palestre apriranno solo per chi avrà un appuntamento con un personal trainer.
e' l'unico modo per avere entrate scaglionate e non creare assembramenti.
per tornare al liberi tutti di prima bisognerà aspettare il vaccino, alternative non esistono."
1,"""dopo i novax, i notrax"" indovinate su quale testata giornalistica hanno coniato il neologismo notrax   appioppato  a chiunque abbia rilevatp  perplessità  sulla app immune."
0,"user il vaccino sarà la vera via alla normalità"
0,"user strano il silenzio dei novax, forse hanno capito quanto sono stati stupidi ed incoscienti!"
2,"spettacolo!al corso preparto invitano i genitori a vaccinarsi contro la pertosse, in modo che il neonato non rischi di prendere la malattia prima di poter effettuare lui stesso il vaccino. quindi, dopo essermi bucato, non lo dovrei far uscire di casa?  chiedo a user link"
2,"user purtroppo potrebbe essere.
il cerchio si chiude: dalla via della seta all'... autostrada del #vaccino link link"
1,"user prof., rispetto alla sieroterapia ci sono ricercatori che affermano che la protezione durerebbe solo alcune settimane, si richiederebbero costanti ed ingenti prelievi di sangue dai guariti, e ci sarebbero costi associati infinitamente più alti di quelli del vaccino..è vero?"
0,"ci sono ben 6 diverse marche che producono vaccino antinfluenzale senza lattice, tra cui scegliere. chi  allergico al lattice lo sa, che deve chiedere al medico e fare attenzione per questo ed altri farmaci. lessenziale  proteggersi con la vaccinazione. link"
2,"l'italia ai tempi della #ue: vaccinazione coatta, euro, immigrazione, dittatura gender, islamizzazione, furto di bambini (bibbiano), utero in affitto, legge fornero (ergastolo lavorativo), jobs act (licenziare per riassumere a met stipendio), tassazione insostenibile..  #uscita link"
1,"coronavirus, vaccino vicino. l'istituto migal di israele: «ora test in vivo e avvio produzione» link"
2,"""global vaccine safety summit"" : i maggiori esperti del settore hanno dubbi sulla sicurezza dei #vaccini.  non esistono studi adeguati sulle reazioni a lungo termine e sulle reazioni avverse degli adiuvanti, soprattutto se combinati tra loro.   (sub ita).  link"
2,"nanochip vaccinali glaxo-hitachi e inquietanti intrallazzi renziani  di valdo vaccaro  ciao valdo. gianni lannes ci spiega come le multinazionali del vaccino stanno mettendo le... link"
1,"user mentre oms stronca l’ipotesi della disponibilità di un vaccino per il 2020."
0,"il user ha fatto benissimo a liberarsi dai no vax. un segnale di continua maturazione politica."
0,"user io ho una malattia cronica autoimmune, sono  immunodepressa per la terapia, abito a mezz'ora di strada dal focolaio veneto e sinceramente tanto tranquilla non sono. per l'influenza stagionale infatti faccio il vaccino."
0,"#conte: ""mantenere e far rispettare, a tutti i livelli, le misure per il distanziamento sociale e promuovere l’utilizzo diffuso dei dispositivi di protezione individuale, fino a quando non saranno disponibili una specifica terapia e un vaccino""."
1,"user user user veramente lo dicono medici in gamba che l hanno già sperimentato con successo. il vaccino non c è ancora, o sbaglio? una alternativa altrettanto valida nemmeno. i pazienti gravi ancora si! è forse meglio aspettare il vaccino e pregare?"
0,"carissimi no-vax, quello che stiamo vivendo ora è un mondo senza un vaccino. voi non ne vorreste nessuno."
2,"le azioni della bill &amp; melinda gates e delle altre multinazionali impegnate nella ricerca del ""vaccino"" hanno preso il decollo, mentre il resto crollava."
2,"postate tra i commenti tutte le foto dei vostri figli danneggiati, anche quelli che purtroppo oggi non ci sono pi!  non nascondetevi dietro una tastiera il silenzio  complice!!!!  mettete foto nome e poi scrivete danneggiato da vaccino!  link link"
1,"accordo italia-usa per vaccino orale, alleate kiromic e molipharma   link"
2,"user user user forse non è chiaro che qui non si sta parlando (e parlo per me non per altri) dei vaccini in generale,  ma di un vaccino che vogliono sviluppare in tempi rapidissimi, senza seguire i protocolli e soprattutto vogliono imporre a tutti. spero di essere stata chiara."
1,"di maio: «ora un’alleanza internazionale per mettere a punto il vaccino» link"
0,"adesso i no vax invocano il vaccino! link"
2,"user user user_hopppe1 user user vabbè lei proprio non vuole capire. se lo stato mi obbliga ad un tso perché mi fa firmare addossandomi la responsabilità?  lo sa che se non firmi non te lo fanno il vaccino?"
