1,"user user anche un semplicissimo herpes non ha vaccino ... è un virus...ci conviviamo"
2,"user la astrozeneka si sta gia occupando della messa in mercato dei dispenser antenne vaccino di b.gates conte gli ha promesso 150milioni per il vaccino,a pomezia oltre 300gonzi si sono fatti inoculare il vaccino"
0,"user user user user user user user user user user user user user user_amatu user user user user user user user user sul vaccino, ed in generale sugli interventi farmacologici, è allucinante che i governi di mezzo mondo non abbiano già messo in piedi un programma stile manhattan."
2,"il #coronavirus è una #pandemia mondiale, questo vuol dire che se trovano il vaccino obbligheranno 7,5 miliardi di persone a vaccinarsi?sarebbe l'affare mai visto sul pianeta, forse ci metto troppa fantasia,ma se fosse io non mi vaccino"
0,"user mamma che paura sono veramente terrorizzato, è una strage senza fine, finiremo tutti in ospedale e metà della popolazione italiana morirà senza aver possibilità di essere curati. è una disgrazia enorme e dobbiamo tutti chiuderci in casa fino a quando non ci sarà un vaccino"
2," user: (poi il vaccino di cui parla non protegge dai virus circolanti, ma a voi politici e cittadini responsabbbbili cazzofreg�"
2,"user user per indurre a spese illimitate alla sanità imponendo il vaccino obbligatorio alla popolazione gratis sfruttando una misura tipo il mes sanitario. e uala!  fondazione gates,clinton, big farma  e poche altre con trilioni di dollari e euro a gogo"
1,"coronavirus, vaccino: a settembre 400 milioni di dosi. test in corso, ma … link"
2,"vaccine nation  - sub ita  - sottotitolato in italiano da ""il portico di... link di user"
2,"user user ancora insistete si questa strada? capisco la scienza, prima di oggi ci sono voluti anni per un vaccino, poi il test ed il codice etico, ora in 3 mesi lo vogliamo pronto ed efficace, mentre dopo 30 anni ancora non c'è quello contro l'hiv"
2,"user oltre alla mascherina ci vogliono imporre anche il bavaglio, mi sembra si stia esagerando, non vorrei che dopo i camici cominciassero con le camice di forza a chi rifiuta il vaccino e l'appalto di esse dato ai cugini di primo letto e alle fidanzatine"
0,"user tarro 2 (tpi 20/4/20): “e noi abbiamo già un vaccino naturale negli anticorpi di chi non si è ammalato, malgrado il virus, e di chi ha contratto il virus, ma è guarito”. acciderba, ma allora la plasmaterapia immunizza quanto un vaccino? ma che cosa ci insegnano?"
1,"user solo così si può testare un vaccino dove sta la proposta choc"
0,"user user user speriamo nel vaccino anti covid a breve. obbligatorio. per tutti."
0,"coronavirus, conte: ""mascherine e distanziamento fino al vaccino""

link"
2,"di maio ed il pubblidirezionale pro-vax (di debora billi) link"
1,"ranieri guerra (oms): ""vaccino? se va bene entro il primo trimestre del 2021"" link"
1,"alleanza tra giganti per il vaccino antivirus link"
0,"user user user user user purtroppo bojo ha torto perché a parte la strage che ne seguirebbe, non è ancora affatto detto che si sviluppi un'immunità di gregge, in assenza di un vaccino, perché si teme che l'immunità da infezione sia temporanea.
come per l'influenza o il raffreddore."
0,"- negli ospedali sono ricoverati solo italiani, perché non ci sono immigrati ?, forse perché sono vaccinati contro la tubercolosi, il vaccino ha durata circa 20 anni e quanti di noi si è rivaccinato ?"
0,"ma i #novax, dove cazzo sono spariti?"
1,"coronavirus: vaccino anti covid-19, è una ragazza la prima persona italiana a testarlo. ecco dove e come link #meteo via user"
0,"user user brava,svegliatevi dal medioevo,nn auguro il male a nessuno, lo preciso,però se uno di voi,o della vostra famiglia fosse colpito da questo maledetto virus,e ci fosse il vaccino, ma neanche morto ve lo farei fare,no vax dei miei coglioni,questo siete,siete solo cazzari e pericolosi"
2,"#domandedasomaro 3) dai primi dati emersi dalla regione #emiliaromagna sui danni da #vaccino e reazioni avverse ai farmaci, risulta che dal 2017 c' un'impennata vertiginosa delle reazioni avverse, perch? link link"
2,"la chiesa di satana provax, ma tu guarda... con lavallo dei clinton poi. toh! link"
0,"ima, vacchi: «le macchine del gruppo per le dosi iniettabili del futuro vaccino» link"
2,"questa volta sono stati troppo precipitosi per... link"
0,"i novax potrebbero lottare contro il vaccino al coronavirus. non possiamo permetterglielo. link"
2,"link i danneggiati da vaccino esistono: 691 sono i soggetti riconosciuti e indennizzati dallo stato al 31 dicembre 2018, di cui 27 morti. nadia gatti, presidente del condav, ci fornisce i dati...buona lettura!"
0,"“a tutte le persone che nel mondo non volevano i vaccini, ecco a voi un mondo a cui manca un vaccino.” #covid_19 user"
0,"user ma poi quando qualcuno le fa notare che la maggior parte dei morti sono over 65 che non avevano indicazione nel fare il vaccino per la meningite ha risposto:gli hanno fatto l'antinfluenzale peccato che quest'ultimo lo fanno ogni anno in tutta italia (a chi vuole,mica è un obbligo link"
0,"c’è l’app ma forse, boh. test sierologici, ma non si sa. trasporti? c’è l’idea ma forse non facciamo in tempo. di questo passo bisogna davvero stare in casa fino al vaccino per non far morire la gente. che è impensabile #fase2"
2,"user il virus no.

ma il vaccino + app + 5g.

si."
2,"il problema in lombardia e a bergamo e cremona  rase al suolo � proprio dovuto non al coronavirus di cui ne abbiamo tanti nel nostro organismo perch� sono virus influenzali ma � dovuto proprio al immunodepressione creata dalla vaccinazione a tappeto fatta precedentemente"
2,"il #vaccino e i suoi effetti collaterali : in africa ci sono pi casi di polio derivata che di virus selvaggio.  ma non vi preoccupate, sar colpa dei #novax anche in questo caso   link"
2,"""perch ho bisogno di uno studio medico? se l'80% dei genitori di bambini con autismo regressivo nella mia pratica afferma che il loro bambino ha reagito dopo il vaccino mmr, perch ho bisogno di uno studio medico?"" dr. douglas hulstedt link"
2,"mi pare che sia essenziale indagare sulla letalità del covid 19 nella zona di bergamo nell'ipotesi che la concomitanza del vaccino antinfluenzale e di quello anti meningococco abbia mandato in tilt il sistema immunitario!!!"
2,"di una bella epidemia di ebola vaccino-indotta in territorio europeo in effetti sentivamo la mancanza. servir a sentirsi pi vicini, pi solidali, pi pei. link"
2,"user_william user questo conta, che si possa curare.
da quello che ho appreso tutta la serie di corona non sono prevenibili.
si modificano nel tempo, si comportano diversamente per ceppo etnico, per età e per mille altri fattori. mi inquieto quando sento anteporre alla cura certa, la vaccinazione."
1,"coronavirus, stati uniti: oggi primo test di una dose di vaccino sperime... link di user"
0,"coronavirus, burioni: bene terapia plasma, ma meglio il vaccino link"
2,"noi con trump | dr. fauci conferma al congresso come il vaccino alimenta la pericolosità del coronavirus link"
0,"user_the_teacher stiamo dicendo la stessa cosa, con una piccola differenza, per l'influenza stagionale esiste un vaccino e le persone più fragili dovrebbero averlo fatto. per il coronavirus no"
0,"user user user_cauc user in un mondo parallelo dove avrei lo scettro del comando, manderei tutti i novax su un’isola con tutti i confort tranne che le medicine, ne uscirebbero solo con un super sistema immunitario o tutti malati"
1,"vaccino coronavirus, ema: aspettare ancora mesi per gli studi clinici link"
1,"al supermercato c'erano due che si stavano per menare per accaparrarsi gli ultimi 2 pacchi di farina sullo scaffale.
cambiare ""farina"" con ""vaccino"" e avrete la prospettiva del futuro prossimo."
0,"coronavirus: vaccino usa, il professor bucci sulla sperimentazione di moderna:: ""poche persone testate e nessuno studio scientifico, ma la strada è promettente"" | rep link user"
1,"user user te lo dicono i virologi che prima di 18 mesi non sarà pronto il vaccino, che prima di ottobre è difficile tornare alla normalità e che non si può escludere l’ondata di ritorno ... fatti due conti e vediamo dove arriviamo."
0,"al dott. #rezza vorrei chiedere se chi ha fatto bil vaccino antinfluenzale ha una qualche protezione dal #codvid19italia ( seppur preparato per altro virus) #livenoneladurso"
1,"se sospendono la serie a a tempo indeterminato 48 ore dopo lotito trova il vaccino"
0,"user il lockdown stile cina è impossibile status a parte le dimensioni e proporzioni di persone e territori potenza economica ed altri fattori non sono equiparabili. o vaccino o non la risolviamo. con l isolamento possiamo solo tamponare infatti i casi in ti sono in discesa continua."
0,"ne ho conosciuta una che non ha fatto i vaccini al figlio...però dice che gli vorrebbe fare quello per il tetano.....
ma vai a fan culo.....no vax....poveri imbecilli"
1,"user user user user user user user user user user user user user user user user user user user_ user user user user user user user user user user user buongiorno lidia. saremo anche un popolo di adolescenti ma dobbiamo crescere e non è possibile rimanere a casa fino a quando si troverà il vaccino. non possiamo permetterci di vivere di rendita . non tutti almeno."
2,"user_fivestar user involontariamente zinga ha fatto autogol

i primi a non vaccinarsi sono proprio i medici

e poi i politici...mica la lorenzin ha fatto mai vedere i certificati di vaccinazione dei pargoli"
2,"user_it user_capitani user una mia amica informatrice farmaceutica e generalmente pro vax e molto allineata alla medicina ufficiale, non ha mai fatto vaccinare l'anziana madre contro l'influenza. ci sarà un motivo..."
2,"user user_semenov user user_vitruviano user_g user__bru user user_data24 user user_arnese user user user user eh beh... è giusto! un vaccino già pronto e prodotto per fine anno? ma cosa ci vogliono iniettare? ma questi sono tutti matti."
2,"ci potete scommettere
#novax
x sempre 
link"
0,"emilia romagna ore 14 , vado senza appuntamento a asl per vaccino antinfluenzale. fatto. esco alle 14,30 e dopo alcune ore mi � arrivata la email con aggiornamento del mio libretto vaccinale, anche nel fascicolo sanitario online una sanit� proprio da cambiare, mi raccomando ????"
0,"user_riccio direi che dal 68 le cose sono cambiate. siamo più vecchi, più malandati e più numerosi. il virus poi è una sars. il fino a quando dipende da farmaci, vaccino, test diagnostici. non piace? prendetevela col virus"
0,"i nemici del “#vaccino dei popoli”. l’accesso sostenibile ai farmaci #covid19 segnerà il crinale di una guerra ad alta densità geopolitica. in gioco c’è il diritto alla salute. la rubrica di user link link"
0,"studio del 2005: la clorochina è un potente inibitore del contagio da #sars
#coronavirus . lo sapevano. però niente da fare, per il #covid_19
devono trovare il #vaccino . 
link"
2,"user ma facciamo tutti un bel vaccino con un chip rfid integrato! 
ci ha già pensato bill."
2,"ieri +71% per la societ che sta producendo il #vaccino per il #coronavirus .  #lascienza per ci dice che a loro non conviene produrre vaccini, quindi sar sicuramente un caso  #libertadiscelta link"
2,"a proposito di ebola, i produttori del vaccino avranno l'immunit sui loro prodotti.  almeno in america, per il momento.  praticamente produrre vaccini  il business perfetto. non corri nessun pericolo se il tuo prodotto uccide chi ne fa uso (persone sane) link"
2,"user user vogliono metterci un microchip sulla mano destra, con la scusa del vaccino. ci vaccineranno e oltre al vaccino avremo un microchip con codice a barre, ideato da bill gates. è un prototipo del marchio della bestia."
0,"e poi quando ci scappa il morto tutti a piangere e a pietire il vaccino d'emergenza (no vax compresi, perch la morte fa paura a tutti). facciamoci domande e diamoci risposte, seguiamo i consigli del prof. burioni. link"
0,"user l’essere uniti credo sia una chimera. io ad esempio auspicherei una unità, uno scambio di informazioni tra questi ca. 40 team di scienziati che cercano un vaccino. ma ognuno farà per conto suo purtroppo"
2,"coronavirus, i ricercatori temono il calo di contagi ci occorrono malati per vaccino” link"
2,"user user ti fai un vaccino nato da un virus scomparso mesi prima. perché,detto da loro,il covid muta velocemente. 
mah."
0,"user user user scommetto un gelato che se gli scorri la tl ci trovi tutto il cucuzzaro #novax, #no5g, #qanon.
il pacchetto ""cazzate complottare per babbei"" è unico."
1,"ptv news 25.02.2020 - #covid19 gli usa alla ricerca del vaccino - pandora tv link"
1,"user user impossibile non esiste vaccino ancora"
1,"coronavirus: il furetto e' il candidato migliore per il vaccino - animali - link link"
1,"|| news.flash ||
news | euronews rss - la pandemia di covid-19 accelera la sperimentazione del vaccino
la pandemia di covid-19 accelera la sperimentazione del vaccino
link
link"
1,"il vaccino in arrivo dagli usa. «pronti i test sull’uomo» link link"
2,"l'azienda pi� vicina alla scoperta del vaccino per il #coronavirus (anche via anticorpi monoclonali) sarebbe vir biotechnologies, finanziata da colui che preannunci� una pandemia gravissima (gates). da inizio anno azioni balzate del 100%, capitalizzazione di quasi 3 miliardi."
2,"invito alla vaccinazioneeee? ma vaccinatevi voi, i vostri figli, amici, conoscenti e parenti entro il quarto grado! link"
1,"#vaccino #modernainc 
l'annuncio, ovviamente, è stato premiato dai mercati finanziari e a wall street l'azienda biotecnologica  americana guadagna il 23,78% a 82,73 dollari. - see more at: link 
#covid19"
1,"#allespertochiedo a che punto siamo con un eventuale vaccino? grazie"
2,"samoa mette al bando il vaccino esavalente nel 2018, dopo la morte di due bambini per reazione avversa al siero. niente morbillo per un intero anno. nel 2019 arriva l'#unicef e inocula 115.500 vaccini per uno dei suoi programmi filantropici. novembre: scoppio epidemico, morti. link"
0,"domando per un amico: ma i #novax dove sono finiti ?"
2,"per chi ancora non l'avesse capito.  l'obiettivo delle case farmaceutiche  quello di entrare nel mercato delle persone sane.  le persone sane sono tutti gli abitanti della terra, 7 miliardi di potenziali clienti, le persone malate solo una microscopica percentuale di essi. link"
0,"coronavirus gallera: “finché non avremo vaccino dovremo girare con mascherina e cambiare abitudini” -  #coronavirus #gallera: #“finché  link"
2,"user user user mi spiace per lei ma purtroppo pare non sia cos ma che invece il vaccino del morbillo non garantisca l'immunit e soprattutto stia facendo sviluppare un tipo diverso di virus  link"
0,"user non do degli analfabeti a chi fa questo attivismo ma a chi fa attivismo estremo in generale, inclusi complottisti, no vax e terrapiattisti. i social danno un poter vasto a persone con la 5 elementare e questo è un pericolo"
2,"user user_gurt il problema è se obbligano a farlo... mai fatto un vaccino negli ultimi anni (da piccolo mi vaccinarono per i noti obbligatori) ... se mi viene un po' di influenza o raffreddore non prendo mai farmaci ed al momento sto bene..."
0,"hey conte ho capito che dal 4 maggio inizieremo la fase 2 e che dovremo usare le mascherine e guanti fino al vaccino, ma chi ha una relazione a distanza e rivedrà finalmente il proprio partner? come funzionerà là quando riapriranno le regioni e i comuni?"
1,"user hanno preso gusto a tenerci al guinzaglio.
non a caso, intendono prolungare le misure come il distanziamento sociale, anche qualora queste precauzioni non avranno alcuna ragione di persistere.
fino al vaccino...
vaccino che ha utilità preventiva, non di cura delle malattie."
2,"user non abbia fretta. prima si deve realizzare l'agenda di bill gates e bigpharma, poi ci concederanno la libertà provvisoria a patto di subire il loro vaccino ovviamente obbligatorio. link"
2,"associazione corvelva - vaccino merck, il caso degli informatori verso una risoluzione link"
2,"il #vaccino unico modo per curare il #covid_19!
ecco a chi ha messo in mano la nostra #salute user: :down_arrow:
truffe, molestie sessuali, ricerche falsificate e danno ai sistemi sanitari pubblici: ecco chi fornirà il vaccino (obbligatorio) anti-covid  link"
2,"user_19 user tutto vero solo che che se quello preme così tanto sulla vaccinazione di massa che disegno ha dietro? tanto quello il vaccino già lo tiene pronto nn temere... aspetta solo il momento giusto per inocularlo"
2,"abbiamo l'unico farmaco per il coronavirus: il plasma. è più potente di un vaccino - dr. de donno

link"
2,"""non ci sono prove che il vaccino hpv abbia prevenuto anche un solo caso di cancro cervicale in qualsiasi parte del mondo link"
2,"user user de donno ha curato un intero reparto con il plasma, una terapia semplice e che ha un costo bassissimo.  trovo strano che dopo essersi confrontato con lei,i suoi social siano spariti e lei si mette a parlare di vaccini.per caso i sui amici ci devono guadagnare con il vaccino?"
0,"cosa non è chiaro nel fatto che per avere il plasma devi avere dei guariti, ovvero dei malati sopravvissuti, mentre il vaccino serve ad evitare i malati? esiste gente che pensa che questa cura consista nel prelevare sangue da un guarito a caso e iniettarlo in un malato a caso..."
2,"user user fallo ai tuoi cari il vaccino traditore della patria. ti auguro di pagare tutto questo al più presto."
0,"non sono un virologo ma nemmeno un chiacchieratore da bar. fin quando non si troverà un vaccino o una cura, bisognerà conviverci. le nostre libertà ci verranno concesse a spizzichi e bocconi e continueremo ad indossare mascherine, guanti ed a tenerci a debita distanza."
0,"user user sarai obbligata a fare il vaccino . non avete ancora capito ?"
2,"user ma comunque ho i miei dubbi che si possa dimostrare l'immunità per evitare il vaccino. a parte i soggetti noti che guardacaso, si ""sono offerti volontari"" per il tampone, tra i quali, ahhh c'è chi è favorevole al vaccino."
2,"non si pu offrire la prole a moloch.  basta vaccini.  roba da satanisti pi o meno consapevoli. cristo non usava vaccini e ancor meno li avrebbe usati con tracce di feti abortiti, ovaie di criceto, metalli pesanti ecc... come si fa a credere che siano cose buone? link"
1,"user presto obbligatorio per tutti, e come un un buon paese comunista italiano se nn lo fai perdi il diritto di essere italiano, vaccino solo per gli italiani nn x gli exstra comunitari, viva l'italia"
1,"user influenza ha il vaccino. scommettiamo che a fine anno in italia ci saranno più morti per l'influenza che per il corona virus?"
0,"user secondo me anche a settembre non si gioca. basterebbe un positivo per dover fermare tutto il campionato. finché saremo a contagi zero (difficile) o con un vaccino gli sport di squadra non ricominciano, figurarsi poi con il pubblico"
2,"???? che strana cosa, anche quest'anno sembra che ai medici faccia pi paura il #vaccino che l'influenza. ???? link"
2,"la protagonista, danneggiata con riconoscimento della causa nella somministrazione di un vaccino, che ha vissuto tutta la sua esistenza allettata, fino al decesso nel corso del procedimento giudiziario, a soli 32 anni.     link via user"
0,"user purtroppo sarà lunga arrivare ad una cura o ad un vaccino."
1," user: ricercatore: non riusciamo a trovare il vaccino per il coronavirus mamma del ricercatore: e questo cos'�"
0,"user__conti è essenziale trovare un farmaco che contrasti l'evoluzione della polmonite, in modo da non intasare il sistema sanitario. così da guadagnare tempo x la realizzazione di un vaccino..."
0,"user_ansa cosa c'è di difficile nel capire che un virus circola se noi circoliamo? siamo in emergenza. ne volete uscire? allora si sta isolati. nessuna alternativa fino al vaccino. per colpa di scriteriati, non ne verremo fuori presto. #chegente"
1,"user user user altrettanto seri e dobbiamo conviverci. non c'è un'alternativa, quella si chiama vaccino. e se non lo trovassimo mai? aspettiamo chiusi che perda efficacia il virus? se tu hai paura libero di averne, però non è nemmeno giusto fare il contropelo a chi tenta di conviverci."
2,"#coronaviriusitalia
visto l'inutile bufera (i dati e i virologi continuano a dire che è meno di un'influenza) cui il governo si è adagiato, non resta altro che pensare al dolo.
di smerciare in futuro vaccino.
se no non si spiega"
0,"user user user ascolta, cucciolo, voi prendete i voti da no vax, terrapiattisti ed esperti di scie chimiche e come capo politico ne avevate scelto uno che fatica con l'italiano. siete ancora così sicuri che quelli coglioni votano a destra?"
2,"user user user user si parla di dosi vaccino, non di bambini vaccinati e la cosa cambia di molto. esempio, in america gi� la prima vaccinazione comprende pi� dosi in una sola seduta, spesso senza tener conto delle condizi"
2,"user user user user i vaccini non c'entrano nulla con lo stato di emergenza perché arriveranno circa fra 1 anno. e poi se permette se lei vuole farsi il vaccino io non glielo impedisco. così se io voglio innalzare le mie difese immunitarie e non aver bisogno del vaccino lei non può impedirmelo."
0,"user eh, sarebbe bello. purtroppo prima che il vaccino diventi disponibile fanno in tempo a fare ammalare troppa gente"
0,"a tutti quelli che vogliono tornare in chiesa per la messa propongo di curarsi non con il futuro vaccino per #covid19 ma di affidarsi al cuore immacolato di maria #asteroide #sciacalli"
2,"user user cominciai a postarlo su #twitter dai primi di marzo.. #vaccino #covid_19 #lombardia link"
0,"standing ovation per user, ordinario di microbiologia al user e docente della scuola di igiene a user per l'intervista su user e per il contributo alla lotta contro la vaccine hesitancy e le fake news in italia. link"
2,"user user user il vaccino è inutile . quindi si può affermare che se una cosa non serve a niente serve a qualcos’altro?"
0,"tanti insistevano che brevettassi il vaccino, ma non ho voluto.  il mio regalo a tutti i bambini del mondo.  il 3 marzo 1993 a washington moriva albert sabin, il virologo di origine polacca che invent il vaccino antipolio  [la lapide  nel giardino di borgo allegri a firenze] link"
2,"user user prendo del complottista tutti i giorni.
posso predicare quanto voglio, ma farmi dare del coglione di continuo quando so bene di non esserlo, anche no grazie!

son tutti terrorizzzati dal virus
allora che ognuno scelga come vuole morire

ma io di certo non da schiavo causa vaccino"
0,"user_iacoboni non ne usciremo fino a quando non faranno un vaccino e speriamo ci riescano nessuno o quasi rispetta la #quarantena"
1,"'non possiamo aspettare il vaccino, corriamo un rischio calcolato' – conte annuncia la fase 2 link link"
2,"il fumetto dell’ue del 2012 dove era stato previsto tutto: dalla pandemia al vaccino

link"
0,"new fb postl'idea dell'app che monitora i contatti non piace per niente ai no vax. pur rimanendo dell'opinione che ci sono dei punti del design che vanno chiariti (server centrali vs peer to peer) già che quella banda di coglioni si mobilita contro mi pare un buon motivo per…"
2,"imbecilliiiii! un bimbo sano fa il #vaccino sta maleeee e ridono pure! tutto normale oramai  normale anche se un bimbo crepa x un vaccino. ande a cagher! link"
2,"user che strano, già si sono accordati per il vaccino, azz sono dei maghi."
2,"user user fine sto cazzo. il vaccino obbligatorio è palesemente contro la costituzione. infatti quello agli studenti under 16 non era obbligatorio. ma senza di esso niente scuola."
0,"link ricerca. manfredi: italia all'avanguardia anche su vaccino anti-covid - link"
1,"queste sono parole di chiarezza, ci vuole tanto a capire? il futuro secondo il virologo andrea crisanti (il vaccino non è certo) link"
0,"vaccino e covid-19: cosa sappiamo 
una visione narrativa di cosa sta succedendo
f. marchetti, c. guiducci 
medico e bambino 2020;39(5):297-299 
link
(ad accesso… link"
0,"user la mamma dei fessi #novax é sempre incinta!"
2,"#polmonite interstiziale associata al #vaccino #influenzale link"
0,"user user user l'rticolo linkato: dice che le categorie da isolare sono quelle che hanno fatto il vaccino, perché fa il vaccino chi è a rischio. e' stato interpretato in maniera errata da chi dice che le categorie sono da isolare a causa del vaccino, non è quello che c'è scritto"
0,"p.s. vivo in una provincia che ha 23 casi accertati mentre quelle limitrofe ne hanno centinaia, come ad esempio la provincia di #bergamo che ne ha circa 800.

grazie per aver affidato questa situazione al #buonsenso di #novax, #terrapiattisti e #complottisti!!!

#covid19italia"
2,"user equazione...#covid...#vaccini..#bigpharma...sorpreso che non ne parli??spaventano il mondo perché non si vende un farmaco..allora li imploreremo di darci il vaccino covid......!
pace e bene con una rivoltella in mano ad attenderli!!"
2,"user no no,
dovete stare buonetti e ammalati che poi arriva il vaccino e allora sarete miracolati.
maledetta big pharma e i suoi ignobili servi."
1,"coronavirus: al via la sperimentazione di un vaccino su una donna di 45 anni - altraeta link"
2,"no questa  bella. arianna 5 anni, le somministrano 2 #vaccini insieme. la bimba ha crisi epilettiche e sviene poco dopo il vaccino. i medici che dicono alla madre? signora lei ha trasmesso tensione alla bimba. oh ma questi sono laureati in medicina !!! link"
1,"la guerra per il vaccino - il foglio link"
2,"user ne ho letti un paio dicono che il virus non esiste , fra poco esce il vaccino così guadagnano"
2,"user__marti uno dei principali medici inglesi, tesi sostenuta anche dal governo uk, ha detto che chi ha fatto il vaccino rischia molto di più"
2,"user dovrebbero mandarlo a casa ciccone a botte di un vaccino al giorno"
2,"ecco come ci stanno fregando.

#covid2019
#vaccino
#quarantena

link"
