0,"#conte: ""mantenere e far rispettare, a tutti i livelli, le misure per il distanziamento sociale e promuovere l’utilizzo diffuso dei dispositivi di protezione individuale, fino a quando non saranno disponibili una specifica terapia e un vaccino""."
0,"user user user ma come simo, non lo sai? con la triennale diventi no vax e con la magistrale sblocchi anche la tessera del partito 3v. cosa pensi che io studi a fare?"
1,"prima mappa in scala atomica 3d del #coronavirus
link

i ricercatori dell'university of #texas at #austin e del national institutes of health hanno fatto un importante passo avanti verso lo sviluppo di un #vaccino per il nuovo... ( #ecplanet #edoardocapuano ) link"
0,"mentre in usa, uk e germania hanno iniziato i test per il #vaccino #covidー19, non ci sono vaccini sperimentali sviluppati in italia. causa probabile: i forti tagli a università e ricerca. non ci sorprendiamo se gli italiani riceveranno un vaccino dopo altri paesi
#italia"
1,"user user_el user_gori esattamente, non fosse per il cts il 4/5 avremmo avuto più riaperture e libertà di circolare, con le precauzioni, ma liberi. ma d'altronde dopo aver visto rezza ridacchiare dicendo ""per me si sta chiusi fino al vaccino e ho risolto"" non alcuna fiducia in quel comitato"
2,"coronavirus in diretta video: non sarà il vaccino a tirarci fuori dall'incubo covid-19. parla la virologa capua link #meteo via user"
0,"user li obblighiamo se necessario. 
ma non ce ne sara' bisogno, 
verranno a implorare il vaccino in ginocchio sui ceci.

robeo burioni link"
0,"user proponga un piano integrativo al presente, che funzioni dopo il ""lockdown"" fino al vaccino."
2,"come volevasi dimostrare... oplà!  la società farmaceutica americana ''moderna'' e' vicina al primo vaccino contro il coronavirus link"
0,"user vorrei ricordare che tra loro si annida anche novax e nodemocrazia."
1,"e se ottenessimo un vaccino contro il covid-19 e metà del paese si rifiutasse di prenderlo? - link link"
0,"vaccino fatto..  adesso una bella passeggiata zona zattere... link"
2,"user user jack kalman: “dopo aver letto questo studio, ci vuole l’indole di un  kamikaze per farsi vaccinare ma per far vaccinare un proprio figlio si deve aver gia’ raggiunto gli abissi della mancanza di coscienza. dal punto di vista scientifico, ogni vaccinazione e’ uno scandalo”."
2,"user user l’australia ha vaccinazioni obbligatorie vietnam e thailandia ha vaccinazioni consigliate . io sono contrario al vaccino covid . questo cercavo di far capire e non accetterò nessun tipo di imposizione ."
1,"di domenica questa è il mio pensiero....debellare,sconfingere e non imparare a convivere...non esiste vaccino ma tutti proprio tutti assieme per mandare a casa il governovirus, un governo antitaliano, incapace che sta mandando l'italia al collasso."
1,"user user user quale vaccino?.."
2,"user equazione...#covid...#vaccini..#bigpharma...sorpreso che non ne parli??spaventano il mondo perché non si vende un farmaco..allora li imploreremo di darci il vaccino covid......!
pace e bene con una rivoltella in mano ad attenderli!!"
1,"la germania nega la vendita esclusiva del brevetto per il vaccino covid-19 all�america, perch� l�azienda tedesca produttrice metter� a punto il vaccino ""per tutto il mondo e non per singoli paesi"".  cio� i tedeschi sono i buoni questa volta, how the tables have turned"
0,"studio del 2005: la clorochina è un potente inibitore del contagio da #sars
#coronavirus . lo sapevano. però niente da fare, per il #covid_19
devono trovare il #vaccino . 
link"
2,"user

i sospetti di speculazione finanziaria dietro gli annunci sul vaccino di moderna link di user_italia"
0,"coronavirus, dalla cina primi successi per il vaccino link"
1,"user non ho competenze per poter affermare nulla ma la mia personale opinione è che se mai esisterà.un vaccino efficace al sars covid_n19 sarà a base di plasma con cellule anticorpali istruite geneticamente"
2,"noi lo dicevamo che l’obbligo vaccinale sui bambini era il cavallo di troia...ma voi ci chiamate novax...
#covidー19
#vaccini link"
0,"user user user user che per un caso di morte da vaccino ci sono migliaia di vivi che devono ringraziare il vaccino."
2,"in cina lo stato acquista i farmaci dalle case farmaceutiche. nel caso il farmaco provochi un danno  riconosciuto,  la casa farmaceutica a dover risarcire, oltre a dover pagare una multa allo stato.  chinese company in vaccine scandal declared bankrupt link"
0,"tanti insistevano che brevettassi il vaccino, ma non ho voluto.  il mio regalo a tutti i bambini del mondo il 3 marzo 1993 moriva albert sabin, il medico che ide il vaccino antipolio. non lo brevett perch potesse essere disponibile a tutti link link"
0,"coronavirus, arcuri: `emergenza alle spalle solo con vaccino`  - corriere di rieti link"
1,"user una pippata di #amuchina potrebbe essere il vaccino per il #codvid19?
#propagandalive 
#amuchinalive"
2,"tg: la fase 2 inizierà tra 1 mese,
""gli esperti"": fase 2 lunga 8 mesi.
giusto il tempo per fare il vaccino,
bill cancelli dice: far circolare solo i vaccinati, e tracciarli, investe in chip e vaccini, mah... saranno solo seghe mentali, mi dicono che #andratuttobene, #covidー19"
0,"user user ho firmato l’ordinanza per rendere obbligatoria la vaccinazione antinfluenzale per tutti i cittadini over 65. una grande operazione di tutela della salute pubblica

nicola zingaretti link"
0,"user siamo qui a fare un vaccino, come per tutti i vaccini ti chiedono di stare 20 minuti ad aspettare eventuali effetti collaterali. lei vuole scappare perché non ci sta in questo posto tutti insieme (10 persone tutte minute di mascherina in un corridoio lungo)."
2,"user user user mi spiace per lei ma purtroppo pare non sia cos ma che invece il vaccino del morbillo non garantisca l'immunit e soprattutto stia facendo sviluppare un tipo diverso di virus  link"
0,"user ❤️ se è tosto come mamma, appena nasce trova il vaccino. bacio a tutti e due, bella"
1,"user ancora ad aspettare il vaccino!! ma cercate le cure subito!!! ci sono!!"
2,"user_sx_veg user user_cocco user user user user tu hai visto questo?  bambini indiani che hanno preso la paralisi flaccida da vaccino della polio?  ignorante pericoloso  link link"
0,"alcuni scienziati temono che non si troverà un vaccino contro il coronavirus, e dovremo convivere con la minaccia del covid-19 link"
1,"vorrei sapere perché si continua a dare credito solo a coloro che profetizzano nuove sventure! forieri di sfiga 1 : teste pensanti 0! perché?
il premio nobel beutler: «non ci sarà una seconda ondata del virus. il vaccino? solo a inizio 2021» link"
2,"il sindaco di rieti si fa per la prima volta il #vaccino e si becca una forte #influenza, causata proprio dal vaccino, come egli stesso ammette. link"
2,"manca personale,famiglie costrette a rinunciare alle cure ma in compenso il #vaccino  gratis e sicuro!   a nessuno viene il dubbio che della nostra salute non interessi a chi taglia fondi alla sanit e ci tratta come polli da batteria? fonte: link link"
1,"ho la febbre no, mia madre non so che ha scritto sul gruppo di classe-1itori su questo fatto. litigano da ieri discutendo se il vaccino serve o meno. ammazzatemi che faccio prima."
2,"ops !!!  ma come la scienza , i vaccini super sicuri...  chissà quante balle ci hanno raccontato lorenzin e company. chi aveva dubbi era un terrapiattista vero?   link"
2,"samoa mette al bando il vaccino esavalente nel 2018, dopo la morte di due bambini per reazione avversa al siero. niente morbillo per un intero anno. nel 2019 arriva l'#unicef e inocula 115.500 vaccini per uno dei suoi programmi filantropici. novembre: scoppio epidemico, morti. link"
1,"#america first. #coronavirus, pronta la prima fiala del vaccino: così ""uccide""  #covid19. a #seattle iniziano le sperimentazioni su 45 volontari del prototipo di un vaccino. ma prima di poter arrivare a un vaccino efficace e sicuro serviranno 12-18 mesi (g.) link"
2,"sbagliate il vaccino non ci proteggerà ci farà prendere il covid ma in una forma più lieve invece la cura che ce l'abbiamo ci va sicuramente guarire e prima quindi cosa sondaggio non è andato a buon fine"
0,"user user il mio li fa, è dal 2000 che mi vaccino ogni anno per l'influenza."
2,"1/ - lei ha mai usato bimbi di madri in prigione per sperimentare un vaccino? - s. - ha mai usato individui sotto dominio coloniale per sperimentare un vaccino? - lo ha fatto nel congo belga? - s. - l'esperimento coinvolgeva quasi un milione di persone? - be', mmm, ecco, s. link"
0,"ai complottisti, ai #novax, a chi “ è colpa di #bigpharma “ etc etc............ ma andate a cacare.
#tocilizumab #13marzo #coronavirus #covid_19 #spallanzani"
2,"gates scoperto vaccino contro coronavirus mio migliore investimento!
allarme italia pericolo africa! 

link di user"
0,"user user questa situazione non è temporanea e si risolve solo con il vaccino. saremo sempre soggetti a nuovi focolai, anche importati. se non c’è sicurezza nessuna azienda deve lavorare. se vengono adottati i protocolli di sicurezza si dovrebbe poter lavorare."
0,"#lavitaindiretta sono guido folzani di felino (pr) volevo chiedere all’esperto se per tornare alla vita come prima si dovrà aspettare il vaccino che potrebbe arrivare anche fra qualche anno. sino a quel giorno non si potrà abbassare la guardia?"
0,"per user  una delle migliori scoperte del 2015. e ora manna dal cielo per milioni di persone in africa centrale e occidentale #vaccini #ebola link"
1,"cos’è il vaccino anti pneumococco? a cosa serve e quando farlo? composizione e modalità di ...rischi, controindicazioni e risultati.
il vaccino anti pneumococco è il vaccino che serve a prevenire le infezioni da streptococcus pneumoniae (o pneumococco). link"
2,"- nesso causale tra vaccinazione esavalente e la patologia di cui soffre il minore: � quanto stabilito da una sentenza della sezione lavoro e previdenza del tribunale di lamezia terme che ha condannato al risarcimento il ?user? #vaccini  https"
0,"user sono un po' preoccupato, ma paura nessuna.
potrei prendere il covid così come avrei potuto prenderlo prima e so che lui rimarrà in giro ancora per parecchio mesi, almeno finché non sarà disponibile un vaccino (forse estate dell'anno prossimo)."
0,"primo piano e anteprima vaccino per il coronavirus, jennifer lo testa per la prima volta al mondo: «grande opportunità» link"
1,"a che punto siamo con la sperimentazione del vaccino anti covid-19? link"
0,"user_ansa cosa c'è di difficile nel capire che un virus circola se noi circoliamo? siamo in emergenza. ne volete uscire? allora si sta isolati. nessuna alternativa fino al vaccino. per colpa di scriteriati, non ne verremo fuori presto. #chegente"
0,"no vax no ask no app si traduce in si racism, si fascism? perché molti di loro mi sembrano gli stessi."
2,"se 10 100 1000 genitori affermano tutti la stessa cosa: il mio bimbo era sano fino a quel giorno maledetto del #vaccino mpr, perch voi medici/scienziati non prendete nemmeno in considerazione il nesso autismo/vaccino? lunica risposta  paura o corruzione. link"
0,"user la speranza è che sarà pronto il vaccino nel giro di 2/3mesi"
0,"user con rispetto, solo un super-coglione rifiuterebbe di farsi un vaccino a tutela della sua salute.
e, soprattutto, degli altri che gli stanno intorno, famiglia, amici, colleghi..."
2,"@_fede_6 user user o muoiono.comunque confermi che il vaccino non link plasma,al limite"
1,"coronavirus: il legale, 'per vaccini licenze gratis o consorzi aziende-istituzioni': esistono esempi di tali vaccini coperti da brevetti validi sul territorio cinese, come il vaccino contro la poliomielite, il vaccino contro la malattia 'mani- ... link"
2,"3 anni fa, user lanciava una vasta campagna d'immunizzazione contro il #morbilloi in africa centrale, afflitta oggi dalla ""pi grande epidemia di morbillo contemporanea"". o il vaccino non funziona, o - dubbio legittimo - scatena la malattia. #lascienza risponde senza insultare? link"
2,"#ivaccinisonosicuri nadia gatti: i danneggiati da vaccino sono una realt e hanno diritti che non vanno calpestati link di user"
0,"c’è l’app ma forse, boh. test sierologici, ma non si sa. trasporti? c’è l’idea ma forse non facciamo in tempo. di questo passo bisogna davvero stare in casa fino al vaccino per non far morire la gente. che è impensabile #fase2"
1,"user user inoltre, dato che molto verosimilmente le misure di distanziamento temo varranno chissà fino a quando - probabilmente anche dopo l'estate, se come molto probabile non tireranno fuori un vaccino a breve - i capi suddetti si mostrano anche abbastanza ridicoli e fuori dalla realtà."
1,"user non è cambiato nulla da marzo...non c'è il vaccino,non c'è una cura, non siamo arrivati a casi positivi 0 (in italia ce ne sono ancora 58.000 positivi che potrebbero contagiare altri...per non parlare degli asintomatici)...la fiducia agli italiano è stata data...ma... #movida"
0,"user user fermare  no, contenere sì... in attesa dell'anno che ci vuole per il vaccino, ripeto le parole di sileri"
1,"user user user buongiorno. il vaccino è importante, ma vorrei sapere con quale  ""cura"" ne sono usciti indenni dagli ospedali? di plasma se n'è è parlato solo recentemente.. grazie mille"
2,"user_piso_71 user user utilizzeresti un vaccino scoperto dall'ospedale finanziato dal cinesino social?"
1,"user solo così si può testare un vaccino dove sta la proposta choc"
0,"user strano il silenzio dei novax, forse hanno capito quanto sono stati stupidi ed incoscienti!"
1,"i fantastilioni di dosi di vaccino pronti a settembre sono solo accordi per avviare una produzione nel caso il vaccino dovesse essere efficace e sicuro.  e poi dicono che sono gli scienziati a creare confusione #covid_19 #vaccino link"
2,"altro caso di fallimento del #vaccino . epidemia di pertosse, scuola chiusa nonostante il 100% di copertura.  intanto anche oggi migliaia di bambini sani sono fuori da #scuola in italia per la legge lorenzin che nessun partito ha il coraggio di abrogare   link"
1,"user user più che la presenza o meno del vaccino, sono tasso di mortalità e lockdown a incidere sulla percezione della necessità di vaccinarsi. riassumendo: non è il senso civico o la consapevolezza a dominare la scelta, ma paura e portafoglio."
1,"user user user user user user user user user user user user user user user user user user user_ user user user user user user user user user user user buongiorno lidia. saremo anche un popolo di adolescenti ma dobbiamo crescere e non è possibile rimanere a casa fino a quando si troverà il vaccino. non possiamo permetterci di vivere di rendita . non tutti almeno."
2,"user user bravi, ma appena arriva il vaccino non siate così generosi e imparziali come altre volte e vaccinatevi per primi, magari più volte: nessuno vorrebbe che il miglior governo della storia italiana rischiasse, per eccesso di altruismo, di  essere sterminato dal vairus."
2,"tratto dal discorso di #henrykissinger al user il 25.02.09. 
si nota una certa somiglianza con gli intendimenti di user /#rockefeller , che ne è l'erede intellettuale...
ora, sotto coi #vaccini..!
#covidー19 
#coronavirus 
#covid19 
#novax link"
2,"user ma facciamo tutti un bel vaccino con un chip rfid integrato! 
ci ha già pensato bill."
0,"al loro con confronto, i terrapiattisti sono degli innocui creduloni ...
coronavirus, 'movimento genitori lombardia': ""vaccino? noi non lo faremo"" - la stampa link"
0,"vaccino e covid-19: cosa sappiamo 
una visione narrativa di cosa sta succedendo
f. marchetti, c. guiducci 
medico e bambino 2020;39(5):297-299 
link
(ad accesso… link"
2,"user user certo. ho solo preso spunto per rivolgermi a chi spera di avere un vaccino in tempi rapidi (come qualche politico, non nostrano, sta promettendo)"
0,"user user_apostata se ne è “preso” immeritatamente il merito, sono i geniali ricercatori del suo dipartimento che l’hanno scoperto, per tua info il guro dei #novax cura il cancro con l’omeopatia e parkinson e sars con la papaya ... te lo raccomando"
0,"quanto vorrei che una onesta e capace equipe italiana trovasse il vaccino anti #covid?19  ed esigesse in cambio del lavoro svolto: niente! solo la salute della popolazione mondiale. avvoltoi siete avvoltoi. �ngopp �o sang da povera gente nun guardano �nfacc�a niente�."
2,"a moe!  condannati bambini perfetti,  sani e innocenti,  discriminati a vita,  perseguitati come i sioux,  braccati da cani avidi e alla catena. che i vermi vi mangino vivi! link"
0,"user user user ah si? e qualche prova che il vaccino non serva? sti biologi e virologi con cui lavora avranno prodotto dei dati scientifici no? ci cita un paper?"
1,"coronavirus, la rete dei no vax boicotta il vaccino per il covid19: &amp;laquo;&amp;egrave; tutta una truffa&amp;raquo; link"
0,"user user i gruppi di pettegolezzi dei genitori nelle scuole, comunque gestiti (e wa è il peggio) andrebbero perseguiti per legge. come i no vax."
0,"a pensare che fino a quando non ci sarà un vaccino, dovremmo stare sempre con le mascherine non so voi, ma a me prende un po’ male, già non riesco a respirarci ora, figuriamoci d’estate."
0,"la buona notizia è che un vaccino c'è per il #coronavirus, la brutta notizia è che è riservato per i soldati usa.
#defendereurope20"
0,"e se l'app di tracciamento #immuni ti desse la priorita' nel ricevere le cure/vaccino, la installeresti? 
nota: priorita' rispetto ad una persona che ha il tuo quadro clinico. la priorita' e' data dal fatto che si sa come ti sei comportato."
2,"user poi ci sono le cure senza il vaccino, ma nessuno ne parla. link"
1,"coronavirus, da oxford 400 milioni di dosi di vaccino a settembre #calabrianotizie #newscalabria link"
2,"non si pu offrire la prole a moloch.  basta vaccini.  roba da satanisti pi o meno consapevoli. cristo non usava vaccini e ancor meno li avrebbe usati con tracce di feti abortiti, ovaie di criceto, metalli pesanti ecc... come si fa a credere che siano cose buone? link"
1,"#coronavirus, policlinico milano: con modellazione cellulare piu' veloci verso vaccino link"
0,"per ogni discussione con no-vax, complottari e affini, da tenere in mente sempre la linea guida:
""sai cosa vedono le persone quando discuti con un imbecille? due imbecilli"""
0,"#coronaviriusitalia da cittadino incazzato non comprendo come con i mega computer e le risorse a livello mondiale disponibili in termini di scienziati e di soldi non si possa creare immediatamente un vaccino. per me incomprensibile. e intanto si crepa."
0,"user io non ho alcun segno e questo probabilmente perché il vaccino fu  fatto male ma chi se ne importa? il vaiolo non esiste più e grazie a voi col tappo sul braccio.☺"
2,"breve storia triste. madre di bambino convinta che il vaccino antinfluenzale sia indispensabile ogni anno. faticosamente riesce a prendere appuntamento per lei e il figlio circa un mese fa. oggi la madre ha preso l'influenza. eh va beh, sar� per l'anno prossimo."
0,"user mamma che paura sono veramente terrorizzato, è una strage senza fine, finiremo tutti in ospedale e metà della popolazione italiana morirà senza aver possibilità di essere curati. è una disgrazia enorme e dobbiamo tutti chiuderci in casa fino a quando non ci sarà un vaccino"
0,"bill e melinda gates dicono che pagheranno tutte le spese per un vaccino contro il #coronavirus. ovviamente tutti i commenti sono critiche contro il vaccino o contro di lui che è un potente che cerca di controllare il mondo. la gente il bene non se lo merita, bill goditi i soldi."
0,"user_maurizio hai ragione. restiamo chiusi fino al vaccino. sigillati in casa. così non risalirà mai più. tu hai una partita iva per caso?"
0,"user purtroppo c’è stata una sottovalutazione mostruosa......
speriamo che il vaccino sia trovato al più presto!!"
2,"morte da #vaccino. art. 5 convenzione di oviedo - un intervento nel campo della salute non pu essere effettuato se non dopo che la persona interessata abbia dato consenso libero e informato. usate i vostri diritti inalienabili. link"
0,"user user user allora bisogna stare reclusi in casa da soli per più di un anno? (tempo stimato per la messa in circolazione del vaccino). il virus c'è e resterà non se ne va se restiamo in casa!"
1,"bill gates chiamerà conte sul vaccino per il coronavirus link"
2,"user user user user_di_marzo user_gori ma questa è una malattia che non dà immunità,  e quindi non sarà un vaccino a risolvere il problema"
1,"coronavirus: al via sperimentazione vaccino di 'takis' sui topi. in autunno sull' uomo link"
2,"user_italia non lo vogliamo il vaccino fatelo voi al cervello, ne avete bisogno."
1,"coronavirus: il vaccino in un anno in poche settimane test sulluomo -  #coronavirus: #vaccino #poche  link"
0,"p.s. vivo in una provincia che ha 23 casi accertati mentre quelle limitrofe ne hanno centinaia, come ad esempio la provincia di #bergamo che ne ha circa 800.

grazie per aver affidato questa situazione al #buonsenso di #novax, #terrapiattisti e #complottisti!!!

#covid19italia"
0,"user_____1 user_ronchetti user penso intendesse sul totale delle malattie. sono moltissime quelle senza un vaccino. attenzione, non si sta dicendo che siano inutili e non vadano fatti."
1,"quindi riepilogando chiusi per un mese in casa a cantare dai balconi. ora per esigenza di qualcuno e qualche business, senza una vrenzola di cura che allevia il male per non finire in terapia intensiva, il vaccino si riapre con mascherina e guanti.
a saperlo facevamo la pasquetta"
0,"user user per tutte quelle malattie ci sono i vaccini. se tu non sei una no vax puoi stare tranquilla. se invece sei no vax allora ti ammalerai."
0,"#liguori: ""in questa vicenda del virus ancora non sappiamo nulla. non solo siamo lontanissimi dal vaccino ma ancora non abbiamo individuato i farmaci. stiamo sperimentando. mentre si mente sui numeri"".

#staseraitalia"
0,"user eh, sarebbe bello. purtroppo prima che il vaccino diventi disponibile fanno in tempo a fare ammalare troppa gente"
1,"(vaccino coronavirus, il ministro speranza firma accordo per 400 milioni di dosi)  playhitmusic - link link"
0,"user purtroppo sarà lunga arrivare ad una cura o ad un vaccino."
0,"user guarda ho fatto una discussione con un 5 stelle. diceva che è una ex.
gli ho fatto presente che è da sempre una no vax pazza e che è entrata in parlamento per colpa loro
niente, non la capiscono"
0,"i no vax non si arrenderanno mai link"
1,"1/2 senza entrare nel merito delle diverse teorie sulla diffusione del virus, quello che emerge unanimemente � che l�isolamento da solo potrebbe non bastare. potremmo dover aspettare il vaccino. la produzione di macchinari per la rianimazione/ventilazione �  l�elemento critico."
1,"trump vuole vaccino tedesco in esclusiva - ultima ora - ansa link"
0,"#coronavirus: un vaccino potrebbe essere pronto a settembre secondo la scienziata che lo sta sviluppando a #oxford link"
0,"user purtroppo ormai più o meno tutti sono concordi: fino al vaccino si può solo tamponare"
1,"panico meningite nel bergamasco: code dallalba per fare il vaccino in arrivo la protezione civile link"
0,"(scusate l'ignoranza) mi spiegate l'utilità di far parlare panzironi in questo periodo così difficile(con la gente chiusa in casa) non bastavano le bestialità dei novax ascoltate negli anni scorsi #nonelarena irresponsabili!!!"
1,"la germania ha introdotto lobbligo del vaccino contro il morbillo per gli studenti e i bambini degli asili nido link"
0,"user bisogna essere sicuri che nel vaccino non c'è il microchip!11!!1!"
0,"sentivo proprio la mancanza di qualche novax di stocazzo."
0,"user stessa condizione ""clinica"", ma quando uscirà il vaccino per il #covid lo farò, non per me, ma per tutelare le persone vicino a me che, magari, non sono altrettanto sane.
è la ragione per cui in giappone, chiunque abbia un minimo di raffreddore, mette la mascherina. civiltà..."
1,"coronavirus, vaccino entro fine anno: «ma non sarà per tutti, prima anziani e medici» link user"
2,"se combatterete per la vera chiesa cattolica contro l’impostura luterana massonica di bergoglio in accordo con il piano massonico della falsa pandemia covid-19, come pretesto per codificarvi con il falso vaccino vincerete perché cristo sarà con voi! link link"
0,"coronavirus: ministro bellanova “rischio zero solo con vaccino”.
vivaddio!! user 
 link via user"
2,"user io sono contro questo vaccino, in particolare. il vaccino viene fatto con le stesse cellule del virus, il covid-19 è un misto tra la cellula del pipistrello e quella del topo. farmi iniettare questo schifo mi fa orrore. bisogna ribellarsi a questo vaccino."
2,"user user user user si parla di dosi vaccino, non di bambini vaccinati e la cosa cambia di molto. esempio, in america gi� la prima vaccinazione comprende pi� dosi in una sola seduta, spesso senza tener conto delle condizi"
2,"se sono sicuri,perch chiedere l'immunit?  fatevi una #domanda    s da un'epidemia hanno solo da guadagnare e nulla da perdere ,cosa succeder? link"
0,"focus coronavirus - #cura e #vaccino, risultati promettenti dal fronte medico/scientifico - link #tg24 - link - #coronaviris link"
2,"nessuno ha mai trovato un vaccino per l hiv     diamo.soldi a palate a ricercatori ma mai visto vaccini"
1,"i morti sembrano pochi ma stavano meglio prima, i contagiati sono sempre 1500 al giorno e il vaccino non c’è. state a distanza, pensate alla salute, non date retta alle idiozie della #meloni e di #salvini e guardate qualche partita di #calcio anni 60"
1,"#coronavirus, #speranza: “contratto con #astrazeneca per 400 milioni dosi #vaccino a europa” 
link"
0,"user e' posta male la domanda. 
a- non sto producendo io il vaccino, quindi non posso essere certo che andrà in porto.
b- sono certo però sull'obbiettivo: depotenziare il coronavirus che uccide ancora oggi tantissime persone."
