2,"user se è una bufala tanto meglio, in caso contrario spero che possa strozzarsi con il suo fottuto vaccino!"
2," user: il vaccino anti influenza � gratis eppure la maggior parte dei dipendenti della asl lo rifiutano: un perch� ci sar� e noi�"
2,"user_belotti78 user un vaccino? ma se il virus muta"
0,"user user user speriamo che il vaccino a tempo record sia fuori per la prossima stagione invernale. senno si  rischia altro giro..."
1,"covid-19, allo studio un vaccino che si somministra con un cerotto - il sole 24 ore user link"
1,"nel #vaccino antinfluenzale quest'anno c' anche un po' di lattice per arginare il noto virus roccosiffredus. [_c.colombo] link"
0,"--- magari un richiamino ogni tanto --- #covid2019 
10 anni prima: ""di vaccino si può morire"" link di il blog di beppe grillo"
1,"user e se magari, prima del vaccino, arrivasse una cura? non é la stessa cosa, ma sarebbe una gran cosa. ed é meno complessa."
2,"user caro ministro sa dove se lo deve mettere il vaccino? vuole un disegno così capisce meglio... buona giornata"
2,"user proprio ora che sta scomparendo il virus pagate un vaccino?"
0,"user user_ user user_fc1969 user e per lei è normale che un bambino rischi di morire, ad esempio, di morbillo? o che vada a scuola e magari infetti altri bimbi? se questo è normale allora diciamo che se il suo bambino o lei o altri si ammalano per non avere fatto il vaccino la sanità pubblica non ne risponde ."
2,"user scuola italiana menefrega.
oramai fa solo schifo. ma da mo...
e' il vaccino che mi preocc."
2,"user bene, si vaccini pure col nuovo vaccino a rna inattivato (per non parlare  di altra schifezza che c'è  dentro) non sperimentato a sufficienza per cui le cavie saremo noi.  voi non potete  obbligare nessuno!  trattato  di oviedo."
1,"user la gente vuole stare a casa. non sente cazzi.  li hanno terrorizzati talmente bene che i cervelli sono andati completamente in pappa. la fake news sugli aumenti degli infetti in germania, quella sull’immunità di gregge di johnson. niente. stare a casa e aspettare il vaccino."
2,"user_ozymandias user stando alla logica dei vaccini, un vaccino per il corona virus non è neppure possibile, perché non è una malattia che dà immunità, cioè la puoi prendere più volte ed è mutante, muta velocemente."
1,"#coronavirus, patto commissione #ue - produttori per #vaccino. 2,4 miliardi per acquisti in anticipo con accesso garantito a farmaco
#ansa
link"
0,"user user user ebrei: ‘galilee reasearch istitute’ (migal) di israele ha annunciato di aver raggiunto “risultati scientifici” tali da poter “portare alla rapida creazione di un vaccino contro il coronavirus”.
alla meloni lo danno solo se va ad auschwitz...convinta!"
2,"user bolgan: negli over 65 la vaccinazione causa più complicanze e decessi.
link"
1,"coronavirus, dalla ripresa al vaccino. l'esperto spiega la fase 2 link"
1,"user user user user user user non sono io che studio ad oxford, ma mio cognato che e'  mrc wimm leader al radcliffe department of medicine. al di la' di cio' e' stata la stessa oms a dichiarare che un vaccino non sara' distribuito prima di 12 mesi nella migliore delle ipotesi. burioni e' un megalomane, punto"
0,"oms, ricciardi: “senza vaccino il virus circolerà ancora, bisogna tutelare la salute di tutti” link di user"
2,"user vi hanno terrorizzato! vaccinati a vita e per cosa? iniettare farmaci ai vs. bimbi senza nessun criterio. ci hanno inculcato l'idea del #vaccino come panacea di tutti i mali ma e' e rimane un farmaco con rischi e pericoli..si chiede solo di poter scegliere."
2,"user user_ansa una marmaglia di politicanti che dopo aver fatto ammalare milioni di persone, morire decine di migliaia, in itaglia, ora vogliono imporre il vaccino?"
2,"user user lo dice anche quest'altro studio, che chi fa il vaccino influenzale, aumenta il rischio di prendere il contagio da altri virus, incluso il coronavirus, dai 4 alle 5 volte.  link link"
1,"vaccino, ecco perché non sarà per tutti. la sanofi ha già promesso le prime dosi agli usa link di user"
0,"user nei commenti un'intera platea di fasci, bandierinati e no vax. merda a perdita d'occhio."
2,"i medici hanno scoperto quelli che credono siano i primi casi noti di meningite dovuti alla riattivazione del vaccino contro la varicella in due ragazzi di 14 anni che hanno ricevuto entrambe le dosi raccomandate, secondo un articolo della rivista pediatrics link"
2,"user son tutti cos� allucinati dal terrorismo mediatico assorbito che appena esce il vaccino sgomiteranno x farselo facendo non solo un passo inutile (non esiste vaccino x un virus che oltretutto muta di continuo) ma prestandosi a farsi inocul"
0,"borsa: tokyo, apertura in netto rialzo. fiducia su capacità ripresa economia, avanzamento vaccino #ansa link"
2,"mi pare che sia essenziale indagare sulla letalità del covid 19 nella zona di bergamo nell'ipotesi che la concomitanza del vaccino antinfluenzale e di quello anti meningococco abbia mandato in tilt il sistema immunitario!!!"
2,"i danneggiati da vaccino sono troppi! ll dato riportato  una stima per difetto; mancano infatti coloro che, pur riconosciuti danneggiati, non sono stati indennizzati perch le relative istanze sono state presentate in modo intempestivo. link"
2,"user si purtroppo, dopo la telefonata conte gates negli ospedali di mantova e pavia dove la terapia da immunoglobuline ha salvato diversi pazienti sono intervenuti i nas, pare quasi una minaccia a cure alternative se non al vaccino gates.
qui gatta ci ha covato"
0,"user hanno trovato il vaccino ,che spettacolo!!!!!"
1,"inovio: il vaccino per il coronavirus finanziato da bill gates link"
0,"bull gates: ""se il vaccino funziona, lo finanzio per tutto il mondo"". mica candeggina. #covid19 #coronavirus #billgates"
1,"vaccino covid, ema: pronto entro un anno salvo ritardi burocratici link"
1,"user ammettiamo che sia corretto: non abbiamo una diagnostica e non abbiamo una cura preventiva (vaccino). 
allora dovremmo potenziare con tutte le nostre forze il ssn! ma siamo a livello di 30 posti in più di t.i. in toscana, cioè nulla! 
è assurdo!"
0,"coronavirus, l`ultimo delirio dei no-vax: `il vaccino? rischia di fare danni` - link link"
2,"fanno il vaccino antinfluenzale, poi si ammalano e prendono l'influenza, alcuni purtroppo muoiono, e nemmeno si fanno domande.  si puo' morire d'influenza a 11 anni...no,  si puo' morire iniettandosi sostanze neurotossiche...si.  link link link"
0,"user user ah giusto. voi siete quelli che si prendono super sul serio e che poi si alleano con i novax. però in giacca e cravatta."
0,"user non è il virus che ha perso forza, è l’uomo che è più “forte” a combatterlo. col lockdown, le mascherine, il distanziamento, le diagnosi precoci, le terapie più mirate..forse un giorno muterà e si trasformerà in un virus del raffreddore.  un giorno. forse prima avremo un vaccino"
0,"user user per quello la gente fa il vaccino per l’influenza!!! cea gente non può permettersi di avere un’influenzaaaaaaaaa"
0,"non vedo l'ora di spararmi un vaccino nuovo di pacca."
1,"covid-19: parte negli usa sperimentazione #vaccino a mrna | #ecm link"
2,"user user ha una sua logica, ti infilano il canone in bolletta, e ti infilano il vaccino nella merenda a scuola."
2,"siete contenti?
il vostro presidente del consiglio ha trovato il vaccino ed ha trovato anche i soldi..sveglia! a questi di noi non interessa niente!"
1,"ma voi ve lo ricordate quando dicevano che avrebbero trovato il vaccino per l’ aids?"
2,"user user_meluzzi ridurre la popolazione mondiale questo e' il progetto non ci sono riusciti col covid ci proveranno con un vaccino creato velocemente con sistema di nanotecnologia"
1,"deputata no-vax in direzione mare multa in arrivo | bassano link"
0,"annunciati oggi i primi risultati promettenti di un candidato vaccino covid 19 link"
0,"user almeno per il covid possiamo trovare cura e vaccino"
1,"coronavirus, parla l’esperto: test del vaccino in 2-3 mesi. le ultime novità link  11/02/2020"
1,"#vaccino #modernainc 
l'annuncio, ovviamente, è stato premiato dai mercati finanziari e a wall street l'azienda biotecnologica  americana guadagna il 23,78% a 82,73 dollari. - see more at: link 
#covid19"
0,"user 2021 il tempo che ci vuole per il vaccino"
2,"link
ragazzi il vaccino che dicono di stare a testare non è affatto sicuro ascoltate dal 20 minuto"
0,"user user user user user_dibattista user spero ci toglieremo di torno tutti coloro che agiscono malamente (per incapacità o per altri motivi). voi affidatevi ai novax, mi raccomando."
2,"user esempio di presa in giro,-per il coronavirus può essere utile iniettarsi del disinfettante- tutta la stampa indignata e poi ti accorgi che gli ingredienti comuni per il vaccino sono: 
 thimerosal - disinfettante 
 formaldeide - disinfettante"
2,"lâindustria della vaccinazione, storia e contro storia - pietro ratto #byoblu24 link 31"
0,"virus sparito? come lo vede e quando? perché non ha ricordato il vaccino? è forse contrario?"
2,"user si dia pace...oramai i soldi per il vaccino li avete impegnati...vorrà dire che lo distribuirete come avete fatto nel 2009 con la suina...ai paesi del terzo mondo...suvvia...dei poveri cristi...li trovate da bucherellare!
user"
2,"user siamo stati benissimo con i loro negozi chiusi. credo che la vera pandemia la vedremo con il vaccino!!!"
2,"user user user user volete la verità su vaccini?
allora non si sputa su l'unica forza politica che ci ha provato, ma si incita, si aiuta chi da soli lotta o si è arreso a combattere il gigante. altrimenti mi indichi quale altra forza politica ascolta i no vax?
nessuno?"
0,"user_the user e ogni paese è libero di decidere se far entrare chi ha un vaccino e ogni torneo può decidere che per iscriversi bisogna essere vaccinati.
non vuole vaccinarsi,non giocherà. non vedo il problema"
1,"attenzione a dire antivirale e non vaccino che scattano subito le faide"
0,"user user_domenico user user user user_cersei user l’obbligo del vaccino diviene necessario quando i genitori smettono di vaccinare i figli. qui può vedere la relazione tra copertura vaccinale e casi di morbillo. se eliminassimo il morbillo non si farebbe più il vaccino, come per il vaiolo link"
1,"user quindi stiamo a casa per altri 6/7 mesi? non c’é vaccino non c’é niente. per evitare il contagio di ritorno possiamo fare così, chiedo eh. l’esercito..."
2,"user user user user user fattelo tu il finto vaccino."
1,"coronavirus: coletto, l'università di perugia ha competenze per vaccino link di user"
0,"coronavirus, ecco come si sta cercando il vaccino: ``l`iniziativa in termini di portata e velocità è davvero senza precedenti nella storia`` - il dolomiti link"
0,"user sani finché durano, grazie a tutti gli altri che si vaccinano. poi la tua prole diventerà untrice e onestamente merita di stare chiusa in un posto dove non può nuocere. è diritto di tutti rifiutarsi di condividere spazio con una bomba batteriologica figlia di una pancina antivax."
0,"user prevedo lo stesso scenario qua dopo il 4 maggio
senza vaccino l'unico contenimento è l'isolamento sociale"
2,"per tutti i fans del vaccino, ecco tutte le info per essere i primi a testare questa meravigliosa scoperta scientifica.  dove sono i #novax? sono impegnati a ordinare quintali di popcorn. ???????????? link"
2,"conosciamo pi da vicino, chi ci potr vendere il vaccino e cura contro il coronavirus? case farmaceutiche, gli scandali delle lobby tra venditori e mazzette link di user"
0,"user non metterò mai più piede lì finché non troveranno un vaccino ..... questo ‘piano’ è un suicidio organizzato di massa ‘’ preparatevi a perdere i vostri cari ‘’ ma sti cazzi"
0,"un certo ""giornalismo"" � l'arma di distrazione di massa di certa ""politica"".  dove sono i demagoghi pro #novax #freevax? perch� cari accattoni di voti non andate in tv ora a dire:alla ""gggente"" va garantita la libert� di scelta se vaccinarsi o no? #coronavirusitalia #coronavirus"
1,"#borisjohnson tiene viva la sua teoria di lasciare che il #covidー19 si diffonda in attesa dell'immunità di gregge.

burioni: « non ha senso parlarne perché non abbiamo un vaccino e non sappiamo se l’infezione conferisce immunità ».

boris ma continui ad essere scemo forte però."
2,"user user finalmente qualcuno ha capito e ti dirò di più, quando avverrà il g20 a breve, come d'incanto arriverà il vaccino."
0,"user user user scommetto un gelato che se gli scorri la tl ci trovi tutto il cucuzzaro #novax, #no5g, #qanon.
il pacchetto ""cazzate complottare per babbei"" è unico."
0,"user user user tu non sei una pecora , sei un asino calzato e vestito .  no vax, no mask  e tutti gli irresponsabili idioti che la pensano come te , estromessi dal ssnazionale . così vi curerete con le vostre stronzate , senza pesare sui fondi della collettività in cui non vi riconoscete ."
2,"vaccino covid-19, sindacato dei militari: no a sperimentazioni su forze dell'ordine o personale sanitario militare. no a nuove morti bianche link via user"
1,"coronavirus, fauci al senato: ""morte e sofferenze se riapriremo usa troppo presto"". il vaccino? ""fra un anno o due"" link link"
0,"vista cos�, quando si dir� di vaccinarsi perch� c'� stato un morto di morbillo, quando qualcuno dir� ""ma � morto con il morbillo non per il morbillo"" nessuno dovr� chiamarlo ""folle antivaccinista"". giusto? perch� il ragionamento (stupido) � lo stesso."
0,"user user user ma quale complotto mondiale? ma le hai viste le coperture? i dati, non le chiacchiere dei giornali. i no-vax sono un fenomeno esistente giusto sui media e gonfiatissimo cionondimeno è stato cavalcato per introdurre un nuovo concetto di libertà che per ora non fa paura. per ora..."
0,"comunque la frase ""andrà tutto bene"" sta iniziando a starmi sul cazzo. siamo sinceri, qua andrà tutto bene solo quando si troverà una cura ed un vaccino contro il noto covid..."
1,"trump vuole comprare il brevetto del vaccino tedesco per il coronavirus ‘in esclusiva’ - il riformista link"
1,"user user te lo dicono i virologi che prima di 18 mesi non sarà pronto il vaccino, che prima di ottobre è difficile tornare alla normalità e che non si può escludere l’ondata di ritorno ... fatti due conti e vediamo dove arriviamo."
1,"vaccino coronavirus, ema: aspettare ancora mesi per gli studi clinici link"
0,"user user non ci sono contagiati perché siamo tutti in casa al sicuro. se dovessimo uscire tornerebbero i morti alle stelle. ancora non c'è sicurezza. ancora non c'è un vaccino."
0,"mettono la bandierina italiana, fanno i sovranisti e poi denigrano la mia regione lazio ke nonostante tutto è + avanzata rispetto ad altre, stanno sperimentando anche un vaccino dalle mie parti. bravi continuate a nutrirvi di meschinità meridionale e di altezzosità settentrionale"
2,"ma  meraviglioso! non appena l'oms annuncia la pandemia, che consente di vaccinare senza fare i test, ecco pronto il vaccino pi veloce del west! pronti a farvi bucare, topi italiani? ???? link"
2,"""perch ho bisogno di uno studio medico? se l'80% dei genitori di bambini con autismo regressivo nella mia pratica afferma che il loro bambino ha reagito dopo il vaccino mmr, perch ho bisogno di uno studio medico?"" dr. douglas hulstedt link"
0,"user è il sospetto di molti! c’è anche il fattore invidia ovvero che un non accademico abbia messo a punto una cura telativamente semplice ma soprattutto efficace. certo che servirà il vaccino ma nel frattempo per non far morire i pazienti la terapia al plasma funziona!!!!!!!!"
0,"user da quando siamo nati tutti abbiamo fatto almeno un link miei tempi si vaceva alle elementari quello con i 4 buchi e poi chi ha fatto il militare si ricorda la puntura sul petto? comunque  il perché siamo rimasti tutti in casa e usiamo la mascherina?"
2,"user user naturalmente non poteva mancare la raccomandazione finale: vaccinazione di massa."
0,"user tieni comunque conto che verosimilmente prossimo o fra qualche anno diventerà l'influenza stagionale.
ma avremo il vaccino (speriamo).
e come quest'anno, credo che lo farò.
voi?"
1,"tutti alla ricerca vaccino covid, nuovi test e fondi. alleanza ue per le forniture - metropolisweb link"
0,"- negli ospedali sono ricoverati solo italiani, perché non ci sono immigrati ?, forse perché sono vaccinati contro la tubercolosi, il vaccino ha durata circa 20 anni e quanti di noi si è rivaccinato ?"
1,"la virologa ilaria capua: 'se questo virus si comporter come il raffreddore non servir un vaccino' link"
2,"user_cocco user se il vaccino è un obbligo anche l'assistenza dello stato per chi ha subito danni dal vaccino dev'essere un obbligo. o deve investire sulla prevenzione!"
1,"il vaccino tedesco anti-coronavirus verrà a breve testato
#germania #coronavirus #vaccino link"
2,"user hanno paura di perdere gli affari del vaccino"
0,"vaccino covid-19 sanofi link"
0,"fra 7-8 mesi all�uscita del vaccino per #coronavirus voglio vedere chi non lo far�. intanto per� l'atteggiamento contro i #vaccini porta molte persone a non vaccinarsi, per l'influenza e abbiamo avuto molti decessi. con la salute non si scherza.user user user"
0,"in occasione dei suoi 20 anni di attivit, chiediamo user, lalleanza globale per i vaccini, un maggiore impegno affinch 55 milioni di bambini abbiano accesso al #vaccino anti-pneumococcico ora che finalmente  disponibile una versione pi economica.    link"
2,"user “non avete alcuna scelta” ecco cosa dice bill #gates, a proposito del #vaccino per il #covid19 
link"
0,"user lo sappiamo tutti che non sara facile e le nostre abitudini cambieranno radicalmente. almeno fino al vaccino..."
0,"“a tutte le persone che nel mondo non volevano i vaccini, ecco a voi un mondo a cui manca un vaccino.” #covid_19 user"
1,"volano in borsa le aziende farmaceutiche che stanno studiando il vaccino - link link"
0,"user ma se pensi di essere costante (la cura dura 2 anni) vai col vaccino. da subito risolvi il problema e poi non ci pensi più."
0,"emergenza - sospesi screening oncologici e vaccinazioni contro il papilloma virus. è gravissimo [leggi, di adriana bonifacino]  link #edicola"
1,"user user l'eccesso di vaccino obbligatorii provo fenomeni radicali di rifiuto, è naturale."
2,"user sembra dicono che in spagna super vaccinazione antinfluenzale nel 2019 sono messi male guardate questolink
un dottore con le palle"
1,"mentre il #governo #conte #renzi #zingaretti #dimaio #m5s non contiene il #coronavirus, #netanyahu e #israele produrranno il #vaccino, hanno gi un test rapido e monitorano gli infetti col #mossad e se sgarrano galera seria.   link"
0,"i nemici del “#vaccino dei popoli”. l’accesso sostenibile ai farmaci #covid19 segnerà il crinale di una guerra ad alta densità geopolitica. in gioco c’è il diritto alla salute. la rubrica di user link link"
1,"vaccino si o vaccino no nei pazienti oncologici?  #vaccino #influenza #tumori #oncologia link"
2,"il dr. john bergman  svela che il vaccino antinfluenzale : diffonde il cancrolink link"
1,"a fine aprile cominceranno i test sull'uomo del vaccino anti coronavirus
via user link"
1,"user per il vaccino bisogna aspettare più di un anno, se tutto va bene!"
0,"user__ user user lo so che non vedi differenza. ma c'è il metodo scientifico. prevede la verifica da parte della comunità scientifica di scoperte/teorie. nella storia della scienza, gli eretici geniali veri, sono alla fine stati riconosciuti dalla comunità scientifica. non credo per i novax"
0,"mi fa male il braccio dove ho fatto il vaccino antinfluenzale, forse sto diventando autista."
1,"blog post: a pomezia sperimentazione vaccino - link"
0,"anche le teorie più assurde e strampalatempalate che fino a ieri si esibivano come una medaglia.
coerenza vorrebbe che per loro, cura e vaccino, siano negati.
&lt;continua&gt;"
0,"user user user user user fosse per i no vax ancora staremmo  a morire di vaiolo."
0,"user_keno0 user il risultato è che così perdono credibilità  e autorevolezza e in un paese di novax e complottisti è rischioso. vanificano anche il lavoro di tanti ricercatori e medici che si fanno il mazzo non apparendo in tv"
2,"pronostichiamo un allarme ebola in tutto il pianeta.  bisogner fare presto.  se non paghi la licenza ti becchi il virus. link"
0,"user user user user user ma dai? giulio tarro dice così? il medico che è contro tutti i vaccini da una vita? oltretutto, un noto antivaccinista dice che ""potrebbe"" essere inutile? siamo seri dai...le fonti bisogna cercarle affidabili..."
0,"pensate a quanto sono stronzi tutti quei medici e tutti quei ricercatori che da due mesi si stanno ammazzando per trovare un vaccino per il #coronavirus, quando per guarire basta un’iniezione di disinfettante.

#mrvirulent #trump"
1,"user user non mi interessano i vaccini. sto solo dicendo che qui si sta ammalando anche chi non ha mai visto un vaccino in vita sua"
0,"user ma come si fa a pensare che basti questo? i ragazzi sono sempre vicini vicini, riaprire le scuole con virus in giro e senza vaccino vuol dire strage"
0,"user ma senza medicinali che risolvano realmente i sintomi più gravi, senza vaccino, con gli ospedali pieni o giù di lì...
quali sono le aspettative?"
2,"user user_meluzzi vaccinatevi voi, io voglio una cura non un vaccino."
0,"user finché non si troverà un vaccino??cioè in casa per 18/24 mesi? siamo seri. ci sono problemi di vario tipo, forzando la quarantena. fra i tanti,la bomba sociale che esploderebbe se continuassimo a stare chiusi in casa.seguo le regole in modo ligio, ma non si può andare ad oltranza"
0,"grande risultato di una eccellenza scientifica italiana. l�istituto spallanzani ha isolato il #coronavirus   adesso la via per il vaccino � pi� breve. in alto mare invece l�isolamento dell�#idioziavirus. si camuffa e si trasforma miliardi di miliardi di volte in un secondo."
1,"vaccino pomezia-oxford, la gran bretagna prenota 30 milioni di dosi link"
2,"fa il richiamo vaccinale contro tre infezioni batteriche. muore a causa di un infezione batterica dopo aver fatto il vaccino.  colpa dell'infezione batterica spuntata dal nulla. come morire pugnalato,  colpa del coltello, ovvio ???? link"
2,"al vertice mondiale sulla sicurezza dei vaccini dell'oms hanno fatto rivelazioni sorprendenti:  i vaccini possono essere mortali   gli studi sulla sicurezza sono inefficaci   il monitoraggio della sicurezza  inadeguato  gli adiuvanti aumentano il rischio  link link"
0,"user user e gli immunodepressi che non possono fare il vaccino? se lo stato ragionasse come voi, avremmo ancora il vaiolo e la polio."
0,"user è un casino così, ok che abbiamo da ieri contagi zero come città, però alcun tipo di vaccino ancora... boh sono perplesso."
0,"user user non solo novax, tante altre belle cose, in bocca al lupo!"
1,"melfi .bimba di 2 anni muore in ospedale dopo il vaccino esavalente: il ministro grillo invia gli ispettori       link link"
1,"user user chi ha riconosciuto la risposta adeguata? i 34k morti? la metà in lombardia? basta vantarsi! perchè il germania e francia hanno reagito meglio? 
un accordo per un vaccino che non esiste di cui non si sa nulla non le laverà la coscienza.
fuori i dati."
2,"il virologo tarro: “coronavirus, il vaccino non serve"". e attacca burioni link"
2,"sciacalli in corsa per il brevetto. la corsa al vaccino vale 30 miliardi: i favoriti sono le star delle borse. | rep link user"
0,"user_e user user user ha fatto dell'ironia sul delirio novax. lei invece è arrivato insultando e pretende che le venga risposto educatamente?"
2,"user arcuri deve iniettarsi il vaccino prima lui,poi i suoi figli e la moglie ,i suoi nipotini ,dopo un anno da questa sperimentazione...forse potremmo fare il vaccino"
0,"user dovrebbe servire per preparare le “armi di difesa” e renderle disponibili a tutti. intanto che le “armi di offesa” (vaccino) siano pronti."
0,"user user i novax sono dei ritardati mentali usciti da una caverna del medioevo. si curassero leggendo la bibbia e non osino bussare ad un ospedale frutto di ricerca scientifica."
0,"forse sono io scollegata dal mondo ma ho come l'impressione che non appena uscirà il vaccino gran parte di quel 40% all'improvviso cambierà idea, non so ecco."
0,"coronavirus, bill gates: ""vaccino? se funziona lo pago io"" link"
0,"user io e te siamo più furbi appena esce ci si fa il vaccino
^  ^"
2,"user salvini chiami tarro in tv e finiamola con questa farsa
avanti. vogliono vendere vaccino che non può funzionare contro questo virus.
chiami tarro e fate uno show in streaming.
forse dell'ordine stanno delirando....elicotteri x scovare gente che prende il sole quando fino"
2,"""ammalato di tumore all'orecchio, ex dipendente telecom vince la causa: ora usa solo auricolari con il filo""  in questo caso la consulenza medica del tribunale  corretta o, come nei casi di danni da vaccino, dobbiamo pensare che non siano degli esperti? link"
2,"le sequenze genomiche dei vaccini utilizzati sono composte da intere sequenze di genoma umano, proveniente da aboi. geni anormali, deformi. 560 di questi, legati all'insorgenza del cancro (nei commenti audio da ascoltare) link"
1,"user user user l suo nome è (per ora) chadox1 ncov-19: ecco il vaccino di oxford che ""parla"" italiano
link
da prendere con le molle"
2,"user user purtroppo l'ho letto pure io. colpa del richiamo per il vaccino della meningite."
0,"user user user certo, ma io credo che sia stato fatto un po' di bullismo"", passami il termine, su questa pratica. ora stanno iniziando anche a modena a sperimentarla.. i medici dovrebbero ssere contenti.. cura più adatta fino all arrivo del vaccino."
2,"invito alla vaccinazioneeee? ma vaccinatevi voi, i vostri figli, amici, conoscenti e parenti entro il quarto grado! link"
0,"user_a_v_76 user non c'è una cura e penso non ci sarà (solo il vaccino), la cura sono i tuoi anticorpi"
