1,"vaccini: fontana al via hub tra i più imponenti deuropa -  #vaccini: #fontana #imponenti #deuropa link"
2,"robert f. kennedy jr. su pfizer e fda: „ questo è uno schema sinistro per imporre un vaccino gravemente difettoso che ha già fato la storia con morti e feriti, che non previene né la malattia né la trasmissione e non migliora la mortalità“."
0,"ad ottobre, quando ci rinchiuderanno nuovamente, ricordate che quel 30% in meno di efficacia del vaccino può comunque fare la differenza! quindi vaccinatevi!
perché anche per delta, con il vaccino per lo meno non muoio, senza non so! sappiatelo!
#greenpassobbligatorio #pfizerdown"
0,"tutti voi che state ironizzando sul #deltaplus #deltavariant... ma l'avete fatta almeno una dose di vaccino? no perché nel caso non sareste nella posizione giusta per fare dello spirito."
0,"tu provi a far finta di niente, a mantenere la calma poi sti novax si paragonano agli ebrei durante la seconda guerra mondiale e ti vien voglia di prenderli a sberle tipo mulino a vento."
0,"user non lo direi neanche di un medico fumatore se non fuma in faccia ai suoi pazienti. i vaccini non sono solo un bene per la propria salute."
2,"basta tutti testimonial di vaccini e case farmaceutiche"
0,"user vaccinazioni non se ne parla manco morti?

il lockdown è l'alternativa al vaccinarsi ... senza vaccini si va in lockdown ... con i vaccini il lockdown è una inutile vacanza!:pouting_face:"
1,"gds: ""#sicilia. vaccini in farmacia, si parte il 15 luglio""
link"
1,"user urge una legge contro l’odio verso chi vuole le restrizioni ai non vaccinati che odiano i vaccinati che… insomma, urge una legge :face_with_rolling_eyes:"
1,"covid, al via le vaccinazioni per caregiver e familiari di soggetti fragili: ecco chi rientra nella categoria link"
1,"limes:carta: la distribuzione dei vaccini link 25"
2,"user user i testimonial come lui  e  affini dovrebbe pubblicare i titoli anticorpali prima e dopo il vaccino. così, giusto per confermare che sbadatamente  loro non abbiano ricevuto il placebo .lo facciamo perché ci teniamo tanto alla loro salute e alla scienza"
2,"10€ sulle rsa chiuse per altri motivi con l’articolista che ha buttato gli 87 non vaccinati nel titolo per fare sensazionalismo."
1,"“a palermo c’è una evidente escalation dei contagi, in particolare per la diffusione delle varianti, più aggressive. abbiamo i primi casi di virus in soggetti già vaccinati."""
1,"vaccini covid lombardia, moratti: “i pazienti vulnerabili possono aderire con il sito delle poste” link"
0,"user user user alle persone (e i governi) che si stanno sbattendo x affermare il privilegio di chi è vaccinato su chi no, che i vaccini a)non sono una cura, b)senza test and track servono a poco, c)non devono discriminare aree geografiche e gruppi di persone d)vanno resi disponibili globalmente"
0,"user user user user_kuzzo cosa c’è di non chiaro nell’affermazione “i vaccini non proteggono dal contagio ma da sviluppo di forme di malattia gravi / morte” iniziate a sembrare seriamente deficienti a riportare ste notizie."
1,"user_cappellini user “ancora da definire però le modalità con cui gli aventi diritto secondo il criterio della domiciliazione potranno prenotare il vaccino”. ancora attese..."
1,"#cronaca #ultimenotizie vaccini in aziende, 2mln #astrazeneca in frigo - link - #tifosi #vaccino link"
2,"user 1-gli esperti non sanno nulla. 
2- tutti i vaccini sono ancora in fase sperimentale. 
3- la fascia di età in questione ha un fattore di rischio trascurabile. 
ne riparliamo nel 2023."
1,"festa: “ritardi nelle vaccinazioni. fuksas ha rinunciato al progetto dogana”

link link"
1,"stop a 8000 prenotazioni al vaccino astra zeneca dall'asl toscana sud est link"
1,"#vaccini domani, 5 maggio, sul portale della regione #toscana aprono le agende per prenotare il johnson&amp;johnson per chi ha più di 65 anni
link user"
1,"""arrivano da firenze e cremona i primi indagati ‘no vax’. l’accusa formulata dal magistrato nei confronti di un 66enne lombardo è chiaro: “istigazione alla disobbedienza delle leggi, di ordine pubblico, in vigore a tutela della salute pubblica nel periodo di emergenza pandemica."
0,"vaccini, figliuolo: si vada avanti con over 60, se no non ne usciamo più link"
2,"user_pfeddy user_ user quella che ti infetta e ti spedisce in terapia intensiva anche se sei vaccinato ""bucando"" la protezione degli anticorpi link hanno l'80% di vaccinati, e gli è ripartita l'epidemia"
2,"user_cersei nei laboratori militari c'è la prassi di sviluppare parallelamente a ogni arma biologica il suo vaccino.
link"
0,"grandissimi pezzi di ce:toilet:sse unitamente a tutti i :cherries:oni no vax che vivete nella nostra sicilia-- 
ci siete riusciti siamo primi per contagi e ultimi per vaccinazioni
da lunedì 30 saremo di un bel colore giallo!
guardatevi allo specchio e ….:sneezing_face::sneezing_face: link"
2,"user user_andme qualcuno vorrebbe escludere i cittadini non vaccinati dal #ssn.
va bene, pero' non saremo piu' tenuti a versare tasse e contribuzioni e ci rivolgeremo al privato.
alla fin dei conti gia' succede: per una visita col ssn mesi di attesa...privatamente domattina alle ore 8.00 !!!"
2,"user è legittimo essere contro il vaccino. non buttare fumo negli occhi."
0,"tra due ore mi vaccino link"
0,"con l’85% degli over 60 vaccinati, israele ha registrato un calo del 77% dei casi covid. studio nature su medical facts
link"
0,"mario draghi: chi rifiuta il vaccino sostenga i costi della propria ospedalizzazione! - firma la petizione! link via user"
0,"user user user parli per lei quando si riferisce a chi è stolto non coinvolga gli italiani. milioni di morti in tutto il mondo ed ha ancora il coraggio di mettere in dubbio la necessità dei vaccini? per sua informazione poi tutti i paesi hanno acquistato vaccini comprese le locomotive europee"
0,"utili di pfizer coprono + che adeguatamente costi e rischi
adesso x evitare milioni di morti e rischi varianti x noi bisogna fare licenze obbligatorie nei paesi emergenti e/o sospendere brevetto su questo vaccino (non su quelli che verranno o su farmaci non #covid_19) #11maggio link"
2,"nashville : giovane donna immobilizzata in un letto di ospedale ad una settimana dal vaccino pfizer, senza la possibilità di muovere le gambe"
0,"user_dr user_acm ognuno è libero di fare ciò che vuole e se ne assume le responsabilità..detto questo io mi sono vaccinato.."
2,"per la cronaca e come volevasi dimostrare, la figlia del mio collega, ieri, è risultata positiva. ora andate a quel paese voi e il vostro vaccino."
1,"user__ user e comunque stiamo dicendo cose diverse secondo me. 
io farei un confronto del tasso di letalità per classe d'età rispetto alla variante alpha e la delta tra non vaccinati. in questo modo vedi se la letalità della delta è rimasta la stessa dell'alpha oppure è diminuita anche tra i"
1,"anche roberta aveva detto di non parlare di harry perche questa serata era dedicata a louis 
voi harries rovinate… — madonna ma tutto bene hai fatto il vaccino  link"
0,"user user_ spiegazione:
classe di età &gt;50
 vaccinati 95% 
non vaccinati 5% : il rapporto è 19:1
tabella: morti:
vaccinati  279
non vaccinati 131: il rapporto è 2.2:1. 
quindi il vaccino ha protetto gli over 50,anche se il  numero dei loro morti è superiore a quello dei non vaccinati."
0,"burioni espatria: ""se costretti a chiudere per colpa dei no-vax me ne vado in francia"" | il primato nazionale link"
2,"""evidenzia una grande quantità di #asintomatici""
quindi, se il #vaccino eviterebbe il manifestarsi di sintomi gravi, a che cazzo serve davvero se ci son tutti sti asintomatici?
c-r-i-m-i-n-a-l-i negazionisti della libertà si sapeva,ora si sa neanche avvezzi alla logica
#tagadala7"
0,"user_sa io come te sara. era nell'aria, lo temevo, xò averne la conferma fa male lo stesso, soprattutto xché con i vaccini che procedono spediti avere un minimo di speranza era lecito...almeno ci fosse stato qualcosa da attendere quest'estate avrebbe fatto meno male e invece nulla :broken_heart:"
2,"deve diventare famoso il dott. scoglio! laureato in legge, ma dedica la vita alle alghe. ha deciso di essere il candidato al nobel 2018, anche se nessun candidato al quel nobel sarà noto prima del 2068. 
e vi parla della pericolosità dei vaccini."
0,"user chi si prende la responsabilità di mandare il personale scolastico sopra i 50 anni allo sbaraglio? se la prende lei, ministro?
qualcuno dovrà spiegare perché riaprire le scuole senza aver vaccinato gli insegnanti.
chi ne risponderà, se qualcuno si contagia e ci lascia la pelle??"
0,"user user user user nessuno vuole imporre il vaccino, al momento, ma sei tu che stai ipotizzando che sia solo business."
2,"user sicuramente non accetterò mai #pfizer :backhand_index_pointing_down:
link
fin'ora non ho letto nulla di simile sul #vaccino #sputnik 
qualcuno che ne sappia più di me ? link"
2,"fino che non avranno vaccinato 18 milioni di italiani loro non si fermano lo sa la sx e anche il cdx"
2,"covid-19. l'oms continua a stupire per la grande confusione e contraddizione dei suoi membri. e' preoccupata e dubbiosa per l'efficacia dei vaccini sulla 'variante inglese'. però consiglia di accelerare la vaccinazione, che ormai è inutile per la vecchia influenza passata,"
2,"user user zone rosse ora con questo caldo. l'anno scorso i vaccini non c'erano e ora che ci sono è la stessa minestra. ma andate a caxare."
0,"a questo punto però c’è da aspettarsi anche il titolo “muore all’improvviso, una settimana fa aveva prenotato il vaccino #astrazeneca” link"
2,"user user ha fatto più morti il vaccino del covid?"
1,"user_tajani user_italia fino ad oggi solo proclami ma la vaccinazione di massa non parte"
1,"tutti gli errori europei sui vaccini - bisognava fare le scelte giuste e restare uniti ma... link"
0,"che bello sarebbe, se ci fosse un vaccino contro il covidooooooh wait!"
1,"vaccini lazio, al via 'open week' astrazeneca per maggiorenni - adnkronos link"
0,"user a dire il vero è la stessa cosa che chiedono i novax e i no greenpass cui voi fate l’occhiolino… veda lei…"
2,"#nessunacorrelazione, quindi #vaccinoaigiornalisti che hanno sempre sostenuto l'obbligo."
1,"vaccini covid, la classifica delle regioni link"
1,"al momento sono 29.969.854 le dosi di vaccino somministrate alla popolazione italiana, mentre 9.759.934 persone hanno concluso il ciclo vaccinale sul territorio nazionale (16,47% della popolazione)."
1,"user ma ancora prima: perché bisogna tradurre? il cts non dovrebbe su questo tema dare una indicazione chiara, che non necessita di traduzione? capisco la decisione politica su chiusure/aperture, ma su quali vaccini dare a chi, se non il cts, chi dovrebbe  dare istruzioni ?"
1,"vaccini lazio, ripartono le prime dosi: la chiusura degli hub ora slitta a ferragosto - link link"
0,"user prof con tutti i non vaccinati nell'ambiente scolastico?"
1,"user uno che ruba i vaccini agli altri paesi invece come si chiama?"
1,"#vaccini, l'italia procede a rilento? com'è la situazione in altri paesi #ue? ora su user: fabrizio pregliasco user, don pietro sigurani e user_anfossi di user_cristiana. link link"
2,"assassini!

lorenzo si era anche sottoposto al vaccino anti-covid, lo scorso 5 giugno. una scomparsa la sua che sconvolge la comunità, stretta intorno ai genitori"
2,"user allora è vero che i vaccinati sono contagiosi :face_screaming_in_fear:"
1,"user_s in austria bloccano abv5300 del vaccino #astrazeneca link"
2,"detto questo figliuolo riceve ordini e li esegue. da lui non si cava un ragno dal buco. la vaccinazione dei minorenni è un atto gravissimo, tirannico, figlio di una ideologia assurda ed inquietanta. purtroppo non bastano le buone maniere per far sentire il proprio dissenso."
0,"buongiorno user e roby!

finalmente ho smaltito il vaccino e oggi posso essere con voi come sempre!

#frenchgp :France: #moto3 #motorzn user_it"
0,"user un pubblico di sanitari, tutti vaccinati, sarebbe stato un bel gesto! sono o non  sono  i nostri eroi?!??"
0,"user ..più vaccini per l'africa, allora.."
0,"user mi dice che non faccio parte della categoria che può usufruire del vaccino"
2,"prima di covid, qualcuno ha chiesto se le infermiere erano vaccinate contro l'influenza?
no, pensavo di no.
eppure l'influenza è mortale per certi gruppi di persone. l'#ipocrisia è reale &amp; è fastidiosa.
gli amanti delle maschere hanno mostrato i loro veri colori. sono dei ...:backhand_index_pointing_down:"
2,"user_grim vogliamo ricordare la diretta televisiva della processione natalizia del vaccino che ha attraversato il brennero e poi è arrivato a roma? giorni e giorni di giubilo perché ormai si vedeva la luce in fondo al tunnel. ecco, tre mesi dopo eccoci qua nel caos totale."
0,"difficile per ora fare previsioni #covid19. di certo con la vaccinazione le nostre abitudini potranno tornare ad una nuova normalità molto più agibile della presente link"
0,"user user dovrebbe tacere e fare quello che ha detto user vaccinato entro giugno e cosi deve essere! e basta con 'sto strazio di figliuolo"
1,"queste che vedete in fila sotto la pioggia sono decine di soggetti fragili in attesa del vaccino in fiera. basterebbero un paio di gazebo, ma la ⁦user⁩ dov’è? #palermo #sicilia #vaccini  link"
2,"user user user user user si vaccini..stia a casa..e si protegga dal virusmagico. attenda lo stipendio il 27  compri su amazon e si faccia portare la spesa a casa. saluti"
1,"vaccini, stefani-speranza: disabili fra categorie prioritare link"
0,"sii utile a te stesso e agli altri vatti a vaccinare.
#vaccinatevi
l'alternativa non c'è"
1,"le battute sul 5g dopo che fate il vaccino anche meno. avete fracassato le palle"
0,"user user user_scientists ho letto banchi a rotelle e mi sono venuti i brividi... certo in teoria sarebbe meglio non buttare soldi. il problema vero di reithera è di essere un vaccino tradizionale, non rna. se il risultato è un altro az o jj che non vorrà nessuno, tanto vale fermarsi e investire in rna"
1,"piano vaccini | la preoccupazione dei medici di base | «sui pazienti fragili c'è il rischio di una giungla delle priorità» – l'intervista link"
2,"conferenza del dottor charles morgan all'accademia militare di west point: controllo remoto del cervello umano tramite vaccini mrna - database italia link via user"
2,"user user__ no, sono sperimentali, leggi il bugiardino e vedrai cosa scrivono. sono vaccini sperimentali somministrati in larga scala per via della pandemia."
2,"ecco qua... infettata anche una ragazza vaccinata con due dosi. perché rompete i c... ai non vaccinati? qual è la differenza? deficienti! link"
1,"#dimartedi  #moratti 
ieri ""gli over 80 che non sono stati ancora convocati per la vaccinazione potranno vaccinarsi presentandosi senza prenotazione nel centro vaccinale più vicino dal 7 all'11 aprile'
-oggi ""no lasciate stare..mi sono sbagliata""
dal disastro #lombardia è  tutto"
2,"tutti leoni e poi si cagano sotto...e fanno le corse per fare il vaccino"
1,"2,5 milioni di over 60 ancora non vaccinati.
5 milioni di over 50 ancora non vaccinati."
0,"ho letto abbastanza cazzate su #dedonno da parte di fascisti e novax. 
adesso che lui ha compiuto l'estremo gesto, queste bestie cominciano con il solito tam tam complottista. 
almeno per rispetto dell'uomo tacete una buona volta.
strumentalizzatevi sto cazzo."
1,"vaccino anti-covid, online il portale regionale per la registrazione degli estremamente vulnerabili
link"
2,"user per le missioni glielo ordinano, ""lo fanno per la patria"" e vengono pagati. anche la martani, dietro compenso, si è iniettata vaccini contro cui faceva finte lotte."
1,"ristoranti, calcetto, pass vaccinale, mense scolastiche: al #cts i nodi da sciogliere in vista delle riaperture del #26aprile
so' problemi
#vaccini #covid19italia"
1,"user lo status di vaccinato è transitorio,israele dopo 5 mesi alla 3ª dose,uk dopo 6 mesi,dal 6/9 3ª dose per 32 milioni di già vaccinati,usa dopo 8 mesi,dal 20/9 3ª dose,la variante delta elude il vaccino::da noi per decreto 2 dosi valgono 12 mesi... link"
2,"user se esistessero i vaccini, primo. se fossero efficaci, secondo. se non fossero inutili...se, se, se..."
1,"asl na 2 nord, stop alle prime dosi per mancanza di vaccini link"
1,"sul mio pianeta ideale, 
gli #istigatori alla violenza che nei #mediaspazzatura offendono, minacciano e incitano all'odio,
vivrebbero a 666 metri di altezza, con vento forza 4, in punta di piedi su uno spago, in perenne equilibrio instabile.

 #telegram #novax link"
1,"non credo che sia etico, il comportamento che esclude l’uso di un  #vaccino  :syringe: #sputnik per motivi politici . il dovere della politica è mettere la vita dei cittadini davanti a qualunque pregiudizio o interesse"
2,"le overdosi di vaccino… (e dovremmo essere pure contenti)"" link 91"
1,"user user e siamo gli ultimi ad avere il vaccino , complimenti a lei"
2,"nessuna correlazione, ma un nesso c' è. 
a chi è morto un caro ucciso dal vaccino non girano le palle neanche un po'?"
1,"user user user il problema è che in italia il medico non può proporti di fare una dose di vaccino diverso se hai più di 60 anni.
l'aifa ha autorizzato la cosa solo per under 60.
ora capisco che draghi è il pdc, ma quando va dal medico agisce da privato cittadino e non da capo di governo..."
2,"coloro che ci hanno messo paura a causa del covid, sono gli stessi che ci vogliono imporre la somministrazione del vaccino 
link"
0,". user qualcuno lo fermi perché ha perso il lume della ragione e lo dico da convinta sostenitrice dei vaccini"
0,"comunque il 16 ho la prima dose del vaccino :backhand_index_pointing_right_medium-light_skin_tone::backhand_index_pointing_left_medium-light_skin_tone:"
2,"user_claudio appunto perché non si tratta di vaccino ma di una sperimentazione sull'uomo, sono dei veri tentativi di omicidi."
2,"cosa non ci hanno detto in italia sui vaccini:face_screaming_in_fear:

 link"
0,"iniziate vaccinazioni over 70. finalmente! #toscana #vaccini"
2,"user che poi a quanto pare si iniettano acqua pura non vaccini!!!!!!"
1,"user user_alpopolo fammi capire: sull'obbligatorietà del vaccino e sul passaporto vaccinale cosa ne pensi?"
2,"user_official :beaming_face_with_smiling_eyes::beaming_face_with_smiling_eyes::beaming_face_with_smiling_eyes::beaming_face_with_smiling_eyes::beaming_face_with_smiling_eyes:sapete quante varianti devono ancora uscire  parecchie e una cosa grave ///i vaccini non riescono ad anticipare perché è impossibile bloccare il mondo! !!!"
1,"vaccino o certificato di negatività per chi arriva in sardegna: la proposta link"
1,"#vaccini anti #covid19 in italia, dosi somministrate su base quotidiana.
dosi somministrate il 11/05/2021 : 429.134
media mobile a 7 giorni: 465.570
#covid_19 #vaccinaitalia #astrazeneca #coronavirus #pfizer #modernavaccine link"
1,"user user user user_italia qui il contenuto della interrogazione a firma armando siri e alberto bagnai al ministro speranza sui vaccini. link"
2,"link

#astrazeneca , #antonellaviola e l'allarme sui #vaccini: ""i #rischi superano ampiamente i #benefici, ma non l'hanno letto?"" 

#liberoquotidiano"
0,"condivido in pieno... se c'è qualcosa che bisogna sapere che venga fuori subito!
aggiungo: in uk hanno vaccinato 12m di persone con az, ora capisco che gli inglesi siano stoici e pragmatici mentre in europa siamo un pò chiagnoni ma escludo che abbiano sotterrato i morti!"
2,"india 
uomo muore appena dopo aver ricevuto la prima dose del vaccino covid 

man dies shortly after taking first dose of covid vaccine in angul  link"
1,"user user user_lucato io vedo la differenza tra chi il vaccino lo ha prodotto e ha vaccinato (tra mille problemi) e chi per ora lo sta solo testando. il resto chiacchiere."
1,"user_fenzi se il cognato di fontana avesse prodotto vaccini, i lombardi sarebbero già tutti vaccinati"
0,"ma allora ditelo che basta avere un amico in paradiso e il vaccino te lo fanno anche con 25 anni di età. solo sulla carta viene previsto prima over 80 poi over 60 dopo il resto della popolazione. non si deve aprire un fascicolo si deve punire severamente i furbi"
0,"vaccinato questa mattina 08 00  prima dose con  pftruser  puffazer..... pitzifur  pizziffer   vabbe' so vaccinato :face_with_tears_of_joy::face_with_tears_of_joy::face_with_tears_of_joy::face_with_tears_of_joy:  #pfizervaccine"
0,"vaccini fuori lista, in procura a bari primi interrogatori. il legale: ""sono stati chiamati, nessuno ha saltato la fila"" link 
vergogna #infiltrati e #saltafila!!!"
1,"vaccini: quasi 30mila dosi somministrate nell'oristanese link"
2,"user non c'è nessuna fuga, fenomeni, il vaccino non è obbligatorio e non essendo obbligatorio non scappano da nulla, semplicemente non sono interessati a farlo e non si prenotano, somari!"
1,"pfizer sta pensando di adattare il nuovo richiamo alle varianti."
1,"user mi piacerebbe essere contadino 
in ogni caso in una comunità si può esprimere il proprio gradimento o critica.
e in una comunità europea non ha senso che ogni nazione vada per la sua strada tra vaccinazioni e chiusure.
ci vorrebbe uniformità,oppure ciao europa"
1,"auguro vacanze all'insegna della dissenteria per tutti quelli che si son vaccinati scavalcando anziani, immunodepressi e malati cronici."
0,"#pfizer, ""uno dei vaccini più efficaci nella storia della medicina"". link"
1,"politici e vaccino: da salvini e meloni a letta, renzi e grillo. chi lo ha fatto e chi non lo farà 
⁦user⁩  link"
1,"appena ha saputo che non poteva entrare alla sagra della porchetta o al papeta #salvini si è vaccinato stamattina a milano - cronaca - ansa link"
1,"campagna vaccinazione in cina: oltre 2 mld dosi somministrate   video link"
2,"dott. de mari : spiega cosa fare se si attacca la calamita nel braccio dopo il vaccino link"
2,"user provateci a dare un vaccino genico sperimentale ai miei figli. provateci."
2,"user sperano che dopo esserti vaccinato muoia di incidente stradale, magari ti porti via altri 3 o 4 ed il risparmio è sicuro. vogliono bertolaso a roma, più vicino alla palestra in via flaminia, per le sue gesta eroiche."
0,"user user ho citato tutte trasmissioni passate che diffondevano falsità.
per me è grave per lei no.
hanno diffuso le fake sui vaccini. per me è di una gravità inaudita. enorme.
per lei no.
libere opinioni per carità...ma parlare di trasmissione attendibile no eh. 
link"
0,"user @_clappuccino user user se vuoi tanto guardare l'efficacia dei vaccini guarda il grafico sulle terapie intensive e sui decessi covid in gran bretagna, e magari cambi idea, o ti devo spiegare anche quello dato che non lo sai leggere?"
0,"la variante più pericolosa è quella  no-vax: si attacca al cervello  #covid link"
0,"il #covid19 continua a colpire i #neonati. tre casi nel vicentino, tutti con familiari #nonvaccinati. altri ricoveri in #rianimazione. servizio di giovanni stefani, montaggio gianpaolo gigante #ioseguotgr
link"
1,"il vaccino di johnson  link via user"
1,"da lunedì 7 giugno verrà sospesa l'#attività per la somministrazione del vaccino anti-#covid presso l'#ambulatorio distrettuale della asl 3 in via xii ottobre a #genova. l’attività #vaccinale, si legge nella nota dell'#asl, “proseguirà presso l’#hub della #fiera del #mare. link"
1,"new post: leggi la notizia! in vista obbligo vaccinale per sanitari no vax: pena la link #veneto #notizie #news"
1,"il livello di esasperazione è alto e domandare se si è vaccinati o meno sta diventando un'abitudine come chiedere una tazzina di caffè al bar. si parla sempre di privacy e protezione dei dati personali e poi in tv, te lo chiedono senza problemi. basta no? user user"
2,"user user_lella user user_laffitte user per non piegarmi al vaccino, devo assolutamente cambiare lavoro. chi può aiutarmi, sappia che ho sempre fatto qualunque cosa, tranne rubare."
0,"# user: covid, figliuolo: ""obiettivo tutti vaccinati entro l'estate"" link"
1,"è scontro tra virologi sulle mascherine: bassetti propone l’addio per i vaccinati. gismondo dissente link link"
1,"user user cts ha detto esattamente ciò che ha detto ema due giorni fa cioè non possono dare una certezza assoluta perché non ci sono abbastanza dati a riscontro questo lo sapevamo anche noi comuni mortali perché finora il richiamo seguiva il 1 vaccino da protocollo"
0,"#ottoemezzo siete schizofrenici, non contraddittori. c'è un virus pericoloso sconosciuti, che muta ed è più veloce di noi... e apriamo tutto? fateci scegliere i vaccini e mettere i monoclonali a disposizione di tutti. è la via per la nuova normalità"
2,"user ""il vaccino è il futuro""
""mi farei iniettare anche petrolio pur di poter tornare libero""

questi sono due esempi di cose che hanno udito le mie povere orecchie"
0,"se un sanitario non si vaccina sta commettendo un reato? forse. ce lo spiega user"
0,"user user user user se la percentuale di positivi che hanno sintomi lievi tra i vaccinati è maggiore dei positivi con sintomi lievi tra i non vaccinati no, non possiamo dirlo. per dirlo serve un grafico che mostri le percentuali separate."
1,"vaccini: ruffo (sissa), ancora in attesa comunicazione asugi. università trieste e udine già informati, cominceranno giovedì #ansa link"
0,"user user user user non indipendentemente dalla variante. b117 in uk e' abbondantemente sotto 1 con il livello di vaccinazioni attuale e riaperture."
0,"user caro massimo, almeno io, non ho idea dello stress delle strutture sanitarie. concordo che questi lockdown a singhiozzo non sono ideali, ma oggettivamente questa pandemia è devastante. piuttosto cerchiamo di stringere sulle vaccinazioni. un caro saluto alessandro"
1,"vaccini, marco rizzo-pc: +è la guerra dei vaccini, sputnik dato che è russo non si può dare+"" link 54"
1,"vaccini in sardegna, ieri oltre 13 mila somministrazioni e 60 mila prenotazioni link"
