"label","text"
0,"ma allora ditelo che basta avere un amico in paradiso e il vaccino te lo fanno anche con 25 anni di età. solo sulla carta viene previsto prima over 80 poi over 60 dopo il resto della popolazione. non si deve aprire un fascicolo si deve punire severamente i furbi"
2,"#nessunacorrelazione, quindi #vaccinoaigiornalisti che hanno sempre sostenuto l'obbligo."
1,"da lunedì 7 giugno verrà sospesa l'#attività per la somministrazione del vaccino anti-#covid presso l'#ambulatorio distrettuale della asl 3 in via xii ottobre a #genova. l’attività #vaccinale, si legge nella nota dell'#asl, “proseguirà presso l’#hub della #fiera del #mare. link"
1,"user user cts ha detto esattamente ciò che ha detto ema due giorni fa cioè non possono dare una certezza assoluta perché non ci sono abbastanza dati a riscontro questo lo sapevamo anche noi comuni mortali perché finora il richiamo seguiva il 1 vaccino da protocollo"
2,"user 1-gli esperti non sanno nulla. 
2- tutti i vaccini sono ancora in fase sperimentale. 
3- la fascia di età in questione ha un fattore di rischio trascurabile. 
ne riparliamo nel 2023."
0,"user non lo direi neanche di un medico fumatore se non fuma in faccia ai suoi pazienti. i vaccini non sono solo un bene per la propria salute."
0,"user user user i vaccinati si infettano certamente meno di quelli non vaccinati"
1,"user quello che fa veramente incaxxare è che in sardegna, pretendevano assolutamente che tutti quelli che arrivavano fossero vaccinati! e loro non di vaccinano?"
0,"user prof con tutti i non vaccinati nell'ambiente scolastico?"
0,"tutti voi che state ironizzando sul #deltaplus #deltavariant... ma l'avete fatta almeno una dose di vaccino? no perché nel caso non sareste nella posizione giusta per fare dello spirito."
