1,"#vaccini, l'italia procede a rilento? com'è la situazione in altri paesi #ue? ora su user: fabrizio pregliasco user, don pietro sigurani e user_anfossi di user_cristiana. link link"
0,"speranza: “entro l’estate tutti gli italiani vaccinati, questo è l’obiettivo” | video link via user"
1,"“a palermo c’è una evidente escalation dei contagi, in particolare per la diffusione delle varianti, più aggressive. abbiamo i primi casi di virus in soggetti già vaccinati."""
0,"oggi comunque è stata una bella giornata: sono andata a salutare le mie asinelle, poi sono stata dalla nonna (con tutte le dovute distanze e precauzioni anche se ha fatto il vaccino ieri) e io e la zia abbiamo fatto una ""passeggiata"" per il paese con il cane :heart_suit::pleading_face::folded_hands_light_skin_tone:"
1,"non credo che sia etico, il comportamento che esclude l’uso di un  #vaccino  :syringe: #sputnik per motivi politici . il dovere della politica è mettere la vita dei cittadini davanti a qualunque pregiudizio o interesse"
0,"l’ok alla presenza di spettatori alle gare di #uefa2020 allo stadio #olimpico è un gran bel segnale di #speranza (maiuscolo e minuscolo). ora, però, urge un protocollo rigido del #cts e, soprattutto, un’accelerazione nelle #vaccinazioni. altrimenti sarà l’ennesimo, vuoto proclama"
1,"user_maffi user a tg lombardia conferenza stampa prima regione a raggiungere 1 milione di vaccinati"
1,"gds: ""#sicilia. vaccini in farmacia, si parte il 15 luglio""
link"
2,"user che poi a quanto pare si iniettano acqua pura non vaccini!!!!!!"
0,"comunque domani torno giù a milano per la seconda dose del vaccino e poi risalgo in montagna tipo subito.
sono già stanca al pensiero."
2,"user 1-gli esperti non sanno nulla. 
2- tutti i vaccini sono ancora in fase sperimentale. 
3- la fascia di età in questione ha un fattore di rischio trascurabile. 
ne riparliamo nel 2023."
1,"manifestazione dei ""no green pass"" a milano: circa mille persone sfilano per le vie del centro al grido di ""non sono vaccini, ma sieri assassini"" - il fatto quotidiano link"
0,"user user user user nessuno vuole imporre il vaccino, al momento, ma sei tu che stai ipotizzando che sia solo business."
0,"impoante risoluzione del consiglio d’europa : vaccini per tutti senza discriminazioni di ogni genere link"
2,"user user_andme qualcuno vorrebbe escludere i cittadini non vaccinati dal #ssn.
va bene, pero' non saremo piu' tenuti a versare tasse e contribuzioni e ci rivolgeremo al privato.
alla fin dei conti gia' succede: per una visita col ssn mesi di attesa...privatamente domattina alle ore 8.00 !!!"
2,"user user i testimonial come lui  e  affini dovrebbe pubblicare i titoli anticorpali prima e dopo il vaccino. così, giusto per confermare che sbadatamente  loro non abbiano ricevuto il placebo .lo facciamo perché ci teniamo tanto alla loro salute e alla scienza"
1,"asl avellino. sospensione attività’ centri vaccinali nella giornata di domani, lunedì riprendono le vaccinazioni - link link"
2,"user non c'è nessuno che chiede se avesse fatto il vaccino.....ma pensano subito al covid

concorezzo, muore a 15 anni nella sua cameretta. ora si indaga sul covid - cronaca - link link"
1,"#dimartedi  #moratti 
ieri ""gli over 80 che non sono stati ancora convocati per la vaccinazione potranno vaccinarsi presentandosi senza prenotazione nel centro vaccinale più vicino dal 7 all'11 aprile'
-oggi ""no lasciate stare..mi sono sbagliata""
dal disastro #lombardia è  tutto"
1,"vaccini: quasi 30mila dosi somministrate nell'oristanese link"
1,"user user e siamo gli ultimi ad avere il vaccino , complimenti a lei"
1,"user già che siamo in argomento qualcuno potrebbe spiegare perché la user è penultima per la vaccinazione degli ultraottantenni affidata fin da subito  e giustamente ai medici di famiglia? user user"
1,"user user user il problema è che in italia il medico non può proporti di fare una dose di vaccino diverso se hai più di 60 anni.
l'aifa ha autorizzato la cosa solo per under 60.
ora capisco che draghi è il pdc, ma quando va dal medico agisce da privato cittadino e non da capo di governo..."
0,":blue_circle: ""si riprende con tutti i #vaccini. si pensa a privati e anche #farmacie. tutto come detto. errori sono stati commessi eccome e lo è stato sospendere. errori nazionali. campagna e pass #ue sono la via sana e giusta""

user :studio_microphone:
#nonstopnews link"
0,"user ..più vaccini per l'africa, allora.."
2,"user tranqi che col vaccino ci dimezzano"
0,"user_dr user_acm ognuno è libero di fare ciò che vuole e se ne assume le responsabilità..detto questo io mi sono vaccinato.."
0,"user user user alle persone (e i governi) che si stanno sbattendo x affermare il privilegio di chi è vaccinato su chi no, che i vaccini a)non sono una cura, b)senza test and track servono a poco, c)non devono discriminare aree geografiche e gruppi di persone d)vanno resi disponibili globalmente"
0,"user user user user gli under12, devono mantenere le precauzioni pre-vaccinali. ovviamente a maggior ragione i docenti devono essere vaccinati.
quando ci sarà, sembra in autunno, autotizzazione pediatrica, si vaccineranno."
0,"user user_ spiegazione:
classe di età &gt;50
 vaccinati 95% 
non vaccinati 5% : il rapporto è 19:1
tabella: morti:
vaccinati  279
non vaccinati 131: il rapporto è 2.2:1. 
quindi il vaccino ha protetto gli over 50,anche se il  numero dei loro morti è superiore a quello dei non vaccinati."
2,"deve diventare famoso il dott. scoglio! laureato in legge, ma dedica la vita alle alghe. ha deciso di essere il candidato al nobel 2018, anche se nessun candidato al quel nobel sarà noto prima del 2068. 
e vi parla della pericolosità dei vaccini."
2,"uomo del nj in ospedale con covid dopo essere stato completamente vaccinato.  ma almeno ha il suo passaporto, giusto? #earlytreatment is the key! link"
1,"video
#vaccinazioni a #frabosasottana, #cirio: ""ai nostri giovani somministrato pfizer e moderna, la scienza ci dia indicazioni chiare sull'uso dei vaccini"". ""da lunedì piemonte zona bianca"" link"
1,"user_cappellini user “ancora da definire però le modalità con cui gli aventi diritto secondo il criterio della domiciliazione potranno prenotare il vaccino”. ancora attese..."
0,"tutti voi che state ironizzando sul #deltaplus #deltavariant... ma l'avete fatta almeno una dose di vaccino? no perché nel caso non sareste nella posizione giusta per fare dello spirito."
2,"user se i vaccini fossero super sicuri. ma non lo sono, per niente."
0,"user se è contrario al #greenpass, che è tutt'altro che strumento valido, ci sono buone possibilità che non sia vaccinato. il che è davvero triste.
#barbero"
0,"user user ho citato tutte trasmissioni passate che diffondevano falsità.
per me è grave per lei no.
hanno diffuso le fake sui vaccini. per me è di una gravità inaudita. enorme.
per lei no.
libere opinioni per carità...ma parlare di trasmissione attendibile no eh. 
link"
1,"stop a 8000 prenotazioni al vaccino astra zeneca dall'asl toscana sud est link"
2,"user_sibari user allora mi dica il vaccino e autorizzato alla vendita in emergenza ma rimane sperimentale fino al 2023 
un obbligo da parte dello stato impone che lo stato stesso si faccia carico di eventuali danni rendendo superfluo il consenso firmato 
chi pagherà?"
2,"user user il vaccino è solo un mezzo. il fine è il grande reset"
1,"il livello di esasperazione è alto e domandare se si è vaccinati o meno sta diventando un'abitudine come chiedere una tazzina di caffè al bar. si parla sempre di privacy e protezione dei dati personali e poi in tv, te lo chiedono senza problemi. basta no? user user"
2,"i pazzi under 50 che si fanno astrazeneca vanno fermati! governo di assassini!!!"
0,"user un pubblico di sanitari, tutti vaccinati, sarebbe stato un bel gesto! sono o non  sono  i nostri eroi?!??"
1,"user una domanda, come mai il contatore delle vaccinazioni riporta una cifra di circa un milione di somministrazioni prime dosi in più rispetto alle statistiche ufficiali?"
2,"user user 
allora? sono passati 13 giorni, la situazione mi pare molto peggiorata anche rispetto al 2020, quando non c’erano “#vaccini” nè #greenpass!
che dice l’ “esperto” #battiston? user_bat :face_with_tears_of_joy:
più patetici che ridicoli!

#ilgiornale #fakenews
#nogreenpass
user_cnog link"
2,"basta tutti testimonial di vaccini e case farmaceutiche"
1,"un nuovo articolo: (vaccini covid, da domani in sicilia prenotazioni per i ragazzi dai 12 ai 15 anni) è stato pubblicato su: tempo stretto - ultime notizie da messina e reggio calabria - link link"
0,"user @_clappuccino user user se vuoi tanto guardare l'efficacia dei vaccini guarda il grafico sulle terapie intensive e sui decessi covid in gran bretagna, e magari cambi idea, o ti devo spiegare anche quello dato che non lo sai leggere?"
0,"user né il vaccino pfizer né quello moderna vengono prodotti usando linee cellulari di conseguenza è impossibile che contengano cellule di feti.
altri vaccini necessitano di linee cellulari per la produzione (mrc-5, wi-38 e hek393 originarie degli anni 60/70), ma non ne contengono."
2,"fa il vaccino pfizer alle 14 45 muore alle 16,30   link"
1,"user_fenzi se il cognato di fontana avesse prodotto vaccini, i lombardi sarebbero già tutti vaccinati"
0,"user user ma la variante alpha (inglese) è di ottobre 2020 e la vaccinazione di massa in uk è iniziata tra dicembre ‘20 e gennaio ‘21!!!!!! svegliaaaaa!!"
2,"coloro che ci hanno messo paura a causa del covid, sono gli stessi che ci vogliono imporre la somministrazione del vaccino 
link"
0,"ma allora ditelo che basta avere un amico in paradiso e il vaccino te lo fanno anche con 25 anni di età. solo sulla carta viene previsto prima over 80 poi over 60 dopo il resto della popolazione. non si deve aprire un fascicolo si deve punire severamente i furbi"
0,"sii utile a te stesso e agli altri vatti a vaccinare.
#vaccinatevi
l'alternativa non c'è"
1,"""arrivano da firenze e cremona i primi indagati ‘no vax’. l’accusa formulata dal magistrato nei confronti di un 66enne lombardo è chiaro: “istigazione alla disobbedienza delle leggi, di ordine pubblico, in vigore a tutela della salute pubblica nel periodo di emergenza pandemica."
2,"medico in incognito parla dei vaccini covid link via user"
1,"2 settembre alle 20:00, a vibo, sarò alla presentazione del libro di matteo bassetti.
intanto è notizia di oggi:
ennesima aggressione dei no vax nei confronti dell'infettivologo bassetti inseguito e minacciato: ""ci ucciderete tutti con questi vaccini e ve la faremo pagare"". link"
0,"user_tiziana noi vaccinati si (si spera)"
0,"mia nonna fhe cerca di far ragionare mia madre e farci fare il vaccino:growing_heart::sparkling_heart::heart_with_arrow::two_hearts:"
0,"orgogliosa e grata ai nostri ragazzi in divisa che, come sempre, ci sono nel momento del bisogno. 
generale #figliuolo avanti tutta con i vaccini noi di user_italia siamo al vostro fianco."
2,"“lo scopo principale della vaccinazione non è di ordine sanitario” link"
2,"user user_freisa chiedo a te che mi pare sia informato. è una domanda non provocatoria, ma seria.
si hanno fonti attendibili circa l'ausilio di cellule derivanti da feti morti per la ricerca o messa a punto del vaccino az o j&amp;j?"
1,"user molte persone dopo molti mesi a casa hanno scelto di fare il vaccino.. altri hanno scelto di non farlo.. quando un certo andrea scanzi ha scelto di farlo prima di altri mezza italia era pronta a fustigarlo .."
0,"la variante più pericolosa è quella  no-vax: si attacca al cervello  #covid link"
0,"#pfizer, ""uno dei vaccini più efficaci nella storia della medicina"". link"
2,"detto questo figliuolo riceve ordini e li esegue. da lui non si cava un ragno dal buco. la vaccinazione dei minorenni è un atto gravissimo, tirannico, figlio di una ideologia assurda ed inquietanta. purtroppo non bastano le buone maniere per far sentire il proprio dissenso."
0,"user prof con tutti i non vaccinati nell'ambiente scolastico?"
2,"ecco qua... infettata anche una ragazza vaccinata con due dosi. perché rompete i c... ai non vaccinati? qual è la differenza? deficienti! link"
2,"user allora è vero che i vaccinati sono contagiosi :face_screaming_in_fear:"
0,"user user_francesco user quindi non ti vaccini contro il tetano fino a che non muori di tetano perché in base alla tua esperienza personale il tetano non esiste. d'accordo."
2,"dott. de mari : spiega cosa fare se si attacca la calamita nel braccio dopo il vaccino link"
0,"user user user user se la percentuale di positivi che hanno sintomi lievi tra i vaccinati è maggiore dei positivi con sintomi lievi tra i non vaccinati no, non possiamo dirlo. per dirlo serve un grafico che mostri le percentuali separate."
0,"user a dire il vero è la stessa cosa che chiedono i novax e i no greenpass cui voi fate l’occhiolino… veda lei…"
0,"ma quindi abbiamo davvero bloccato un vaccino per 30 trombosi su 5 milioni di vaccinati?
#astrazeneca"
0,"è assurdo come i novax riescano a mettere in correlazione la morte di #raffaellacarrá con il vaccino. sono da tso ormai. fermateli."
0,"user chi sceglie di non vaccinarsi è come quello che non rispetta il divieto di sosta e di fermata nei giorni di mercato. chi si è vaccinato ha pagato il suolo pubblico e si è iscritto alla camera di commercio, e loro ne approfittano a sbafo."
0,"vaccini, figliuolo: si vada avanti con over 60, se no non ne usciamo più link"
1,"#cronaca #ultimenotizie vaccini in aziende, 2mln #astrazeneca in frigo - link - #tifosi #vaccino link"
2,"user user_lella user user_laffitte user per non piegarmi al vaccino, devo assolutamente cambiare lavoro. chi può aiutarmi, sappia che ho sempre fatto qualunque cosa, tranne rubare."
2,"nessuna correlazione, ma un nesso c' è. 
a chi è morto un caro ucciso dal vaccino non girano le palle neanche un po'?"
0,"user non lo direi neanche di un medico fumatore se non fuma in faccia ai suoi pazienti. i vaccini non sono solo un bene per la propria salute."
2,"cosa succederà? i dati #covid miglioreranno ancora e beccamorto user frenerà, incatenando e chiudendo il paese con l’avallo di user_chigi che la mena con i #vaccini. a quel punto user reagirà? di sicuro il popolo insorgerà furiosamente. #dittaturasanitaria"
0,"tra due ore mi vaccino link"
1,"user user user solo a parole, usa e gb si sono accaparrate il 250% dei vaccini necessari alla loro popolazione, molti paesi non hanno visto ancora una fiala, astrazeneca prodotto in india non autorizzato in eu"
0,"user attenta che così ti inimichi tutti gli utenti no vax, no covid, no restrizioni.
'nsomma, sarebbe un bel vanto."
0,"grandissimi pezzi di ce:toilet:sse unitamente a tutti i :cherries:oni no vax che vivete nella nostra sicilia-- 
ci siete riusciti siamo primi per contagi e ultimi per vaccinazioni
da lunedì 30 saremo di un bel colore giallo!
guardatevi allo specchio e ….:sneezing_face::sneezing_face: link"
0,"i free riders del vaccino, ovvero gli scrocconi di libertà (di d. faraone) link #"
0,".... aspettando il turno per il vaccino ma porca troooota perché al mio comune fan tutti schifo aooooo datelo a tutti wtf"
0,"user user user user_kuzzo cosa c’è di non chiaro nell’affermazione “i vaccini non proteggono dal contagio ma da sviluppo di forme di malattia gravi / morte” iniziate a sembrare seriamente deficienti a riportare ste notizie."
0,"è bellissimo sentire i commenti delle persone grandi sul momento della loro vaccinazione. servizio,gentilezza degli operatori sanitari e grande soddisfazione x avere ricevuto a loro tutela la salvezza.
siamo in #emiliaromagna"
1,"2,5 milioni di over 60 ancora non vaccinati.
5 milioni di over 50 ancora non vaccinati."
0,"mia mamma ha detto a mia zia che mi voglio fare il vaccino e ora lei mi ha chiamata per farmi il bordello e a raccontarmi stronzate lette su facebook ma diocane"
2,"aprite questa pagina e notate come i commenti ammessi sono solo quelli favorevoli a questa vergognosa iniziativa. e' censura vera e propria della libertà di pensiero e di espressione perpetrata giornalmente dal user_it 
#nazipass
#nazivax

link"
0,"sto pensando ai vaccini! link"
2,"#nessunacorrelazione, quindi #vaccinoaigiornalisti che hanno sempre sostenuto l'obbligo."
0,"a ora che il vaccino sarà disponibile per me lo venderanno a 2 euro e 50 dal tabaccaio"
1,"pfizer sta pensando di adattare il nuovo richiamo alle varianti."
0,"user user li avrei proprio volti vedere dire di no al vaccino mentre erano a fare il militare. per questa gente mi spiace che abbiano levato la leva obbligatoria, queste son persone che hanno bisogno di essere ""comandate"" almeno una volta nella vita per abbassare la cresta."
2,"fino che non avranno vaccinato 18 milioni di italiani loro non si fermano lo sa la sx e anche il cdx"
2,"user user zone rosse ora con questo caldo. l'anno scorso i vaccini non c'erano e ora che ci sono è la stessa minestra. ma andate a caxare."
1,"vaccini in sardegna, ieri oltre 13 mila somministrazioni e 60 mila prenotazioni link"
2,"india 
uomo muore appena dopo aver ricevuto la prima dose del vaccino covid 

man dies shortly after taking first dose of covid vaccine in angul  link"
0,"iniziate vaccinazioni over 70. finalmente! #toscana #vaccini"
0,"il generale figliuolo dovrebbe chiedere scusa al popolo italiano
 
tante mostrine , pochi vaccini"
1,"vaccini, marco rizzo-pc: +è la guerra dei vaccini, sputnik dato che è russo non si può dare+"" link 54"
0,"burioni espatria: ""se costretti a chiudere per colpa dei no-vax me ne vado in francia"" | il primato nazionale link"
1,"#vaccini domani, 5 maggio, sul portale della regione #toscana aprono le agende per prenotare il johnson&amp;johnson per chi ha più di 65 anni
link user"
0,"user user ed è proprio per questo che occorrerebbe smettere con l’isteria collettiva. a metà luglio l’ue sarà dove saranno gli usa a inizio giugno. a fine anno produrrà più dosi degli usa. keep calm and carry on vaccination and export."
0,"i dati della nuova #campagnavaccinale testimoniano il cambio di passo: in un mese, da 60mila somministrazioni giornaliere a oltre 250mila e abbiamo ampliato platea vaccinatori e punti vaccinali (+30% in un mese). ne ho parlato ieri su user
link"
1,"user user user user_italia qui il contenuto della interrogazione a firma armando siri e alberto bagnai al ministro speranza sui vaccini. link"
0,"user user user parli per lei quando si riferisce a chi è stolto non coinvolga gli italiani. milioni di morti in tutto il mondo ed ha ancora il coraggio di mettere in dubbio la necessità dei vaccini? per sua informazione poi tutti i paesi hanno acquistato vaccini comprese le locomotive europee"
1,"giro di vite per 45mila sanitari. per i non vaccinati stop all’attività link"
0,"tu provi a far finta di niente, a mantenere la calma poi sti novax si paragonano agli ebrei durante la seconda guerra mondiale e ti vien voglia di prenderli a sberle tipo mulino a vento."
1,"limes:carta: la distribuzione dei vaccini link 25"
0,"comunque ieri sera l’host del nostro b&amp;b ci ha seriamente detto che non fa il vaccino perché a sua sorella adesso rimangono le chiavi attaccate addosso. non ne usciamo."
2,"byoblu:aumento delle infezione nei vaccinati. la svezia vieta l’ingresso agli israeliani   link 28"
2,"antidiplomatico:""non si tratta di pro-vax e no-vax"": la discriminazione come metodo educativo e la retorica dell'inclusione link 11"
1,"è scontro tra virologi sulle mascherine: bassetti propone l’addio per i vaccinati. gismondo dissente link link"
1,"user user cts ha detto esattamente ciò che ha detto ema due giorni fa cioè non possono dare una certezza assoluta perché non ci sono abbastanza dati a riscontro questo lo sapevamo anche noi comuni mortali perché finora il richiamo seguiva il 1 vaccino da protocollo"
1,"anche roberta aveva detto di non parlare di harry perche questa serata era dedicata a louis 
voi harries rovinate… — madonna ma tutto bene hai fatto il vaccino  link"
1,"#sicilia, al via a #palermo il primo grande ‘hub’ per le vaccinazioni - video link"
0,"user user user non ci vedo nulla da ridere, mi sembra un ragionamento più che sensato quello di avere la possibilità poter comprare il vaccino in farmacia, nulla togliendo ovviamente a chi aspetta il servizio sanitario nazionale"
0,"𝐒𝐞𝐧𝐭𝐢𝐫𝐬𝐢 𝐫𝐞𝐬𝐩𝐨𝐧𝐬𝐚𝐛𝐢𝐥𝐢  per se e per gli altri!
lo stato italiano e la situazione storica ci chiedono e ci impongono la #responsabilita attraverso la chiamata alla vaccinazione di massa. 
#vaccini #covid19 #governoitaliano #pandemia 
link"
2,"user user__ no, sono sperimentali, leggi il bugiardino e vedrai cosa scrivono. sono vaccini sperimentali somministrati in larga scala per via della pandemia."
2,"user per le missioni glielo ordinano, ""lo fanno per la patria"" e vengono pagati. anche la martani, dietro compenso, si è iniettata vaccini contro cui faceva finte lotte."
1,"ma quindi il vaccino immunizza? chi si vaccina può anche togliere la mascherina e non rispettare la distanza?"
0,"dopo quella vaccinazione 56 anni senza nemmeno un raffreddore ! link"
1,"11) banco informazioni, ti danno un modulo ""lo compilo e glielo dò adesso?"" 
12) ti fanno prendere appuntamento dal sito
13) complimenti ha un appuntamento per consegnare il modulo fra un mese.
14) la pandemia è finita, non ho la tessera sanitaria e non ho ancora il vaccino"
2,"user_official :beaming_face_with_smiling_eyes::beaming_face_with_smiling_eyes::beaming_face_with_smiling_eyes::beaming_face_with_smiling_eyes::beaming_face_with_smiling_eyes:sapete quante varianti devono ancora uscire  parecchie e una cosa grave ///i vaccini non riescono ad anticipare perché è impossibile bloccare il mondo! !!!"
2,"user è legittimo essere contro il vaccino. non buttare fumo negli occhi."
1,"vaccini covid, la classifica delle regioni link"
0,"user_lorenzo user no entra ma facciamo le gabbie di vetro come per i fumatori in aereoporto e ci mettiamo la targa imbecilli novax"
0,"il #covid19 continua a colpire i #neonati. tre casi nel vicentino, tutti con familiari #nonvaccinati. altri ricoveri in #rianimazione. servizio di giovanni stefani, montaggio gianpaolo gigante #ioseguotgr
link"
1,"insomma, uk segue israele e vuole introdurre il pass vaccinale per l'accesso a pub, ristoranti, teatri, etc. esenzione solo per ospedali e supermercati. 
questi sono i due stati più avanti con le vaccinazioni. 

poi non dite che non ve l'avevo detto. link"
1,"user si fa il triage prima del vaccino. l’occasione per valutare l’opportunità dovrebbe essere quella"
1,"user user user_lucato io vedo la differenza tra chi il vaccino lo ha prodotto e ha vaccinato (tra mille problemi) e chi per ora lo sta solo testando. il resto chiacchiere."
1,"ristoranti, calcetto, pass vaccinale, mense scolastiche: al #cts i nodi da sciogliere in vista delle riaperture del #26aprile
so' problemi
#vaccini #covid19italia"
2,"covid-19. l'oms continua a stupire per la grande confusione e contraddizione dei suoi membri. e' preoccupata e dubbiosa per l'efficacia dei vaccini sulla 'variante inglese'. però consiglia di accelerare la vaccinazione, che ormai è inutile per la vecchia influenza passata,"
0,"user user potete sempre espatriare dove non c'è praticamente nessun problema italiano: mi sembra - ma ammetto di non essere certo - che in tunisia non ci siano vaccini, greenpass pass e balle varie (sarei stupito del contrario, là si lamentano che non li vaccino e non li curano)."
0,"mario draghi: chi rifiuta il vaccino sostenga i costi della propria ospedalizzazione! - firma la petizione! link via user"
1,"vaccino o certificato di negatività per chi arriva in sardegna: la proposta link"
0,"a questo punto però c’è da aspettarsi anche il titolo “muore all’improvviso, una settimana fa aveva prenotato il vaccino #astrazeneca” link"
2,"user user user user non so in quanti sopravviveremo a  altri due anni di vaccini !!??!?:face_screaming_in_fear::face_screaming_in_fear::face_screaming_in_fear:… e lo avevano detto …siamo in troppi al mondo:pouting_face::face_with_steam_from_nose::face_with_steam_from_nose:"
2,"prato muore durante la tac. aveva fatto vaccino due giorni prima disposta l’autopsia - #prato #muore #durante #aveva #fatto link"
1,"vaccini: sileri,verosimile ripeterli ogni anno link"
2,"eccellenza: l’ormai immancabile bill &amp; melinda gates foundation e la central intelligence agency.

abbiamo analizzato nei 31 reportages wuhangates il ruolo della cia nel campo delle armi batteriologiche e quello di gatesnella ricerca di virus per costruire lucrosi vaccini. ora"
1,"politici e vaccino: da salvini e meloni a letta, renzi e grillo. chi lo ha fatto e chi non lo farà 
⁦user⁩  link"
1,"piano vaccini | la preoccupazione dei medici di base | «sui pazienti fragili c'è il rischio di una giungla delle priorità» – l'intervista link"
1,"user ma ancora prima: perché bisogna tradurre? il cts non dovrebbe su questo tema dare una indicazione chiara, che non necessita di traduzione? capisco la decisione politica su chiusure/aperture, ma su quali vaccini dare a chi, se non il cts, chi dovrebbe  dare istruzioni ?"
0,":postal_horn: 
la «categoria 4» finalmente!! (per età - da oggi i 55-59enni con esenzione per malattia cronica - ma prima di riaprire alle normali fasce d'età si faranno tutti i fragili over 60)
now on user
#fragili #vaccini #covid19 #lombardia
link"
2,"cosa non ci hanno detto in italia sui vaccini:face_screaming_in_fear:

 link"
0,"user grande stima matteo.  non cedere di un millimetro davanti ai vaccino-scettici che commentano qui.  la lega è destra moderna, non un movimento oscurantista e becero."
