2,"user user user_it ma guardi che l'hanno chiamato così i gesuiti e oggi un gesuita è papa.
elisabetta i diceva che quando arrivano i gesuiti ci sono pestilenze e carestie...toh.
tra un po' il vaccino.

cmq, lucifer(ci sono anche altri articoli che lo attestano).
link"
2,"user user_s user_ aspettano il vaccino a novembre lo ha già detto. che miserabili umani"
1,"coronavirus, il ‘vaccino-cerotto’ supera i test su animali ma ricciardi frena: pronto non prima di un anno - link link"
2,"user provo ad integrare: non ci sarà mai un vaccino sicuro ed efficace contro il coronavirus.
tuttavia, uno o più vaccini verranno immessi sul mercato."
0,"ne ho conosciuta una che non ha fatto i vaccini al figlio...però dice che gli vorrebbe fare quello per il tetano.....
ma vai a fan culo.....no vax....poveri imbecilli"
2,"user per iniziare minerva, per iniziare... ne hanno tanti da smaltire prima di rendere l'umanità schiava di ogni vaccino. vorrebbero che uccidessimo per averli, ma accadrà il contrario. poi ci sono quei film del 2011 tipo contagion, è così chiaro tutto..."
2,"user_it sua santità, se vuole che ci facciamo il vaccino, basta che lo dica apertamente, senza tutti questi giri di parole... tanto s'è capito da che parte ha scelto di stare!"
0,"il vaccino non  un opinione. internet oggi  terra di nessuno. situazione molto pericolosa se lignoranza si unisce allarroganza user ora al convegno i costi dell #antiscienza  sui danni della disinformazione scientifica, organizzato da user #28novembre link"
2,"user user user user informati..  che la cura  c'è     e non serve il vaccino...  sarà  come  quello dell'influenza  che muta ogni anno....il plasma  non costa niente.. e   con bill gates   e i suoi vaccini   sperimentali  tu  .. lascia stare  gli italiani..chissà dove sei l'anno prossimo"
2,"user manco morta farò un vaccino"
0,"user chi vive insieme, suppongo nn debba più farlo e dunque giovani fuori di casa ;)
poi lui dice che quando il 60-70% avrà preso la malattia, questa sarà ""over"". boh!
vabbè magari nel frattempo uscirà il vaccino..."
1,"vaccino oxford, entro l'estate sapremo se funziona contro il covid link"
2,"coronavirus, “sul vaccino c’è troppo ottimismo’   link"
2,"#vaccino per la varicella causa meningite per la riattivazione del virus in due ragazzi di 14 anni  pu lo stato obbligarmi a un trattamento sanitario che pu causare danni come questi? siamo sicuri che i medici spieghino gli effetti avversi prima?   link"
2,"user user user user user user lei per delucidarci ci ha postato video di fazio. chissa perche tralascia, cosi come lo tralascia burioni, l'elevata mutabilita dei coronavirus che rende pressoche inutile la vaccinazione. gia adesso ve ne sono decine di ceppi.

tralascio affermazioni risibili su farmaci e plasma"
0,"nessuno dice che non ci si debba preoccupare per le persone pi� esposte o non dispiacere per i deceduti, ma ricordate che:   � l�80% delle persone vengono curate facilmente � siamo sempre pi� vicini ad un vaccino � basta seguire le istruzioni che vengono date in maniera calma"
0,"user in cina sono rimasti ""blindati"" circa 2 mesi e ora con estrema cautela iniziano ad uscire...se non abbiamo un vaccino, la trafila e' questa, non ci sono alternative."
1,"coronavirus: anche la russia inizia i test per un vaccino link"
2,"se volete continuare a farvi prendere in giro mentre mettono in pericolo la vita o la salute dei vostri figli fate pure. accomodatevi! io no, grazie! link"
2,"le sentenze dei tribunali per danni da #vaccino  sono in aumento in tutto il mondo.  ma continuano a dirci che i #vaccini sono sicuri e salvano vite.  link"
1,"#coronavirus: partnership moderna - lonza per produrre  fino a 1 miliardo di dosi all'anno di #vaccino link user_tx user"
2,"#testimonianze salve a tutti sono la mamma di diego bimbo di 3 anni e mezzo affetto da autismo da quando il 10 ottobre 2017 all et� di 20 mesi feci fare il #vaccino #mpr (morbillo parotite rosolia)da li ebbe inizio tutto dopo 2 mesi il 24 dicembre 2017 si manifesta il"
0,"user user user esattamente. perché? perché per l'influenza esiste il vaccino. l'età media dei ricoverati è 70 anni, categoria che con l'influenza non va in ti grazie al vaccino. questo sto cercando di chiarire. le categorie non a rischio, anche senza vaccino, quanto devono preoccuparsi?"
0,"user_ansa è interessante leggere tutti i tweet dei no-vax quanto sono arrabbiati, quanto insultano... eppure sono stati tra i primi a barricarsi in casa quando il sono stati confermati i primi casi covid19 in italia. e prima di ricevere insulti, sappiate che l’ho visto di persona."
2,"user la cosa più bella è che, con tutti sti miglioni elargiti ""per beneficienza"", sto merdoso si fa dare dall'altro merdoso itagliano centinaia di miglioni per ""progettare il vaccino"" (quale di tutti, non si sa)... entrambi i merdosi devono andare davanti a un giudice, come minimo."
2,"user user il problema  che  stato approvato per il commercio europeo.  e chi se lo farebbe se prima non c' un'epidemia? link"
2,"user user fallo ai tuoi cari il vaccino traditore della patria. ti auguro di pagare tutto questo al più presto."
1,"user_maggiore si si! ma pure se hai un negozio tuo, fra i documenti devi avere il certificato del vaccino."
2,"user_ansa si infili su per il culo app e vaccino, 'sto usuraio."
0,"coronavirus elisa di francisca: “djokovic no vax? rabbrividisco. il vaccino salva vite” -  #coronavirus #elisa #francisca:  link"
2,"meningite b, il consiglio superiore della sanit belga non raccomanda il vaccino. in italia invece l'iss mette il bollino sulla pubblicit di gsk... link"
2,"le indagini condotte hanno evidenziato una chiara negligenza del personale sanitario: le infermiere  mescolarono al vaccino un miorilassante, un farmaco che rilassa i tutti i muscoli dellorganismo, anzich della semplice soluzione fisiologica. link link"
1,"il dottor mariano amici presenta ricorso al tar contro l`ordinanza di zigaretti: `vaccinazione antinfluenzale obbligatoria senza nessun valido motivo scientifico` link"
2,"user user_cersei user no, c’é roba più grossa in ballo. sparirá magicamente con il vaccino obbligatorio annuale del signorino bill"
0,"user_ user fino al vaccino o comunque una cura seria non ci sarà nessuna piazza purtroppo"
2,"user user user  03 ....vaccinare tanta gente , questo non serve a nulla anzi il vaccino porta tantissimi decessi, avevo conoscenti che per il vaccino sono deceduti! quindi ...(04)"
1,"bill gates finanzia la creazione di un vaccino per il coronavirus link"
0,"user_the_dog user non so sono ignorante, ma allora cosa stiamo aspettando? invece di stare a casa isolati tutti, non è meglio starci mirati? anche per ""non si sa cosa fare con i tracciati"": stanno in quarantena, 4 settimane, durante le quali si testano. o ci stiamo tutti fino al vaccino?"
2,"user ho la speranza che speranza schiatti visto le statistiche sui nuovi vaccini.
ma è troppo codardo per sottoporre se stesso al vaccino"
2,"user trovate la cura il vaccino ve lo fate voi io non faccio da cavia"
0,"user user ne riparliamo quando una grande impresa svilupperà un vaccino. quel vaccino. quello che aspettano tutti."
0,"user user user user l'immunità di gregge si raggiunge con il vaccino. la via ""naturale"" comporta un numero di vittime altissimo, vedi morbillo &amp; co."
2,"user il video è vero. quale sia il vaccino che gli hanno fatto non si sa
però prevedo questo tipo di pericolo, ricercando il piano rockefeller &gt;lock step 2010 &lt;e sentendo gli ideali di bg
non è normale cosa succede per un ""virus""xniente proprio.
stiamo reagendo esattamente dal piano"
0,"user nè dubito, finché non sì trova un vaccino le mascherine saranno d'obbligo, secondo me"
2,"l'agenzia americana offre immunit� legale ai produttori di vaccini contro #ebola.  il nuovo vaccino #ervebo � un vaccino con virus vivo, che rilascia l'rna del virus nel sangue, nella saliva, nelle urine e nei liquidi delle vescicole cutanee degli adulti vaccinati."
2,"user user user user user user user io non l'attacco sul peso (freganiente) ma sul nazismo che lei esprime. #ilpeggiodelpeggio. lei, oltre che frasi idiote ha qualche ricerca che dice che il vaccino ci protegge o è sicurissimo ? sentiamo... io aspetto..."
2,"ci dichiararono guerra,distrussero l’europa e poi ci diedero i soldi per ricostruire rendendoci schiavi.

creano il #covid_19 e infettano il mondo intero per poi creare il vaccino e venderlo a tutto il mondo. 

sono sempre loro! 

gli stati uniti d’america! 
#codvid19italia"
1,"user 4) vaccino in supposte da 500g"
1,"coronavirus, “guerra del vaccino”: la germania difende la sua ricerca dai miliardi offerti da trump #covid2019 #coronavirus #ricerca #vaccino link link"
2,"considerando ke ogni vaccino contiene la quantita' di mercurio,alluminio e formaldeide 100 volte massima consentita,fare il calcolo.lo stesso vale per  i vaccini obbligatori per i bambini.da qui l'autismo,asma,malattie immunitarie e neurodegenerative in seguito.informatevi prima! link"
2,"user user squalene è adiuvante che potenzia il vaccino ma essendo squalene già nel nostro corpo pare che faccia per cosi dire impazzire il sistema immunitario...provocando malattie autoimmuni...a l7ngo termine. i vaccini infatti con squalene sono raccomandati agli over 65"
2,"user non possono user il tempo che stanno prendendo è per valutare in base ai milioni e milioni di euro che ci sono in ballo su a chi avrà diritto al brevetto per poi farci vaccinare obbligatoriamente tutti tra l’altro vaccinare da una cosa che non avrà mai un vaccino"
0,"dove sono tutti i #novax ??ho voglia di insultarli!!!! mi devo sfogare"
0,"user user user_cauc user in un mondo parallelo dove avrei lo scettro del comando, manderei tutti i novax su un’isola con tutti i confort tranne che le medicine, ne uscirebbero solo con un super sistema immunitario o tutti malati"
1,"user_cersei user fedriga ha detto solo tre giorni fa che dal coronavirus se ne esce solo vaccino, non scherzo, ha detto così. ieri abbiamo avuto 24 nuovi casi su una popolazione di un milione duecento mila."
0,"user secondo me anche a settembre non si gioca. basterebbe un positivo per dover fermare tutto il campionato. finché saremo a contagi zero (difficile) o con un vaccino gli sport di squadra non ricominciano, figurarsi poi con il pubblico"
0,"stanno andando veloci come razzi, tutti i gruppi, in tutto il mondo pfizer begins human trials of possible coronavirus vaccine - the new york times link"
0,"invece di investire i soldi nella ricerca di un vaccino si spendono per verificare se il virus ci sta tra i coglioni. ora, non so se il covid sta proprio lì ma questo spreco di denaro di sicuro mi sta sopra i #testicoli"
2,"user__boia asino, rispondi sul merito. il post parla di costi, non di vaccini si oppure no.

allora, emerito ignorante codardo, costa di piu avere un vaccino o una sacca di sangue?

rispondi o la butti in caciara come tutti quelli della tua risma?"
2,"user user credo anche la terza ondata con la decimazione della popolazione il blocco sino a marzo 2021 e con l'avviso che se avrebbero fatto il vacino non ci sarebbero stati tutti questi morti. il vaccino uccide il doppio della museruola"
0,"user temo che finché non arriverà il vaccino bisognerà capire come convivere con questo rognosissimo virus"
1,"coletto, ateneo ha competenze per vaccino - umbria - link link"
0,"user vaccino truffa.. questa deve esse una seguace di quel genio di fusaro! ahahah cosa non si fa per un po’ di notorietà e per vende du libracci..."
2,"user__marti uno dei principali medici inglesi, tesi sostenuta anche dal governo uk, ha detto che chi ha fatto il vaccino rischia molto di più"
1,"user user user user user user a basso costo e libera? che cazzo vuol dire? prelievi e trattamenti del siero chi li fa? babbo natale? vuoi obbligare le persone a cavarsi litri di sangue per ""curare"" gente che continua ad ammalarsi perché, appunto, non c'è ancora un vaccino?"
2,"user user sono mesi che medici seri dicono che il vaccino non serve perché non funzionerebbe!

però mass media e politici continuano a dire che lo aspettano!
posso immaginare perché."
0,"user aiuto che spettacolo! speriamo solo nel vaccino"
0,"j&amp;j accelera su #vaccino, anticipati a luglio studi sull'uomo link link"
1,"‘world against covid 19’ lanciato piano cooperazione globale per vaccino link"
0,"user mi chiedevo dove trovasse la forza di stare su twitter e combattere i geni novax. alla fine si cede. in bocca al lupo!"
2,"user user ancora insistete si questa strada? capisco la scienza, prima di oggi ci sono voluti anni per un vaccino, poi il test ed il codice etico, ora in 3 mesi lo vogliamo pronto ed efficace, mentre dopo 30 anni ancora non c'è quello contro l'hiv"
0,"#coronavirus, ecco i due farmaci che fanno sperare i contagiati ma la missione è il vaccino 
link"
2,"user 70 vaccini in ballo
olimpiadi del vaccino
se era cosi facile fare un vaccino per coronavirus e simili
il vaccino sars1 mers ebola dove sono
li provate prima su di voi eroici scienziati non vorrei mai che nella corsa frenetica sbagliaste qualcosa invece dei topi le cavie siamo noi"
0,"user user user da casa mia a casa mia con la mia macchina? chi potrei mettere a rischio? e comunque secondo il suo ragionamento, fino al vaccino(un anno)nessuno dovrebbe mettere un piede fuori dalla propria abitazione?"
1,"“vaccino obbligatorio per over 65 anni”così zingaretti. sei d'accordo? forum link"
2,"i danneggiati da vaccino esistono, famiglie e bambini distrutti dal dolore. #libertdiscelta link"
0,"user__ci cerco di capirlo ma non posso immaginarlo... se si arriva così a giugno si. rischia di avere le carceri piene.. molta gente avrà bisogno di cibo e parecchi di ricoveri coatti.... purtroppo non c'è soluzione non si capisce quale sia il male minore....vaccino salvaci tu"
0,"user user user user user ahahahahahahahahaha essere novax ai tempi del covid"
2,"user user una vaccinazione adesso sarebbe il colpo di grazia"
0,"user user user_hopppe1 pro-vax non la considero un'offesa. nel merito: ""sono troppo di parte"" non mi pare però sufficiente. l'affermazione sulla contagiosità di una persona a cui è stato somministrato il vaccino non è difficile da provare o smentire, non sono parlando dell'origine dell'universo."
1,"ranieri guerra (oms): ""vaccino? se va bene entro il primo trimestre del 2021"" link"
0,"user user user quindi il video che“non vogliono farci vedere“é disponibile sulla piattaforma streaming più famosa al mondo?
e’ tutto così segreto che anche il fruttivendolo al mercato ne parla.non fate il vaccino, così bigpharma può vendervi le medicine per curarvi: eccovi servito il complotto!"
2,"user rassista, fassista, nazista, a voi interessa la tutela della salute pubblica o le lobby del vaccino? mi sa che è la seconda opzione."
0,"user in attesa del vaccino,x non bloccare l'economia,nelle zone rosse italiane ,dove si presume ci siano molti immuni,servono test sierologici e tamponi al ritmo di  1-2milioni al giorno,altrimenti le aziende restano bloccate x troppo tempo.tutti i laboratori italiani devono attivarsi"
1,"user_grillo a meno che non pensavate di impossessarvi del  brevetto e avere il monopolio sul vaccino, mi sembra ovvio che venga distribuito nrl mondo. anche oggi abbiamo avuto la dose di c****ta non richiesta."
0,"complotto numero 229 link #coronavirus #novax #satira #complotti"
0,"user_pecchia user bisogna leggere cosa scrive l'oms ed anche l'imperial college di londra. la pandemia non sarà  di breve durata, potrebbe durare anni, fino a che sia disponibile un vaccino in quantità  adeguate, con periodi di rallentamento e ricadute successive. 
#coronavirus"
2,"user il virus collezione 2019/20 veniva descritto ad ottobre (⬇️) come un virus molto aggressivo e contagioso. 
stesse caratteristiche del covid. 
vaccino consigliato a tutti! 
ma se il covid era solo la nuova influenza allora cosa è successo esattamente a bergamo? link"
2,"user user user io vivo normalmente senza il vaccino, mi disturba che vogliono costringermi a vaccinarmi, solo business,troppi interessi,poca sperimentazione,troppa fretta,troppo denaro"
1,"il futuro secondo il virologo andrea crisanti (il vaccino non è certo) link"
2,"#vaccini:  muore ""suicidata"" con ben due colpi alla testa per aver rivelato le stoure dei programmi di #vaccinazione.  si  sparata, poi  risoa per spararsi di nuovo. ????  #trumanshow   i vaccini uccidono. link"
1,"state sereni il #vaccino non si fara' prima di 2 anni"
0,"user io faccio il vaccino dal 2001.
nel 2000 avevo avuto un’influenza terribile che non passava mai.
ma nessuno ricorda l’asiatica del 1957?"
2,"e anche questanno il #vaccino antinfluenzale non  servito a niente visto che sono molto pi diffusi i virus parainfluenzali   complimenti alle regioni che continuano a buttare soldi per effettuare la campagna di vaccinazione ogni anno  #lascienza  link link"
0,"da parte di roberto #burioni, nell'allievo la speranza di un vaccino in tempi brevi: ""potremmo avere novità"" #coronavirusitalia #chetempochefa  link link"
2,"prof. tarro: chi propone il vaccino contro il covid 19 andrebbe messo in galera (video) link"
2,"fretta di trovare test sierologici.
fretta di trovare farmaci.
fretta di trovare un vaccino.

io spero che la fretta non si riveli un boomerang."
2,"???? che strana cosa, anche quest'anno sembra che ai medici faccia pi paura il #vaccino che l'influenza. ???? link"
0,"la gente ancora non capisce
l'importanza di stare a casa
finché non ci sarà un vaccino
la vita di prima è impossibile"
0,"ricerca alzheimer: vaccino efficace nelle cavie. entro due anni sperimentazione umana link"
2,"inizia tu a fare il vaccino.. barbara #noneladurso...io non lo faccio."
0,"ma i #novax, dove cazzo sono spariti?"
2,"user ultima ora! #aifa vieta le cure! la pandemia deve continuare per arrivare al #vaccino!!! fermate questi criminali! commissariate aifa! non bastano 33.000 vittime! #covid #coronavirus  link"
1,"coronavirus, l'ultima di trump: il vaccino in esclusiva agli usa in cambio di soldi link via user"
1,"«per il personale sanitario vaccino dal prossimo autunno» link"
1,"caos trump, chiede blocco del libro di bolton: poi lancia il vaccino link"
2,"i medici indiani danno la colpa a gates per una devastante epidemia di poliomielite da vaccino che ha paralizzato 496.000 bambini tra il 2000 e il 2017. nel 2017, il governo indiano ha richiamato il regime vaccinale di gates e sfrattato gates.
link"
1,"user_2018 user ,cosa bisogna combattere di preciso?la cura c'è!non c'è la prevenzione(il vaccino),ma la cura c'è! quindi,di preciso,cosa bisogna""combattere""?una malattia che fa meno morti di un influenza o dei suicidi(da inizio anno ad oggi 430mila suicidi!)?"
1,"coronavirus,  il vaccino di oxford che arriverà anche in italia: ecco come funziona link"
0,"user ma i no-vax sono ottusi e tendenzialmente sovversivi..."
1,"@_sazed se ne è parlato da subito perché quel vaccino ha effetti immunostimolanti. è già stato utilizzato in contesti diversi, come il cancro della vescica.
al momento l'oms non lo raccomanda perché non ci sono dati chiari.
link"
2,"user non esistono vaccino sicuri neanche per virus molto più datati ...non esistono cure per un sacco di malattie con cui la gente deve convivere .... arrabbiata perché sanità e ricerca dovrebbero essere una priorità qua la priorità è solo questo vaccino covid come non pensare male .."
1,"sanità: si lavora su risorse, app immuni e vaccino link"
2,"user fattelo tu il vaccino per un virus clinicamente sparito. io al massimo mi vaccino per sopportare gli ipocriti e incapaci come te. la costituzione tutela la libertà nessun obbligo al massimo una raccomandazione."
0,"facciamo una cosa: se esce il vaccino per il #coronavirus, noi sorosiani, ordoliberisti, complici della big pharma e gretini lo facciamo.  voi furbacchioni ""iononcicasco"", invece, vi curate con acqua, limone, spremuta di cetriolo e coronaparty.  ci state? qua la mano!"
0,"anche voi quando partono i complotti sulle nanotecnologie attivabili in seguito al vaccino antikovid!!!# iniziate a grattarvi il cuoio capelluto come giucas link"
2,"per chi ancora non l'avesse capito.  l'obiettivo delle case farmaceutiche  quello di entrare nel mercato delle persone sane.  le persone sane sono tutti gli abitanti della terra, 7 miliardi di potenziali clienti, le persone malate solo una microscopica percentuale di essi. link"
2,"user bravoooooo, oggi ho lanciato questa domanda, verso piu' persone. potrebbe essere una svista nel vaccino iniettato ?"
0,"user andrea i terrapiattisti base grillina. assieme a no vax e soprattutto cospirazionisti alla x-files.... praticamente fuori dal mondo."
1,"vaccino coronavirus, primi test sull`uomo in gran bretagna, partner azienda di pomezia. ai volontari 700 euro link"
0,"user a me sembra che nessuno si sia soffermato su ""questa estate"". é una critica a chi non vede l ora di tornare in un luogo chiuso pieno di gente quando sará proprio la prima cosa da evitare fino all arrivo del vaccino. non penso ce l' avesse con il charlie e con chi lo frequenta."
1,"justin ha donato oltre 3milioni di dollari per trovare un vaccino per il coronavirus, ha amici nell'industria kpop e si sta tenendo in contatto con loro per ricevere notizie in tempo reale. mi sembra strano che hailey bieber sia così mal informata, in ogni caso state esagerando"
0,"user dalla seconda guerra mondiale. certo la situazione è tragica basti pensare a tutte le persone che hanno perso il lavoro, e no, non ci andremo a mare questa estate anche se ci faranno uscire e i concerti solo dopo il vaccino. si è grave ma non potevamo fare diversamente."
1,"coronavirus: il vaccino arriverà, la seconda ondata no. ecco la sentenza di ilaria capua &amp;raquo; link link"
1,"dicono che il corona calerà di vittime verso il venti aprile (mio compleanno) ma il vaccino è ancora lontano"
0,"farmaci e vaccino contro il covid-19 per tutti link #ilmanifesto di user"
0,"user user user ma che vuol dire ""con grande piacere""? 
se gli usa lo trovassero prima, come è molto probabile, sarebbe una delusione? 
è un vaccino, dovremmo ""tifare"" per chiunque, mica è sport."
0,"user_biagetti user la soluzione c’è sempre stata.
soppressione dell’epidemia.
adottata da sempre.
caccia agli infetti, rinchiuderli nei lazzaretti, se peggiorano in ospedali dedicati.
testare, rintracciare, testare, isolare, quarantenare, curare.
fino alla scomparsa del patogeno o al vaccino."
0,"a questo punto cederei la parola a quei geni dei no vax."
1,"user #allespertochiedo e' vero che si consiglia agli anziani vaccino contro il pneumococco come protezione daeventuali infezioni polmonari conseguenti a coronavirus? grazie"
2,"post vaccino: disturbi di apprendimento, epilessia. i medici sapevano ma non dissero nulla alla madre. a voi giudicare. #vaccini link"
2," user: *se* c' volont e intelligenza, si pu fare. link"
1,"user user user il vaccino esiste, dovevi dire che non è disponibile essendo in sperimentazione"
2,"altra mamma. altra testimonianza. vaccino meningococco b. prognosi sindrome di kawasaki. era nel bugiardino come effetto avverso. i medici riconoscono il legame ma non lo mettono per iscritto. #vaccini link"
0,"user se qualche no vax o qualche suo parente di ammala di patologie per le quali poteva proteggersi , si curi pure privatamente ma non con il ssn"
1,"la produzione dei vaccini ha tempi lunghi di produzione e consegna: è strategica una programmazione stabilita con largo anticipo. sanofi produrrà il 20% di vaccino antinfluenzale in più, ma la domanda globale potrà superare l'offerta link #buongiorno #16giugno link"
0,"user_the_teacher stiamo dicendo la stessa cosa, con una piccola differenza, per l'influenza stagionale esiste un vaccino e le persone più fragili dovrebbero averlo fatto. per il coronavirus no"
2,"#dovesonofinitiisivax  appello a tutti i #buriones  ok  il vostro momento, fatevi avanti. ????  un istituto di ricerca di seattle sar il primo nel paese a ospitare studi clinici per testare il vaccino contro il coronavirus su 45 persone. link"
0,"coronavirus, l'influenza 2016 causò 25 mila morti. pregliasco: «ecco perché il vaccino per il covid sarà fondamentale» link link"
0,"pensavo che quei dementi dei #novax fossero spariti ed invece eccoli spuntare come funghi alla notizia di #djokovic link"
2,"di maio ed il pubblidirezionale pro-vax (di debora billi) link"
0,"user fino al vaccino sicuramente"
1,"aspettare che passi. c’è chi invoca la pioggia. chi spera nel vento del nord. chi nel  vaccino  o nella provvidenza. mentre facebook elargisce lauree in medicina e i media fanno audience con la paura.  #milano e il #coronavirus visti da oreste pivetta
link link"
2,"i #vaccini non sono associati alla sclerosi multipla e non provocano ricadute. falso! la sclerosi multipla pu essere causata da #vaccino difettoso.  qui la sentenza: corte di giustizia europea - sez. ii - causa c-621-15, 21-6-2017 link"
1,"user quest'anno sono stati segnalati oltre 3 milioni di casi di influenza stagionale in più rispetto alla scorsa stagione, mi sembra un'enormità viste le campagne di vaccinazione: ci potrebbe essere in questo dato una gran parte di casi di coronavirus non diagnosticati?"
2,"#coronavirus #coronavirusitalia #coronavirustruth #covid19 #covid19italia #pandemia #iorestoacasa pag9 ľ uomo è solo bugiardo e imbroglione! mi rivolgo anche ai miliardari che con tutti i loro soldi pensano di finanziare un ipotetico vaccino se lo possono scordare xké per.. pag10"
0,"user user user esattamente come i novax e i noeuro. quasi sempre chi è “no” di uno lo è anche degli altri due..sono fatti con lo stampino"
